Learner SignUp DateTime,Opportunity Id,Opportunity Name,Opportunity Category,Opportunity End Date,Date of Birth,Gender,Country,Institution Name,Current/Intended Major,Entry created at,Status Description,Status Code,Apply Date,Opportunity Start Date,learner_surrogate_id,status_rank,Major_Bucket,signup_to_apply_days,apply_to_start_days,opportunity_duration_days,learner_age_at_signup,churn,lifecycle_status
2/20/2023 18:36,00000000-10WC-BS50-CYGD-X97ES4,CPR/AED Certification,Course,6/30/2024 16:18,3/22/1990,Male,United States,saint louis university,Public Health,3/11/2024 12:02,Started,1080,3/14/2023 18:31,3/20/2023 2:30,1990-03-22_Male_United States,3,Other,21,5,468,32,0,Retained
6/8/2023 21:43,00000000-0GN2-A0AY-7XK8-C5FZPP,Career Essentials: Getting Started with Your Professional Journey,Course,6/29/2024 18:52,8/7/1998,Male,United States,Saint Louis University,Supply Chain Management,3/11/2024 12:01,Started,1080,,11/3/2022 18:30,1998-08-07_Male_United States,3,Business,,,604,24,0,Retained
2/18/2023 17:23,00000000-10WC-BS50-CYGD-X97ES4,CPR/AED Certification,Course,6/30/2024 16:18,4/26/2005,Male,India,St Aloysius PU College Mangalore,Psychology,3/11/2024 12:02,Started,1080,3/15/2023 6:26,3/20/2023 2:30,2005-04-26_Male_India,3,Other,24,4,468,17,0,Retained
,00000000-0GN2-A0AY-7XK8-C5FZPP,Career Essentials: Getting Started with Your Professional Journey,Course,6/29/2024 18:52,1/27/2003,Female,India,Adamas University,Business Administration,3/11/2024 12:01,Started,1080,,11/3/2022 18:30,2003-01-27_Female_India,3,Business,,,604,,0,Retained
,00000000-0GN2-A0AY-7XK8-C5FZPP,Career Essentials: Getting Started with Your Professional Journey,Course,6/29/2024 18:52,7/16/2000,Female,Nigeria,The Apostolic Secondary Grammar School Ugep,Law and Legal Studies,3/11/2024 12:01,Started,1080,,11/3/2022 18:30,2000-07-16_Female_Nigeria,3,Other,,,604,,0,Retained
1/5/2023 18:56,00000000-10WC-BS50-CYGD-X97ES4,CPR/AED Certification,Course,6/30/2024 16:18,12/29/2009,Female,Afghanistan,GNDU,Otheraassss,3/11/2024 12:02,Started,1080,3/13/2023 11:50,3/20/2023 2:30,2009-12-29_Female_Afghanistan,3,Other,66,6,468,13,0,Retained
,00000000-0GN2-A0AY-7XK8-C5FZPP,Career Essentials: Getting Started with Your Professional Journey,Course,6/29/2024 18:52,10/27/2007,Male,India,T.N.B. College,Physics and Astronomy,3/11/2024 12:01,Started,1080,,11/3/2022 18:30,2007-10-27_Male_India,3,Other,,,604,,0,Retained
3/18/2023 20:40,00000000-10WC-BS50-CYGD-X97ES4,CPR/AED Certification,Course,6/30/2024 16:18,8/10/2002,Male,Pakistan,National University of Modern Languages Islamabad  Pakistan,Data Science and Artificial Intelligence,3/11/2024 12:02,Started,1080,3/18/2023 21:52,3/20/2023 2:30,2002-08-10_Male_Pakistan,3,Other,0,1,468,20,0,Retained
6/16/2023 5:48,00000000-10WC-BS50-CYGD-X97ES4,CPR/AED Certification,Course,6/30/2024 16:18,5/16/1995,Male,India,pt DDU university of CG under maitri college of dentistry and research center,Public Health,3/11/2024 12:02,Started,1080,,3/20/2023 2:30,1995-05-16_Male_India,3,Other,,,468,28,0,Retained
,00000000-10WC-BS50-CYGD-X97ES4,CPR/AED Certification,Course,6/30/2024 16:18,7/16/2000,Female,Nigeria,The Apostolic Secondary Grammar School Ugep,Law and Legal Studies,3/11/2024 12:02,Started,1080,,3/20/2023 2:30,2000-07-16_Female_Nigeria,3,Other,,,468,,0,Retained
,00000000-0GN2-A0AY-7XK8-C5FZPP,Career Essentials: Getting Started with Your Professional Journey,Course,6/29/2024 18:52,7/23/2004,Female,India,Ambedkar DSEU Shakarpur Campus-1,Computer Science,3/11/2024 12:01,Started,1080,,11/3/2022 18:30,2004-07-23_Female_India,3,CS / IT,,,604,,0,Retained
,00000000-0GN2-A0AY-7XK8-C5FZPP,Career Essentials: Getting Started with Your Professional Journey,Course,6/29/2024 18:52,8/11/2000,Male,India,Saint louis University,Software Engineering,3/11/2024 12:01,Started,1080,,11/3/2022 18:30,2000-08-11_Male_India,3,CS / IT,,,604,,0,Retained
6/20/2023 2:57,00000000-10WC-BS50-CYGD-X97ES4,CPR/AED Certification,Course,6/30/2024 16:18,6/18/2008,Male,United States,Brentwood High School,Medicine,3/11/2024 12:02,Started,1080,,3/20/2023 2:30,2008-06-18_Male_United States,3,Other,,,468,15,0,Retained
,00000000-0GN2-A0AY-7XK8-C5FZPP,Career Essentials: Getting Started with Your Professional Journey,Course,6/29/2024 18:52,12/11/1997,Male,Sri Lanka,University of Colombo,Electrical and Electronic Engineering,3/11/2024 12:01,Started,1080,,11/3/2022 18:30,1997-12-11_Male_Sri Lanka,3,Engineering,,,604,,0,Retained
3/12/2023 10:37,00000000-10WC-BS50-CYGD-X97ES4,CPR/AED Certification,Course,6/30/2024 16:18,3/15/2003,Male,Pakistan,IBA  SUKKUR,Business Administration,3/11/2024 12:02,Started,1080,,3/20/2023 2:30,2003-03-15_Male_Pakistan,3,Business,,,468,20,0,Retained
3/26/2023 23:46,00000000-10WC-BS50-CYGD-X97ES4,CPR/AED Certification,Course,6/30/2024 16:18,1/21/2000,Female,Turkey,Üsküdar University,Chemical Engineering,3/11/2024 12:02,Started,1080,,3/20/2023 2:30,2000-01-21_Female_Turkey,3,Engineering,,,468,23,0,Retained
4/9/2023 20:35,00000000-0GN2-A0AY-7XK8-C5FZPP,Career Essentials: Getting Started with Your Professional Journey,Course,6/29/2024 18:52,1/27/2002,Male,United States,Illinois Institute of Technology,Computer Science,3/11/2024 12:01,Started,1080,,11/3/2022 18:30,2002-01-27_Male_United States,3,CS / IT,,,604,21,0,Retained
3/24/2023 23:56,00000000-0GN2-A0AY-7XK8-C5FZPP,Career Essentials: Getting Started with Your Professional Journey,Course,6/29/2024 18:52,12/12/1999,Female,Pakistan,Govt graduate science college Multan,Statistics,3/11/2024 12:01,Started,1080,,11/3/2022 18:30,1999-12-12_Female_Pakistan,3,Other,,,604,23,0,Retained
,00000000-0GRA-BD28-CXVV-EYEX21,Health Care Management,Internship,,2/4/1982,Female,United States,saint louis,Public Health,3/11/2024 12:02,Team Allocated,1070,9/9/2023 14:17,1/8/2024 3:30,1982-02-04_Female_United States,2,Other,,120,,,1,Churned
,00000000-0GRA-BD28-CXVV-EYEX21,Health Care Management,Internship,,9/24/2001,Male,United States,Saint Louis University,Bioinformatics,3/11/2024 12:02,Team Allocated,1070,,1/8/2024 3:30,2001-09-24_Male_United States,2,Other,,,,,1,Churned
,00000000-0GNT-FT74-MZT8-93VC0G,Digital Marketing,Internship,3/11/2024 18:00,11/25/1996,Male,India,Kingston engineering college,Mechanical Engineering,3/11/2024 12:02,Team Allocated,1070,8/5/2023 1:00,1/8/2024 3:30,1996-11-25_Male_India,2,Engineering,,156,63,,1,Churned
,00000000-0GRA-BD28-CXVV-EYEX21,Health Care Management,Internship,,1/1/1999,Female,United States,saint louis university,Public Health,3/11/2024 12:02,Team Allocated,1070,8/20/2023 4:53,1/8/2024 3:30,1999-01-01_Female_United States,2,Other,,140,,,1,Churned
,00000000-0GRA-BD28-CXVV-EYEX21,Health Care Management,Internship,,11/15/1999,Female,United States,Saint Louis University,Information Systems,3/11/2024 12:02,Team Allocated,1070,8/10/2023 1:18,1/8/2024 3:30,1999-11-15_Female_United States,2,Other,,151,,,1,Churned
,00000000-0GRA-BD28-CXVV-EYEX21,Health Care Management,Internship,,1/17/2001,Male,United States,Saint Louis University,Information Systems,3/11/2024 12:02,Team Allocated,1070,8/10/2023 1:05,1/8/2024 3:30,2001-01-17_Male_United States,2,Other,,151,,,1,Churned
,00000000-0GRA-BD28-CXVV-EYEX21,Health Care Management,Internship,,12/28/2000,Female,United States,saint louis university,Health Data Science,3/11/2024 12:02,Team Allocated,1070,,1/8/2024 3:30,2000-12-28_Female_United States,2,Other,,,,,1,Churned
,00000000-106T-FSAJ-KDBX-40ZGNV,UrbanRenew Challenge,Competition,4/29/2024 18:29,2/4/1982,Female,United States,saint louis,Public Health,3/11/2024 12:03,Team Allocated,1070,2/5/2024 5:30,3/21/2024 18:30,1982-02-04_Female_United States,2,Other,,45,38,,1,Churned
,00000000-0GRA-BD28-CXVV-EYEX21,Health Care Management,Internship,,3/26/1999,Male,United States,Saint Louis University,Information Systems,3/11/2024 12:02,Team Allocated,1070,12/4/2023 12:57,1/8/2024 3:30,1999-03-26_Male_United States,2,Other,,34,,,1,Churned
,00000000-0GRA-BD28-CXVV-EYEX21,Health Care Management,Internship,,7/11/1998,Female,United States,Avila university,Business Analytics,3/11/2024 12:02,Team Allocated,1070,12/31/2023 21:35,1/8/2024 3:30,1998-07-11_Female_United States,2,Business,,7,,,1,Churned
,00000000-10QW-PYTT-CJCX-7VQBTT,Join a Student Organisation,Engagement,12/5/2025 12:59,7/11/1998,Female,United States,Avila university,Business Analytics,3/11/2024 12:02,Team Allocated,1070,,8/21/2023 6:30,1998-07-11_Female_United States,2,Business,,,837,,1,Churned
,00000000-106T-FSAJ-KDBX-40ZGNV,UrbanRenew Challenge,Competition,4/29/2024 18:29,11/20/1997,Female,United States,Saint Louis university,Data Analytics,3/11/2024 12:03,Team Allocated,1070,1/24/2024 20:35,3/21/2024 18:30,1997-11-20_Female_United States,2,Other,,56,38,,1,Churned
,00000000-0GWQ-AXC5-X45C-2MHJ28,Data Visualization,Internship,3/11/2024 18:00,3/2/1999,Male,Nigeria,Dahel Teachies,Data Analytics,3/11/2024 12:02,Team Allocated,1070,8/5/2023 21:19,1/8/2024 3:30,1999-03-02_Male_Nigeria,2,Other,,155,63,,1,Churned
,00000000-0GN2-A0AY-7XK8-C5FZPP,Career Essentials: Getting Started with Your Professional Journey,Course,6/29/2024 18:52,3/21/2005,Female,United States,Saint Louis University,Art and Design,3/11/2024 12:01,Team Allocated,1070,,11/3/2022 18:30,2005-03-21_Female_United States,2,Other,,,604,,1,Churned
2/29/2024 16:17,00000000-106T-FSAJ-KDBX-40ZGNV,UrbanRenew Challenge,Competition,4/29/2024 18:29,11/21/1996,Male,India,Saint Louis University,Information Systems,3/11/2024 12:03,Team Allocated,1070,3/2/2024 4:57,3/21/2024 18:30,1996-11-21_Male_India,2,Other,1,19,38,27,1,Churned
,00000000-0GN2-A0AY-7XK8-C5FZPP,Career Essentials: Getting Started with Your Professional Journey,Course,6/29/2024 18:52,1/29/2005,Female,United States,Saint Louis University,Politics,3/11/2024 12:01,Team Allocated,1070,,11/3/2022 18:30,2005-01-29_Female_United States,2,CS / IT,,,604,,1,Churned
,00000000-106T-FSAJ-KDBX-40ZGNV,UrbanRenew Challenge,Competition,4/29/2024 18:29,8/18/2000,Female,United States,Saint Louis University,Computer Science,3/11/2024 12:03,Team Allocated,1070,3/8/2024 2:10,3/21/2024 18:30,2000-08-18_Female_United States,2,CS / IT,,13,38,,1,Churned
,00000000-10RQ-JXA9-NNKD-EW5RCF,UX Redesign Challenge,Competition,4/19/2024 18:29,10/2/2002,Female,United States,Webster University,Cyber Security,3/11/2024 12:03,Team Allocated,1070,2/9/2024 17:03,2/15/2024 18:30,2002-10-02_Female_United States,2,CS / IT,,6,63,,1,Churned
,00000000-0GN2-A0AY-7XK8-C5FZPP,Career Essentials: Getting Started with Your Professional Journey,Course,6/29/2024 18:52,10/5/1998,Male,Ghana,Saint Louis University,Computer Science,3/11/2024 12:01,Team Allocated,1070,,11/3/2022 18:30,1998-10-05_Male_Ghana,2,CS / IT,,,604,,1,Churned
3/9/2024 19:44,00000000-106T-FSAJ-KDBX-40ZGNV,UrbanRenew Challenge,Competition,4/29/2024 18:29,1/13/1999,Male,Bangladesh,Saint Louis University,Information Systems,3/11/2024 12:03,Team Allocated,1070,3/9/2024 21:03,3/21/2024 18:30,1999-01-13_Male_Bangladesh,2,Other,0,11,38,25,1,Churned
3/5/2024 5:55,00000000-100J-PM3A-0WJ8-5T68M5,Jump Start: Developing your Emotional Intelligence,Course,12/24/2025 3:34,8/20/1986,Female,United States,Saint Louis Univeristy,Information Systems,3/11/2024 12:03,Team Allocated,1070,,1/28/2024 23:30,1986-08-20_Female_United States,2,Other,,,695,37,1,Churned
3/1/2024 23:46,00000000-106T-FSAJ-KDBX-40ZGNV,UrbanRenew Challenge,Competition,4/29/2024 18:29,5/1/2000,Male,United States,Saint Louis university,Computer Science,3/11/2024 12:03,Team Allocated,1070,3/8/2024 1:57,3/21/2024 18:30,2000-05-01_Male_United States,2,CS / IT,6,13,38,23,1,Churned
2/28/2024 11:54,00000000-106T-FSAJ-KDBX-40ZGNV,UrbanRenew Challenge,Competition,4/29/2024 18:29,2/22/1997,Female,Nepal,Nepal Law Campus,Law and Legal Studies,3/11/2024 12:03,Team Allocated,1070,2/29/2024 7:02,3/21/2024 18:30,1997-02-22_Female_Nepal,2,Other,0,21,38,27,1,Churned
2/29/2024 14:31,00000000-100J-PM3A-0WJ8-5T68M5,Jump Start: Developing your Emotional Intelligence,Course,12/24/2025 3:34,10/17/2006,Female,Philippines,Assumpta Technical High School,Accountancy,3/11/2024 12:03,Team Allocated,1070,,1/28/2024 23:30,2006-10-17_Female_Philippines,2,Other,,,695,17,1,Churned
2/29/2024 4:30,00000000-106T-FSAJ-KDBX-40ZGNV,UrbanRenew Challenge,Competition,4/29/2024 18:29,4/1/1995,Male,India,Bhavans vivekananda college,Mass Communication,3/11/2024 12:03,Team Allocated,1070,2/29/2024 4:41,3/21/2024 18:30,1995-04-01_Male_India,2,Other,0,21,38,28,1,Churned
2/28/2024 22:53,00000000-106T-FSAJ-KDBX-40ZGNV,UrbanRenew Challenge,Competition,4/29/2024 18:29,5/22/2004,Male,Ghana,Accra Technical University,Electrical Engineering,3/11/2024 12:03,Team Allocated,1070,2/29/2024 13:32,3/21/2024 18:30,2004-05-22_Male_Ghana,2,Engineering,0,21,38,19,1,Churned
2/28/2024 18:19,00000000-106T-FSAJ-KDBX-40ZGNV,UrbanRenew Challenge,Competition,4/29/2024 18:29,3/8/2001,Male,United States,Saint louis university,Business Analytics,3/11/2024 12:03,Team Allocated,1070,2/28/2024 18:48,3/21/2024 18:30,2001-03-08_Male_United States,2,Business,0,21,38,22,1,Churned
2/13/2024 16:21,00000000-10RQ-JXA9-NNKD-EW5RCF,UX Redesign Challenge,Competition,4/19/2024 18:29,8/9/1998,Female,United States,saint louis university,Information Systems,3/11/2024 12:03,Team Allocated,1070,2/13/2024 16:26,2/15/2024 18:30,1998-08-09_Female_United States,2,Other,0,2,63,25,1,Churned
,00000000-10RQ-JXA9-NNKD-EW5RCF,UX Redesign Challenge,Competition,4/19/2024 18:29,11/20/1997,Female,United States,Saint Louis university,Data Analytics,3/11/2024 12:03,Team Allocated,1070,1/24/2024 20:35,2/15/2024 18:30,1997-11-20_Female_United States,2,Other,,21,63,,1,Churned
2/14/2024 19:55,00000000-106T-FSAJ-KDBX-40ZGNV,UrbanRenew Challenge,Competition,4/29/2024 18:29,10/16/1990,Male,Ghana,Saint Louis University,Applied Financial Economics,3/11/2024 12:03,Team Allocated,1070,,3/21/2024 18:30,1990-10-16_Male_Ghana,2,Other,,,38,33,1,Churned
2/28/2024 9:59,00000000-106T-FSAJ-KDBX-40ZGNV,UrbanRenew Challenge,Competition,4/29/2024 18:29,1/6/2004,Male,Ghana,Teshie PRESBYTERIAN Senior High school,Business and Management Studies,3/11/2024 12:03,Team Allocated,1070,2/28/2024 14:53,3/21/2024 18:30,2004-01-06_Male_Ghana,2,Business,0,22,38,20,1,Churned
2/19/2024 23:01,00000000-106T-FSAJ-KDBX-40ZGNV,UrbanRenew Challenge,Competition,4/29/2024 18:29,11/25/2005,Female,Kenya,Graduated from high school,Computer Science,3/11/2024 12:03,Team Allocated,1070,2/19/2024 23:14,3/21/2024 18:30,2005-11-25_Female_Kenya,2,CS / IT,0,30,38,18,1,Churned
2/23/2024 17:13,00000000-106T-FSAJ-KDBX-40ZGNV,UrbanRenew Challenge,Competition,4/29/2024 18:29,4/18/2000,Male,United States,saint louis university,Information Science,3/11/2024 12:03,Team Allocated,1070,2/24/2024 16:23,3/21/2024 18:30,2000-04-18_Male_United States,2,Other,0,26,38,23,1,Churned
2/23/2024 5:36,00000000-106T-FSAJ-KDBX-40ZGNV,UrbanRenew Challenge,Competition,4/29/2024 18:29,4/21/2001,Male,United States,Saint Louis University,Computer Science,3/11/2024 12:03,Team Allocated,1070,2/23/2024 5:47,3/21/2024 18:30,2001-04-21_Male_United States,2,CS / IT,0,27,38,22,1,Churned
2/23/2024 4:07,00000000-106T-FSAJ-KDBX-40ZGNV,UrbanRenew Challenge,Competition,4/29/2024 18:29,4/4/2000,Female,India,St. Teresa's College,Psychology,3/11/2024 12:03,Team Allocated,1070,2/23/2024 4:37,3/21/2024 18:30,2000-04-04_Female_India,2,Other,0,27,38,23,1,Churned
2/23/2024 3:12,00000000-106T-FSAJ-KDBX-40ZGNV,UrbanRenew Challenge,Competition,4/29/2024 18:29,9/25/2002,Female,India,Kadi Sarva Vishwavidyalaya,Computer Engineering,3/11/2024 12:03,Team Allocated,1070,2/23/2024 3:39,3/21/2024 18:30,2002-09-25_Female_India,2,CS / IT,0,27,38,21,1,Churned
2/22/2024 23:14,00000000-106T-FSAJ-KDBX-40ZGNV,UrbanRenew Challenge,Competition,4/29/2024 18:29,9/18/1996,Male,Ghana,University of Education   Winneba,Music,3/11/2024 12:03,Team Allocated,1070,2/23/2024 17:41,3/21/2024 18:30,1996-09-18_Male_Ghana,2,Other,0,27,38,27,1,Churned
2/22/2024 13:58,00000000-106T-FSAJ-KDBX-40ZGNV,UrbanRenew Challenge,Competition,4/29/2024 18:29,11/7/2000,Female,Rwanda,Mount Kenya university,Management,3/11/2024 12:03,Team Allocated,1070,2/29/2024 12:36,3/21/2024 18:30,2000-11-07_Female_Rwanda,2,Business,6,21,38,23,1,Churned
2/21/2024 21:50,00000000-106T-FSAJ-KDBX-40ZGNV,UrbanRenew Challenge,Competition,4/29/2024 18:29,10/25/1994,Male,United States,St Louis University,Geoinformatics and Geospatial Analytics,3/11/2024 12:03,Team Allocated,1070,2/25/2024 13:28,3/21/2024 18:30,1994-10-25_Male_United States,2,Other,3,25,38,29,1,Churned
2/21/2024 14:37,00000000-106T-FSAJ-KDBX-40ZGNV,UrbanRenew Challenge,Competition,4/29/2024 18:29,11/29/2000,Male,India,Saint Louis University,Information Systems,3/11/2024 12:03,Team Allocated,1070,2/21/2024 21:03,3/21/2024 18:30,2000-11-29_Male_India,2,Other,0,28,38,23,1,Churned
2/21/2024 8:35,00000000-106T-FSAJ-KDBX-40ZGNV,UrbanRenew Challenge,Competition,4/29/2024 18:29,2/6/1990,Male,Ghana,Kwame Nkrumah University of Science and Technology  KNUST,Business Administration,3/11/2024 12:03,Team Allocated,1070,2/21/2024 13:18,3/21/2024 18:30,1990-02-06_Male_Ghana,2,Business,0,29,38,34,1,Churned
2/21/2024 7:22,00000000-100J-PM3A-0WJ8-5T68M5,Jump Start: Developing your Emotional Intelligence,Course,12/24/2025 3:34,8/9/2000,Female,United States,Saint Louis University,Computer Science,3/11/2024 12:03,Team Allocated,1070,,1/28/2024 23:30,2000-08-09_Female_United States,2,CS / IT,,,695,23,1,Churned
2/19/2024 23:59,00000000-106T-FSAJ-KDBX-40ZGNV,UrbanRenew Challenge,Competition,4/29/2024 18:29,10/2/2009,Male,Nigeria,Government secondary schools Tudun wada,Robotics and Automation Engineering,3/11/2024 12:03,Team Allocated,1070,2/21/2024 5:24,3/21/2024 18:30,2009-10-02_Male_Nigeria,2,Engineering,1,29,38,14,1,Churned
1/4/2024 12:47,00000000-0GWQ-AXC5-X45C-2MHJ28,Data Visualization,Internship,3/11/2024 18:00,11/1/2008,Male,India,Lotus Valley International School,Data Visualization,3/11/2024 12:02,Team Allocated,1070,1/4/2024 14:13,1/8/2024 3:30,2008-11-01_Male_India,2,Other,0,3,63,15,1,Churned
2/19/2024 8:26,00000000-106T-FSAJ-KDBX-40ZGNV,UrbanRenew Challenge,Competition,4/29/2024 18:29,11/26/2002,Male,India,Mumbai University,Marketing,3/11/2024 12:03,Team Allocated,1070,2/27/2024 4:50,3/21/2024 18:30,2002-11-26_Male_India,2,Other,7,23,38,21,1,Churned
2/28/2024 8:26,00000000-106T-FSAJ-KDBX-40ZGNV,UrbanRenew Challenge,Competition,4/29/2024 18:29,6/22/1994,Female,Nigeria,Saint Louis University,Civil Engineering,3/11/2024 12:03,Team Allocated,1070,3/1/2024 18:04,3/21/2024 18:30,1994-06-22_Female_Nigeria,2,Engineering,2,20,38,29,1,Churned
2/18/2024 6:46,00000000-10WC-BS50-CYGD-X97ES4,CPR/AED Certification,Course,6/30/2024 16:18,2/12/1999,Female,United States,SAINT LOUIS UNIVERSITY,Health Data Science,3/11/2024 12:02,Team Allocated,1070,,3/20/2023 2:30,1999-02-12_Female_United States,2,Other,,,468,25,1,Churned
2/17/2024 8:47,00000000-106T-FSAJ-KDBX-40ZGNV,UrbanRenew Challenge,Competition,4/29/2024 18:29,6/17/1997,Female,Ghana,University of Ghana,Psychology,3/11/2024 12:03,Team Allocated,1070,2/17/2024 9:11,3/21/2024 18:30,1997-06-17_Female_Ghana,2,Other,0,33,38,26,1,Churned
2/17/2024 7:35,00000000-106T-FSAJ-KDBX-40ZGNV,UrbanRenew Challenge,Competition,4/29/2024 18:29,1/1/2006,Male,Bhutan,Shivaji,Pv,3/11/2024 12:03,Team Allocated,1070,2/17/2024 7:45,3/21/2024 18:30,2006-01-01_Male_Bhutan,2,Other,0,33,38,18,1,Churned
2/15/2024 4:34,00000000-106T-FSAJ-KDBX-40ZGNV,UrbanRenew Challenge,Competition,4/29/2024 18:29,5/20/2001,Male,United States,Saint Louis University,Computer Science and Information Systems,3/11/2024 12:03,Team Allocated,1070,3/4/2024 7:32,3/21/2024 18:30,2001-05-20_Male_United States,2,CS / IT,18,17,38,22,1,Churned
2/14/2024 19:55,00000000-100J-PM3A-0WJ8-5T68M5,Jump Start: Developing your Emotional Intelligence,Course,12/24/2025 3:34,10/16/1990,Male,Ghana,Saint Louis University,Applied Financial Economics,3/11/2024 12:03,Team Allocated,1070,,1/28/2024 23:30,1990-10-16_Male_Ghana,2,Other,,,695,33,1,Churned
2/13/2024 10:59,00000000-106T-FSAJ-KDBX-40ZGNV,UrbanRenew Challenge,Competition,4/29/2024 18:29,7/20/2000,Male,India,Dhanekula Institute of Engineering and Technology,Computer Science and Engineering,3/11/2024 12:03,Team Allocated,1070,2/13/2024 11:28,3/21/2024 18:30,2000-07-20_Male_India,2,CS / IT,0,37,38,23,1,Churned
2/14/2024 15:14,00000000-10RQ-JXA9-NNKD-EW5RCF,UX Redesign Challenge,Competition,4/19/2024 18:29,12/16/2001,Female,India,The Study Hall College,Communication,3/11/2024 12:03,Team Allocated,1070,2/14/2024 15:20,2/15/2024 18:30,2001-12-16_Female_India,2,Other,0,1,63,22,1,Churned
2/14/2024 4:55,00000000-10RQ-JXA9-NNKD-EW5RCF,UX Redesign Challenge,Competition,4/19/2024 18:29,1/25/2003,Female,India,Vvit,Computer Science,3/11/2024 12:03,Team Allocated,1070,2/14/2024 5:01,2/15/2024 18:30,2003-01-25_Female_India,2,CS / IT,0,1,63,21,1,Churned
,00000000-10RQ-JXA9-NNKD-EW5RCF,UX Redesign Challenge,Competition,4/19/2024 18:29,10/19/1995,Female,United States,saint louis university,Information Systems,3/11/2024 12:03,Team Allocated,1070,2/14/2024 22:59,2/15/2024 18:30,1995-10-19_Female_United States,2,Other,,0,63,,1,Churned
,00000000-106T-FSAJ-KDBX-40ZGNV,UrbanRenew Challenge,Competition,4/29/2024 18:29,10/19/1995,Female,United States,saint louis university,Information Systems,3/11/2024 12:03,Team Allocated,1070,2/14/2024 23:00,3/21/2024 18:30,1995-10-19_Female_United States,2,Other,,35,38,,1,Churned
2/13/2024 18:48,00000000-106T-FSAJ-KDBX-40ZGNV,UrbanRenew Challenge,Competition,4/29/2024 18:29,5/20/1999,Male,United States,Saint Louis University,Health Data Science,3/11/2024 12:03,Team Allocated,1070,2/29/2024 19:52,3/21/2024 18:30,1999-05-20_Male_United States,2,Other,16,20,38,24,1,Churned
,00000000-100J-PM3A-0WJ8-5T68M5,Jump Start: Developing your Emotional Intelligence,Course,12/24/2025 3:34,10/26/1990,Male,Ghana,College of Health and Well-Being  Kintampo,Medical Laboratory Science,3/11/2024 12:03,Team Allocated,1070,,1/28/2024 23:30,1990-10-26_Male_Ghana,2,Other,,,695,,1,Churned
2/13/2024 10:59,00000000-10RQ-JXA9-NNKD-EW5RCF,UX Redesign Challenge,Competition,4/19/2024 18:29,7/20/2000,Male,India,Dhanekula Institute of Engineering and Technology,Computer Science and Engineering,3/11/2024 12:03,Team Allocated,1070,2/13/2024 11:12,2/15/2024 18:30,2000-07-20_Male_India,2,CS / IT,0,2,63,23,1,Churned
1/9/2024 14:43,00000000-106T-FSAJ-KDBX-40ZGNV,UrbanRenew Challenge,Competition,4/29/2024 18:29,4/11/2000,Male,United States,Saint Louise University,Information Systems,3/11/2024 12:03,Team Allocated,1070,2/8/2024 16:01,3/21/2024 18:30,2000-04-11_Male_United States,2,Other,30,42,38,23,1,Churned
1/19/2024 19:38,00000000-106T-FSAJ-KDBX-40ZGNV,UrbanRenew Challenge,Competition,4/29/2024 18:29,7/1/2002,Female,United States,Saint Louis University,Computer Science,3/11/2024 12:03,Team Allocated,1070,2/13/2024 23:14,3/21/2024 18:30,2002-07-01_Female_United States,2,CS / IT,25,36,38,21,1,Churned
1/17/2024 16:57,00000000-0GN2-A0AY-7XK8-C5FZPP,Career Essentials: Getting Started with Your Professional Journey,Course,6/29/2024 18:52,2/2/2003,Male,United States,Saint Louis University,Information Systems,3/11/2024 12:01,Team Allocated,1070,,11/3/2022 18:30,2003-02-02_Male_United States,2,Other,,,604,20,1,Churned
2/13/2024 3:17,00000000-106T-FSAJ-KDBX-40ZGNV,UrbanRenew Challenge,Competition,4/29/2024 18:29,2/22/2002,Male,India,saint Louis university,Analytics,3/11/2024 12:03,Team Allocated,1070,2/19/2024 20:08,3/21/2024 18:30,2002-02-22_Male_India,2,Other,6,30,38,21,1,Churned
2/12/2024 18:08,00000000-10RQ-JXA9-NNKD-EW5RCF,UX Redesign Challenge,Competition,4/19/2024 18:29,4/24/2001,Female,India,Sri Indu Institute of Engineering and Technology,Computer Science and Engineering,3/11/2024 12:03,Team Allocated,1070,,2/15/2024 18:30,2001-04-24_Female_India,2,CS / IT,,,63,22,1,Churned
2/11/2024 10:32,00000000-10RQ-JXA9-NNKD-EW5RCF,UX Redesign Challenge,Competition,4/19/2024 18:29,4/8/2005,Female,India,Sri Sairam Engineering College,Computer Engineering,3/11/2024 12:03,Team Allocated,1070,2/11/2024 10:38,2/15/2024 18:30,2005-04-08_Female_India,2,CS / IT,0,4,63,18,1,Churned
2/10/2024 22:10,00000000-10RQ-JXA9-NNKD-EW5RCF,UX Redesign Challenge,Competition,4/19/2024 18:29,3/7/1997,Male,United States,saint louis university,Cyber Security,3/11/2024 12:03,Team Allocated,1070,2/10/2024 22:32,2/15/2024 18:30,1997-03-07_Male_United States,2,CS / IT,0,4,63,26,1,Churned
2/9/2024 18:41,00000000-10RQ-JXA9-NNKD-EW5RCF,UX Redesign Challenge,Competition,4/19/2024 18:29,4/4/1999,Male,United States,saint louis university,Health Data Science,3/11/2024 12:03,Team Allocated,1070,2/13/2024 18:29,2/15/2024 18:30,1999-04-04_Male_United States,2,Other,3,2,63,24,1,Churned
2/9/2024 17:09,00000000-10RQ-JXA9-NNKD-EW5RCF,UX Redesign Challenge,Competition,4/19/2024 18:29,8/3/1999,Female,India,Saint Louis University,Information Systems,3/11/2024 12:03,Team Allocated,1070,2/9/2024 17:17,2/15/2024 18:30,1999-08-03_Female_India,2,Other,0,6,63,24,1,Churned
2/9/2024 15:19,00000000-10RQ-JXA9-NNKD-EW5RCF,UX Redesign Challenge,Competition,4/19/2024 18:29,9/13/1980,Male,Ghana,Saint Louis University,Supply Chain Management,3/11/2024 12:03,Team Allocated,1070,,2/15/2024 18:30,1980-09-13_Male_Ghana,2,Business,,,63,43,1,Churned
2/9/2024 15:19,00000000-106T-FSAJ-KDBX-40ZGNV,UrbanRenew Challenge,Competition,4/29/2024 18:29,9/13/1980,Male,Ghana,Saint Louis University,Supply Chain Management,3/11/2024 12:03,Team Allocated,1070,,3/21/2024 18:30,1980-09-13_Male_Ghana,2,Business,,,38,43,1,Churned
2/8/2024 16:11,00000000-106T-FSAJ-KDBX-40ZGNV,UrbanRenew Challenge,Competition,4/29/2024 18:29,3/5/1999,Male,India,K L Deemed to be University,Already Graduation Completed,3/11/2024 12:03,Team Allocated,1070,2/8/2024 16:36,3/21/2024 18:30,1999-03-05_Male_India,2,Other,0,42,38,24,1,Churned
2/8/2024 5:01,00000000-10RQ-JXA9-NNKD-EW5RCF,UX Redesign Challenge,Competition,4/19/2024 18:29,12/17/1977,Male,Nigeria,saint Louis University,Cyber Security,3/11/2024 12:03,Team Allocated,1070,2/8/2024 6:00,2/15/2024 18:30,1977-12-17_Male_Nigeria,2,CS / IT,0,7,63,46,1,Churned
2/8/2024 5:01,00000000-106T-FSAJ-KDBX-40ZGNV,UrbanRenew Challenge,Competition,4/29/2024 18:29,12/17/1977,Male,Nigeria,saint Louis University,Cyber Security,3/11/2024 12:03,Team Allocated,1070,2/21/2024 11:43,3/21/2024 18:30,1977-12-17_Male_Nigeria,2,CS / IT,13,29,38,46,1,Churned
2/6/2024 22:54,00000000-100J-PM3A-0WJ8-5T68M5,Jump Start: Developing your Emotional Intelligence,Course,12/24/2025 3:34,2/7/2002,Male,United States,Saint Louis University,Computer Science,3/11/2024 12:03,Team Allocated,1070,,1/28/2024 23:30,2002-02-07_Male_United States,2,CS / IT,,,695,22,1,Churned
2/6/2024 14:34,00000000-106T-FSAJ-KDBX-40ZGNV,UrbanRenew Challenge,Competition,4/29/2024 18:29,1/19/1999,Male,India,VTU,Electronics and Communication,3/11/2024 12:03,Team Allocated,1070,2/6/2024 14:49,3/21/2024 18:30,1999-01-19_Male_India,2,Other,0,44,38,25,1,Churned
2/3/2024 8:06,00000000-10RQ-JXA9-NNKD-EW5RCF,UX Redesign Challenge,Competition,4/19/2024 18:29,11/9/2004,Female,India,Sardar Patel Institute of Technology,Computer Engineering,3/11/2024 12:03,Team Allocated,1070,2/4/2024 19:13,2/15/2024 18:30,2004-11-09_Female_India,2,CS / IT,1,10,63,19,1,Churned
2/2/2024 21:06,00000000-10RQ-JXA9-NNKD-EW5RCF,UX Redesign Challenge,Competition,4/19/2024 18:29,4/9/2002,Female,United States,saint louis university,Information Systems,3/11/2024 12:03,Team Allocated,1070,2/2/2024 21:37,2/15/2024 18:30,2002-04-09_Female_United States,2,Other,0,12,63,21,1,Churned
2/2/2024 21:06,00000000-106T-FSAJ-KDBX-40ZGNV,UrbanRenew Challenge,Competition,4/29/2024 18:29,4/9/2002,Female,United States,saint louis university,Information Systems,3/11/2024 12:03,Team Allocated,1070,2/2/2024 21:30,3/21/2024 18:30,2002-04-09_Female_United States,2,Other,0,47,38,21,1,Churned
1/31/2024 19:35,00000000-10RQ-JXA9-NNKD-EW5RCF,UX Redesign Challenge,Competition,4/19/2024 18:29,12/6/2001,Female,United States,Saint louis University,Computer Science,3/11/2024 12:03,Team Allocated,1070,2/5/2024 18:54,2/15/2024 18:30,2001-12-06_Female_United States,2,CS / IT,4,9,63,22,1,Churned
1/31/2024 15:11,00000000-10RQ-JXA9-NNKD-EW5RCF,UX Redesign Challenge,Competition,4/19/2024 18:29,5/20/2001,Male,United States,Saint Louis University,Information Systems,3/11/2024 12:03,Team Allocated,1070,1/31/2024 15:51,2/15/2024 18:30,2001-05-20_Male_United States,2,Other,0,15,63,22,1,Churned
1/30/2024 11:38,00000000-10RQ-JXA9-NNKD-EW5RCF,UX Redesign Challenge,Competition,4/19/2024 18:29,6/4/2003,Male,Ethiopia,Kaleab Secondary and Preparatory School,Computer Science,3/11/2024 12:03,Team Allocated,1070,1/30/2024 12:11,2/15/2024 18:30,2003-06-04_Male_Ethiopia,2,CS / IT,0,16,63,20,1,Churned
1/30/2024 11:38,00000000-106T-FSAJ-KDBX-40ZGNV,UrbanRenew Challenge,Competition,4/29/2024 18:29,6/4/2003,Male,Ethiopia,Kaleab Secondary and Preparatory School,Computer Science,3/11/2024 12:03,Team Allocated,1070,1/30/2024 11:53,3/21/2024 18:30,2003-06-04_Male_Ethiopia,2,CS / IT,0,51,38,20,1,Churned
1/30/2024 2:01,00000000-10RQ-JXA9-NNKD-EW5RCF,UX Redesign Challenge,Competition,4/19/2024 18:29,7/11/2002,Male,United States,saint louis university,Data Analytics,3/11/2024 12:03,Team Allocated,1070,1/30/2024 2:55,2/15/2024 18:30,2002-07-11_Male_United States,2,Other,0,16,63,21,1,Churned
1/30/2024 2:01,00000000-106T-FSAJ-KDBX-40ZGNV,UrbanRenew Challenge,Competition,4/29/2024 18:29,7/11/2002,Male,United States,saint louis university,Data Analytics,3/11/2024 12:03,Team Allocated,1070,1/30/2024 2:16,3/21/2024 18:30,2002-07-11_Male_United States,2,Other,0,51,38,21,1,Churned
1/26/2024 16:39,00000000-106T-FSAJ-KDBX-40ZGNV,UrbanRenew Challenge,Competition,4/29/2024 18:29,11/15/2007,Male,India,Amity International School  Noida,Data Analysis,3/11/2024 12:03,Team Allocated,1070,1/27/2024 8:15,3/21/2024 18:30,2007-11-15_Male_India,2,Other,0,54,38,16,1,Churned
1/25/2024 5:52,00000000-106T-FSAJ-KDBX-40ZGNV,UrbanRenew Challenge,Competition,4/29/2024 18:29,11/6/2005,Female,India,Ramadevi women's University Bhubaneswar,Computer Science,3/11/2024 12:03,Team Allocated,1070,1/25/2024 6:30,3/21/2024 18:30,2005-11-06_Female_India,2,CS / IT,0,56,38,18,1,Churned
,00000000-0GN2-A0AY-7XK8-C5FZPP,Career Essentials: Getting Started with Your Professional Journey,Course,6/29/2024 18:52,4/4/2006,Male,Nigeria,Lagos state university,Accounting and Finance,3/11/2024 12:01,Team Allocated,1070,,11/3/2022 18:30,2006-04-04_Male_Nigeria,2,Other,,,604,,1,Churned
1/22/2024 16:18,00000000-10RQ-JXA9-NNKD-EW5RCF,UX Redesign Challenge,Competition,4/19/2024 18:29,3/10/2001,Male,India,saint louis university,Artificial Intelligence,3/11/2024 12:03,Team Allocated,1070,2/6/2024 18:04,2/15/2024 18:30,2001-03-10_Male_India,2,Other,15,9,63,22,1,Churned
11/2/2023 15:20,00000000-0GRA-BD28-CXVV-EYEX21,Health Care Management,Internship,,1/31/2001,Male,India,Gurunanak institutions of technical campus,Information Systems,3/11/2024 12:02,Team Allocated,1070,11/2/2023 16:07,1/8/2024 3:30,2001-01-31_Male_India,2,Other,0,66,,22,1,Churned
1/22/2024 2:23,00000000-106T-FSAJ-KDBX-40ZGNV,UrbanRenew Challenge,Competition,4/29/2024 18:29,2/4/2001,Female,India,SAINT LOUIS UNIVERSITY,Data Analytics,3/11/2024 12:03,Team Allocated,1070,,3/21/2024 18:30,2001-02-04_Female_India,2,Other,,,38,22,1,Churned
2/13/2024 8:50,00000000-106T-FSAJ-KDBX-40ZGNV,UrbanRenew Challenge,Competition,4/29/2024 18:29,7/25/1996,Male,Ghana,Knutsford University College,Marketing,3/11/2024 12:03,Team Allocated,1070,2/13/2024 9:23,3/21/2024 18:30,1996-07-25_Male_Ghana,2,Other,0,37,38,27,1,Churned
1/19/2024 19:38,00000000-10RQ-JXA9-NNKD-EW5RCF,UX Redesign Challenge,Competition,4/19/2024 18:29,7/1/2002,Female,United States,Saint Louis University,Computer Science,3/11/2024 12:03,Team Allocated,1070,2/13/2024 23:20,2/15/2024 18:30,2002-07-01_Female_United States,2,CS / IT,25,1,63,21,1,Churned
1/5/2024 5:18,00000000-0GZY-NNHV-FJWW-PTA9VX,Innovation & Entrepreneurship,Internship,3/11/2024 18:00,12/9/2002,Female,India,saint louis university,Cyber Security,3/11/2024 12:02,Team Allocated,1070,1/5/2024 8:57,1/8/2024 3:30,2002-12-09_Female_India,2,CS / IT,0,2,63,21,1,Churned
1/17/2024 15:35,00000000-10RQ-JXA9-NNKD-EW5RCF,UX Redesign Challenge,Competition,4/19/2024 18:29,1/22/1999,Male,United States,Saint Louis University,Artificial Intelligence and Robotics,3/11/2024 12:03,Team Allocated,1070,2/3/2024 21:17,2/15/2024 18:30,1999-01-22_Male_United States,2,Other,17,11,63,25,1,Churned
1/16/2024 3:39,00000000-106T-FSAJ-KDBX-40ZGNV,UrbanRenew Challenge,Competition,4/29/2024 18:29,8/29/1997,Male,United States,Saint Louis University,Computer Information Systems,3/11/2024 12:03,Team Allocated,1070,2/1/2024 4:59,3/21/2024 18:30,1997-08-29_Male_United States,2,CS / IT,16,49,38,26,1,Churned
1/12/2024 13:43,00000000-10RQ-JXA9-NNKD-EW5RCF,UX Redesign Challenge,Competition,4/19/2024 18:29,7/24/1994,Female,United States,Saint Louis University,Information Systems,3/11/2024 12:03,Team Allocated,1070,1/24/2024 17:05,2/15/2024 18:30,1994-07-24_Female_United States,2,Other,12,22,63,29,1,Churned
1/12/2024 13:43,00000000-106T-FSAJ-KDBX-40ZGNV,UrbanRenew Challenge,Competition,4/29/2024 18:29,7/24/1994,Female,United States,Saint Louis University,Information Systems,3/11/2024 12:03,Team Allocated,1070,2/2/2024 22:37,3/21/2024 18:30,1994-07-24_Female_United States,2,Other,21,47,38,29,1,Churned
1/12/2024 7:08,00000000-106T-FSAJ-KDBX-40ZGNV,UrbanRenew Challenge,Competition,4/29/2024 18:29,1/8/1999,Female,United States,Saint Louis university,Information Systems,3/11/2024 12:03,Team Allocated,1070,2/25/2024 18:39,3/21/2024 18:30,1999-01-08_Female_United States,2,Other,44,24,38,25,1,Churned
1/10/2024 3:16,00000000-106T-FSAJ-KDBX-40ZGNV,UrbanRenew Challenge,Competition,4/29/2024 18:29,6/21/2000,Female,United States,Saint Louis University,Information Systems,3/11/2024 12:03,Team Allocated,1070,2/19/2024 16:01,3/21/2024 18:30,2000-06-21_Female_United States,2,Other,40,31,38,23,1,Churned
,00000000-106T-FSAJ-KDBX-40ZGNV,UrbanRenew Challenge,Competition,4/29/2024 18:29,1/8/2002,Female,United States,Webster University,Information Technology and Management,3/11/2024 12:03,Team Allocated,1070,2/27/2024 21:09,3/21/2024 18:30,2002-01-08_Female_United States,2,Business,,22,38,,1,Churned
1/8/2024 5:56,00000000-10RQ-JXA9-NNKD-EW5RCF,UX Redesign Challenge,Competition,4/19/2024 18:29,11/19/1999,Male,United States,Saint Louis University,Information Science,3/11/2024 12:03,Team Allocated,1070,2/11/2024 16:29,2/15/2024 18:30,1999-11-19_Male_United States,2,Other,34,4,63,24,1,Churned
1/7/2024 4:04,00000000-106T-FSAJ-KDBX-40ZGNV,UrbanRenew Challenge,Competition,4/29/2024 18:29,9/1/2003,Male,India,pace institute of technology and sciences,Artificial Intelligence and Machine learning,3/11/2024 12:03,Team Allocated,1070,2/20/2024 5:12,3/21/2024 18:30,2003-09-01_Male_India,2,Other,44,30,38,20,1,Churned
1/5/2024 5:18,00000000-10RQ-JXA9-NNKD-EW5RCF,UX Redesign Challenge,Competition,4/19/2024 18:29,12/9/2002,Female,India,saint louis university,Cyber Security,3/11/2024 12:03,Team Allocated,1070,2/1/2024 13:31,2/15/2024 18:30,2002-12-09_Female_India,2,CS / IT,27,14,63,21,1,Churned
1/5/2024 5:18,00000000-106T-FSAJ-KDBX-40ZGNV,UrbanRenew Challenge,Competition,4/29/2024 18:29,12/9/2002,Female,India,saint louis university,Cyber Security,3/11/2024 12:03,Team Allocated,1070,2/1/2024 13:30,3/21/2024 18:30,2002-12-09_Female_India,2,CS / IT,27,49,38,21,1,Churned
1/5/2024 5:18,00000000-0GHB-4N83-QX9K-JM48K2,Project Management,Internship,3/11/2024 18:00,12/9/2002,Female,India,saint louis university,Cyber Security,3/11/2024 12:02,Team Allocated,1070,1/5/2024 8:55,1/8/2024 3:30,2002-12-09_Female_India,2,CS / IT,0,2,63,21,1,Churned
1/5/2024 5:18,00000000-0GNT-FT74-MZT8-93VC0G,Digital Marketing,Internship,3/11/2024 18:00,12/9/2002,Female,India,saint louis university,Cyber Security,3/11/2024 12:01,Team Allocated,1070,1/5/2024 8:42,1/8/2024 3:30,2002-12-09_Female_India,2,CS / IT,0,2,63,21,1,Churned
1/18/2024 20:19,00000000-106T-FSAJ-KDBX-40ZGNV,UrbanRenew Challenge,Competition,4/29/2024 18:29,10/19/1998,Female,United States,Saint Louis University,Information Systems,3/11/2024 12:03,Team Allocated,1070,3/10/2024 18:46,3/21/2024 18:30,1998-10-19_Female_United States,2,Other,51,10,38,25,1,Churned
1/4/2024 15:09,00000000-0GHB-4N83-QX9K-JM48K2,Project Management,Internship,3/11/2024 18:00,11/12/2000,Male,United States,Saint Louis university,Information Systems,3/11/2024 12:02,Team Allocated,1070,1/4/2024 15:27,1/8/2024 3:30,2000-11-12_Male_United States,2,Other,0,3,63,23,1,Churned
1/4/2024 15:05,00000000-0GHB-4N83-QX9K-JM48K2,Project Management,Internship,3/11/2024 18:00,3/14/2009,Female,India,Lotus Valley International School,Business and Management Studies,3/11/2024 12:02,Team Allocated,1070,1/5/2024 9:49,1/8/2024 3:30,2009-03-14_Female_India,2,Business,0,2,63,14,1,Churned
1/4/2024 13:58,00000000-0GZY-NNHV-FJWW-PTA9VX,Innovation & Entrepreneurship,Internship,3/11/2024 18:00,9/12/2007,Male,India,Lotus Valley International School,Business Analytics,3/11/2024 12:02,Team Allocated,1070,1/4/2024 14:28,1/8/2024 3:30,2007-09-12_Male_India,2,Business,0,3,63,16,1,Churned
1/4/2024 12:55,00000000-0GHB-4N83-QX9K-JM48K2,Project Management,Internship,3/11/2024 18:00,1/19/2008,Female,India,Lotus Valley International School  Noida,Finance,3/11/2024 12:02,Team Allocated,1070,1/4/2024 13:16,1/8/2024 3:30,2008-01-19_Female_India,2,Other,0,3,63,15,1,Churned
1/4/2024 12:54,00000000-0GHB-4N83-QX9K-JM48K2,Project Management,Internship,3/11/2024 18:00,9/16/2007,Female,India,Lotus Valley International School  Noida  Uttar Pradesh,Project Management,3/11/2024 12:02,Team Allocated,1070,1/4/2024 13:07,1/8/2024 3:30,2007-09-16_Female_India,2,Business,0,3,63,16,1,Churned
1/4/2024 12:52,00000000-0GWQ-AXC5-X45C-2MHJ28,Data Visualization,Internship,3/11/2024 18:00,11/22/2007,Male,India,Lotus Valley International School,Computer Science and Engineering,3/11/2024 12:02,Team Allocated,1070,1/4/2024 13:24,1/8/2024 3:30,2007-11-22_Male_India,2,CS / IT,0,3,63,16,1,Churned
1/4/2024 12:51,00000000-0GZY-NNHV-FJWW-PTA9VX,Innovation & Entrepreneurship,Internship,3/11/2024 18:00,1/18/2007,Male,India,Lotus Valley International School Noida,Economics,3/11/2024 12:02,Team Allocated,1070,1/4/2024 13:08,1/8/2024 3:30,2007-01-18_Male_India,2,Other,0,3,63,16,1,Churned
1/4/2024 12:49,00000000-0GZY-NNHV-FJWW-PTA9VX,Innovation & Entrepreneurship,Internship,3/11/2024 18:00,11/16/2007,Male,India,Lotus Valley International School,BBA,3/11/2024 12:02,Team Allocated,1070,1/4/2024 13:18,1/8/2024 3:30,2007-11-16_Male_India,2,Other,0,3,63,16,1,Churned
1/4/2024 12:48,00000000-0GNT-FT74-MZT8-93VC0G,Digital Marketing,Internship,3/11/2024 18:00,7/22/2007,Female,India,Lotus Valley International School,Law and Legal Studies,3/11/2024 12:01,Team Allocated,1070,1/4/2024 13:15,1/8/2024 3:30,2007-07-22_Female_India,2,Other,0,3,63,16,1,Churned
1/4/2024 12:48,00000000-0GZY-NNHV-FJWW-PTA9VX,Innovation & Entrepreneurship,Internship,3/11/2024 18:00,9/5/2007,Male,India,Lotus valley International,Entrepreneurship,3/11/2024 12:02,Team Allocated,1070,1/5/2024 16:17,1/8/2024 3:30,2007-09-05_Male_India,2,Other,1,2,63,16,1,Churned
1/4/2024 12:47,00000000-0GWQ-AXC5-X45C-2MHJ28,Data Visualization,Internship,3/11/2024 18:00,3/5/2007,Male,India,Lotus Valley International School  Noida,Computer Engineering,3/11/2024 12:02,Team Allocated,1070,1/4/2024 14:15,1/8/2024 3:30,2007-03-05_Male_India,2,CS / IT,0,3,63,16,1,Churned
1/4/2024 12:47,00000000-0GHB-4N83-QX9K-JM48K2,Project Management,Internship,3/11/2024 18:00,1/14/2009,Male,India,Lotus Valley International School,Physics and Astronomy,3/11/2024 12:02,Team Allocated,1070,1/4/2024 13:06,1/8/2024 3:30,2009-01-14_Male_India,2,Other,0,3,63,14,1,Churned
2/23/2024 21:20,00000000-106T-FSAJ-KDBX-40ZGNV,UrbanRenew Challenge,Competition,4/29/2024 18:29,9/6/2000,Female,Zambia,Saint Louis university,Nursing,3/11/2024 12:03,Team Allocated,1070,2/25/2024 8:23,3/21/2024 18:30,2000-09-06_Female_Zambia,2,Other,1,25,38,23,1,Churned
12/8/2023 3:52,00000000-0GWQ-AXC5-X45C-2MHJ28,Data Visualization,Internship,3/11/2024 18:00,11/19/2003,Male,India,Dr D.Y. Patil College of Engineering and Innovation,Artificial Intelligence and Data Science,3/11/2024 12:02,Team Allocated,1070,12/31/2023 1:51,1/8/2024 3:30,2003-11-19_Male_India,2,Other,22,8,63,20,1,Churned
,00000000-100J-PM3A-0WJ8-5T68M5,Jump Start: Developing your Emotional Intelligence,Course,12/24/2025 3:34,1/8/2002,Female,United States,Webster University,Information Technology and Management,3/11/2024 12:03,Team Allocated,1070,,1/28/2024 23:30,2002-01-08_Female_United States,2,Business,,,695,,1,Churned
2/20/2024 16:44,00000000-106T-FSAJ-KDBX-40ZGNV,UrbanRenew Challenge,Competition,4/29/2024 18:29,10/9/2000,Male,United States,Saint Louis University,Information Systems,3/11/2024 12:03,Team Allocated,1070,2/22/2024 1:39,3/21/2024 18:30,2000-10-09_Male_United States,2,Other,1,28,38,23,1,Churned
1/4/2024 12:45,00000000-0GZY-NNHV-FJWW-PTA9VX,Innovation & Entrepreneurship,Internship,3/11/2024 18:00,12/23/2007,Male,India,Lotus Valley international school,Finance,3/11/2024 12:02,Team Allocated,1070,1/4/2024 13:55,1/8/2024 3:30,2007-12-23_Male_India,2,Other,0,3,63,16,1,Churned
1/4/2024 12:45,00000000-0GZY-NNHV-FJWW-PTA9VX,Innovation & Entrepreneurship,Internship,3/11/2024 18:00,11/26/2008,Male,India,Lotus Valley International School,Physics,3/11/2024 12:02,Team Allocated,1070,1/4/2024 13:56,1/8/2024 3:30,2008-11-26_Male_India,2,Other,0,3,63,15,1,Churned
1/3/2024 22:32,00000000-0GWQ-AXC5-X45C-2MHJ28,Data Visualization,Internship,3/11/2024 18:00,3/28/2001,Male,United States,Saint Louis University,Computer Information Systems,3/11/2024 12:02,Team Allocated,1070,1/3/2024 23:03,1/8/2024 3:30,2001-03-28_Male_United States,2,CS / IT,0,4,63,22,1,Churned
1/3/2024 22:32,00000000-0GNT-FT74-MZT8-93VC0G,Digital Marketing,Internship,3/11/2024 18:00,3/28/2001,Male,United States,Saint Louis University,Computer Information Systems,3/11/2024 12:01,Team Allocated,1070,1/3/2024 23:01,1/8/2024 3:30,2001-03-28_Male_United States,2,CS / IT,0,4,63,22,1,Churned
1/3/2024 20:58,00000000-0GHB-4N83-QX9K-JM48K2,Project Management,Internship,3/11/2024 18:00,2/10/2002,Male,India,Saint Louis University,Information Systems,3/11/2024 12:02,Team Allocated,1070,1/3/2024 21:12,1/8/2024 3:30,2002-02-10_Male_India,2,Other,0,4,63,21,1,Churned
1/3/2024 17:13,00000000-100J-PM3A-0WJ8-5T68M5,Jump Start: Developing your Emotional Intelligence,Course,12/24/2025 3:34,6/21/1998,Female,United States,Saint Louis University,Information Systems,3/11/2024 12:03,Team Allocated,1070,1/28/2024 6:11,1/28/2024 23:30,1998-06-21_Female_United States,2,Other,24,0,695,25,1,Churned
1/3/2024 17:13,00000000-10A5-TYD2-181G-D2J679,Xperience Design Hackathon,Competition,3/13/2024 18:29,6/21/1998,Female,United States,Saint Louis University,Information Systems,3/11/2024 12:03,Team Allocated,1070,1/28/2024 6:05,1/28/2024 18:30,1998-06-21_Female_United States,2,Other,24,0,44,25,1,Churned
1/3/2024 17:13,00000000-10RQ-JXA9-NNKD-EW5RCF,UX Redesign Challenge,Competition,4/19/2024 18:29,6/21/1998,Female,United States,Saint Louis University,Information Systems,3/11/2024 12:03,Team Allocated,1070,1/28/2024 6:06,2/15/2024 18:30,1998-06-21_Female_United States,2,Other,24,18,63,25,1,Churned
1/3/2024 17:13,00000000-106T-FSAJ-KDBX-40ZGNV,UrbanRenew Challenge,Competition,4/29/2024 18:29,6/21/1998,Female,United States,Saint Louis University,Information Systems,3/11/2024 12:03,Team Allocated,1070,1/28/2024 6:06,3/21/2024 18:30,1998-06-21_Female_United States,2,Other,24,53,38,25,1,Churned
12/31/2023 14:53,00000000-0GHB-4N83-QX9K-JM48K2,Project Management,Internship,3/11/2024 18:00,6/29/1994,Male,Nigeria,Gombe State University  Tudun Wada Gombe State,Education and Geography,3/11/2024 12:02,Team Allocated,1070,12/31/2023 15:41,1/8/2024 3:30,1994-06-29_Male_Nigeria,2,Other,0,7,63,29,1,Churned
12/30/2023 19:31,00000000-106T-FSAJ-KDBX-40ZGNV,UrbanRenew Challenge,Competition,4/29/2024 18:29,5/21/2001,Male,United States,saint louis university,Information Systems,3/11/2024 12:03,Team Allocated,1070,2/2/2024 5:33,3/21/2024 18:30,2001-05-21_Male_United States,2,Other,33,48,38,22,1,Churned
12/30/2023 17:44,00000000-0GRA-BD28-CXVV-EYEX21,Health Care Management,Internship,,4/10/1980,Male,Nigeria,NIIT,Human Resources,3/11/2024 12:02,Team Allocated,1070,12/30/2023 18:08,1/8/2024 3:30,1980-04-10_Male_Nigeria,2,Other,0,8,,43,1,Churned
12/30/2023 17:28,00000000-0GWQ-AXC5-X45C-2MHJ28,Data Visualization,Internship,3/11/2024 18:00,3/23/2004,Male,India,Sri Krishna Arts and Science College,Accounting and Finance,3/11/2024 12:02,Team Allocated,1070,12/30/2023 17:45,1/8/2024 3:30,2004-03-23_Male_India,2,Other,0,8,63,19,1,Churned
12/30/2023 17:28,00000000-0GHB-4N83-QX9K-JM48K2,Project Management,Internship,3/11/2024 18:00,3/23/2004,Male,India,Sri Krishna Arts and Science College,Accounting and Finance,3/11/2024 12:02,Team Allocated,1070,12/30/2023 17:44,1/8/2024 3:30,2004-03-23_Male_India,2,Other,0,8,63,19,1,Churned
12/30/2023 5:09,00000000-0GZY-NNHV-FJWW-PTA9VX,Innovation & Entrepreneurship,Internship,3/11/2024 18:00,5/12/1998,Male,Nigeria,Nuhu Bamalli Polytechnic Zaria,Finance,3/11/2024 12:02,Team Allocated,1070,12/31/2023 6:04,1/8/2024 3:30,1998-05-12_Male_Nigeria,2,Other,1,7,63,25,1,Churned
12/30/2023 2:46,00000000-100J-PM3A-0WJ8-5T68M5,Jump Start: Developing your Emotional Intelligence,Course,12/24/2025 3:34,9/1/1998,Male,Nigeria,IHERIS UNIVERSITY TOGO,Computer Science,3/11/2024 12:03,Team Allocated,1070,1/27/2024 18:15,1/28/2024 23:30,1998-09-01_Male_Nigeria,2,CS / IT,28,1,695,25,1,Churned
12/30/2023 2:46,00000000-0GWQ-AXC5-X45C-2MHJ28,Data Visualization,Internship,3/11/2024 18:00,9/1/1998,Male,Nigeria,IHERIS UNIVERSITY TOGO,Computer Science,3/11/2024 12:02,Team Allocated,1070,12/30/2023 3:29,1/8/2024 3:30,1998-09-01_Male_Nigeria,2,CS / IT,0,9,63,25,1,Churned
12/29/2023 21:42,00000000-100J-PM3A-0WJ8-5T68M5,Jump Start: Developing your Emotional Intelligence,Course,12/24/2025 3:34,9/17/2002,Male,United States,Saint Louis University,Masters in Information Systems,3/11/2024 12:03,Team Allocated,1070,1/28/2024 22:45,1/28/2024 23:30,2002-09-17_Male_United States,2,Other,30,0,695,21,1,Churned
12/29/2023 21:42,00000000-10RQ-JXA9-NNKD-EW5RCF,UX Redesign Challenge,Competition,4/19/2024 18:29,9/17/2002,Male,United States,Saint Louis University,Masters in Information Systems,3/11/2024 12:03,Team Allocated,1070,1/28/2024 22:38,2/15/2024 18:30,2002-09-17_Male_United States,2,Other,30,17,63,21,1,Churned
12/29/2023 21:42,00000000-106T-FSAJ-KDBX-40ZGNV,UrbanRenew Challenge,Competition,4/29/2024 18:29,9/17/2002,Male,United States,Saint Louis University,Masters in Information Systems,3/11/2024 12:03,Team Allocated,1070,1/28/2024 22:39,3/21/2024 18:30,2002-09-17_Male_United States,2,Other,30,52,38,21,1,Churned
12/29/2023 14:05,00000000-0GZY-NNHV-FJWW-PTA9VX,Innovation & Entrepreneurship,Internship,3/11/2024 18:00,7/28/2002,Male,Pakistan,University of Management and Technology lahore  Pakistan,Accounting and Finance,3/11/2024 12:02,Team Allocated,1070,12/29/2023 14:22,1/8/2024 3:30,2002-07-28_Male_Pakistan,2,Other,0,9,63,21,1,Churned
12/28/2023 6:59,00000000-100J-PM3A-0WJ8-5T68M5,Jump Start: Developing your Emotional Intelligence,Course,12/24/2025 3:34,11/27/2000,Male,United States,Saint Louis university,Computer Science,3/11/2024 12:03,Team Allocated,1070,1/25/2024 22:38,1/28/2024 23:30,2000-11-27_Male_United States,2,CS / IT,28,3,695,23,1,Churned
12/28/2023 6:59,00000000-10A5-TYD2-181G-D2J679,Xperience Design Hackathon,Competition,3/13/2024 18:29,11/27/2000,Male,United States,Saint Louis university,Computer Science,3/11/2024 12:03,Team Allocated,1070,1/25/2024 22:27,1/28/2024 18:30,2000-11-27_Male_United States,2,CS / IT,28,2,44,23,1,Churned
12/28/2023 6:59,00000000-10RQ-JXA9-NNKD-EW5RCF,UX Redesign Challenge,Competition,4/19/2024 18:29,11/27/2000,Male,United States,Saint Louis university,Computer Science,3/11/2024 12:03,Team Allocated,1070,1/25/2024 22:28,2/15/2024 18:30,2000-11-27_Male_United States,2,CS / IT,28,20,63,23,1,Churned
12/15/2023 5:49,00000000-0GRA-BD28-CXVV-EYEX21,Health Care Management,Internship,,3/3/1997,Male,United States,saint louis unveracity,Project Management,3/11/2024 12:02,Team Allocated,1070,12/16/2023 6:28,1/8/2024 3:30,1997-03-03_Male_United States,2,Business,1,22,,26,1,Churned
12/15/2023 5:23,00000000-0GRA-BD28-CXVV-EYEX21,Health Care Management,Internship,,3/17/2001,Female,United States,Saint louis Univeristy,Information Systems,3/11/2024 12:02,Team Allocated,1070,12/15/2023 5:47,1/8/2024 3:30,2001-03-17_Female_United States,2,Other,0,23,,22,1,Churned
12/15/2023 3:58,00000000-0GRA-BD28-CXVV-EYEX21,Health Care Management,Internship,,11/9/2002,Male,United States,Saint louis university,Information Systems,3/11/2024 12:02,Team Allocated,1070,12/15/2023 4:19,1/8/2024 3:30,2002-11-09_Male_United States,2,Other,0,23,,21,1,Churned
1/4/2024 12:45,00000000-0GWQ-AXC5-X45C-2MHJ28,Data Visualization,Internship,3/11/2024 18:00,7/11/2007,Female,India,Lotus Valley International School  Noida,Computer Engineering,3/11/2024 12:02,Team Allocated,1070,1/4/2024 14:28,1/8/2024 3:30,2007-07-11_Female_India,2,CS / IT,0,3,63,16,1,Churned
1/4/2024 12:45,00000000-0GZY-NNHV-FJWW-PTA9VX,Innovation & Entrepreneurship,Internship,3/11/2024 18:00,3/17/2007,Female,India,lotus valley international school,Psychology,3/11/2024 12:02,Team Allocated,1070,1/4/2024 13:09,1/8/2024 3:30,2007-03-17_Female_India,2,Other,0,3,63,16,1,Churned
1/4/2024 12:46,00000000-0GZY-NNHV-FJWW-PTA9VX,Innovation & Entrepreneurship,Internship,3/11/2024 18:00,8/13/2007,Male,India,Lotus Valley International School,Engineering,3/11/2024 12:02,Team Allocated,1070,1/4/2024 13:35,1/8/2024 3:30,2007-08-13_Male_India,2,Engineering,0,3,63,16,1,Churned
12/19/2023 19:41,00000000-10A5-TYD2-181G-D2J679,Xperience Design Hackathon,Competition,3/13/2024 18:29,9/25/2000,Female,India,Future Institute of Engineering and Management,Information Technology,3/11/2024 12:03,Team Allocated,1070,1/27/2024 13:18,1/28/2024 18:30,2000-09-25_Female_India,2,Other,38,1,44,23,1,Churned
12/23/2023 23:56,00000000-0GRA-BD28-CXVV-EYEX21,Health Care Management,Internship,,11/28/1998,Male,United States,Saint Louis university,Information Systems,3/11/2024 12:02,Team Allocated,1070,12/24/2023 23:56,1/8/2024 3:30,1998-11-28_Male_United States,2,Other,1,14,,25,1,Churned
12/23/2023 4:38,00000000-0GRA-BD28-CXVV-EYEX21,Health Care Management,Internship,,10/30/1999,Female,United States,SAINT LOUIS UNIVERSITY,Health Data Science,3/11/2024 12:02,Team Allocated,1070,12/24/2023 1:28,1/8/2024 3:30,1999-10-30_Female_United States,2,Other,0,15,,24,1,Churned
12/22/2023 10:23,00000000-0GHB-4N83-QX9K-JM48K2,Project Management,Internship,3/11/2024 18:00,12/21/1988,Female,Nigeria,Saint Louis University,MBA,3/11/2024 12:02,Team Allocated,1070,12/31/2023 7:08,1/8/2024 3:30,1988-12-21_Female_Nigeria,2,Other,8,7,63,35,1,Churned
12/22/2023 4:03,00000000-0GHB-4N83-QX9K-JM48K2,Project Management,Internship,3/11/2024 18:00,1/22/2004,Male,India,united college of engineering and research,Software Engineering,3/11/2024 12:02,Team Allocated,1070,12/22/2023 4:23,1/8/2024 3:30,2004-01-22_Male_India,2,CS / IT,0,16,63,19,1,Churned
12/20/2023 21:24,00000000-10RQ-JXA9-NNKD-EW5RCF,UX Redesign Challenge,Competition,4/19/2024 18:29,8/7/2002,Male,United States,Saint Louis University,Information Systems,3/11/2024 12:03,Team Allocated,1070,2/2/2024 7:19,2/15/2024 18:30,2002-08-07_Male_United States,2,Other,43,13,63,21,1,Churned
12/20/2023 21:24,00000000-106T-FSAJ-KDBX-40ZGNV,UrbanRenew Challenge,Competition,4/29/2024 18:29,8/7/2002,Male,United States,Saint Louis University,Information Systems,3/11/2024 12:03,Team Allocated,1070,2/22/2024 8:12,3/21/2024 18:30,2002-08-07_Male_United States,2,Other,63,28,38,21,1,Churned
12/20/2023 16:12,00000000-10RQ-JXA9-NNKD-EW5RCF,UX Redesign Challenge,Competition,4/19/2024 18:29,2/15/2000,Female,India,Saint Louis University,Computer Information Systems,3/11/2024 12:03,Team Allocated,1070,1/26/2024 3:30,2/15/2024 18:30,2000-02-15_Female_India,2,CS / IT,36,20,63,23,1,Churned
12/20/2023 16:12,00000000-106T-FSAJ-KDBX-40ZGNV,UrbanRenew Challenge,Competition,4/29/2024 18:29,2/15/2000,Female,India,Saint Louis University,Computer Information Systems,3/11/2024 12:03,Team Allocated,1070,1/26/2024 3:29,3/21/2024 18:30,2000-02-15_Female_India,2,CS / IT,36,55,38,23,1,Churned
12/20/2023 16:12,00000000-0GRA-BD28-CXVV-EYEX21,Health Care Management,Internship,,2/15/2000,Female,India,Saint Louis University,Computer Information Systems,3/11/2024 12:02,Team Allocated,1070,12/20/2023 16:38,1/8/2024 3:30,2000-02-15_Female_India,2,CS / IT,0,18,,23,1,Churned
12/20/2023 11:23,00000000-0GWQ-AXC5-X45C-2MHJ28,Data Visualization,Internship,3/11/2024 18:00,7/20/2002,Male,Singapore,Yishun Junior College,Electrical Engineering,3/11/2024 12:02,Team Allocated,1070,12/20/2023 12:46,1/8/2024 3:30,2002-07-20_Male_Singapore,2,Engineering,0,18,63,21,1,Churned
1/4/2024 12:46,00000000-0GZY-NNHV-FJWW-PTA9VX,Innovation & Entrepreneurship,Internship,3/11/2024 18:00,5/4/2007,Female,India,Lotus valley international school,Business and Management Studies,3/11/2024 12:02,Team Allocated,1070,1/4/2024 13:11,1/8/2024 3:30,2007-05-04_Female_India,2,Business,0,3,63,16,1,Churned
12/20/2023 11:23,00000000-0GZY-NNHV-FJWW-PTA9VX,Innovation & Entrepreneurship,Internship,3/11/2024 18:00,7/20/2002,Male,Singapore,Yishun Junior College,Electrical Engineering,3/11/2024 12:02,Team Allocated,1070,12/20/2023 12:35,1/8/2024 3:30,2002-07-20_Male_Singapore,2,Engineering,0,18,63,21,1,Churned
12/19/2023 19:18,00000000-106T-FSAJ-KDBX-40ZGNV,UrbanRenew Challenge,Competition,4/29/2024 18:29,4/25/2001,Female,United States,saint louis university,Bioinformatics,3/11/2024 12:03,Team Allocated,1070,2/11/2024 3:03,3/21/2024 18:30,2001-04-25_Female_United States,2,Other,53,39,38,22,1,Churned
12/28/2023 6:59,00000000-106T-FSAJ-KDBX-40ZGNV,UrbanRenew Challenge,Competition,4/29/2024 18:29,11/27/2000,Male,United States,Saint Louis university,Computer Science,3/11/2024 12:03,Team Allocated,1070,1/25/2024 22:29,3/21/2024 18:30,2000-11-27_Male_United States,2,CS / IT,28,55,38,23,1,Churned
12/19/2023 19:18,00000000-0GRA-BD28-CXVV-EYEX21,Health Care Management,Internship,,4/25/2001,Female,United States,saint louis university,Bioinformatics,3/11/2024 12:02,Team Allocated,1070,12/19/2023 19:48,1/8/2024 3:30,2001-04-25_Female_United States,2,Other,0,19,,22,1,Churned
12/19/2023 15:51,00000000-0GRA-BD28-CXVV-EYEX21,Health Care Management,Internship,,1/13/2000,Female,India,Saint louis University,Information Systems,3/11/2024 12:02,Team Allocated,1070,12/21/2023 18:38,1/8/2024 3:30,2000-01-13_Female_India,2,Other,2,17,,23,1,Churned
12/19/2023 5:23,00000000-106T-FSAJ-KDBX-40ZGNV,UrbanRenew Challenge,Competition,4/29/2024 18:29,11/10/1998,Female,United States,Saint Louis University,Health Data Science,3/11/2024 12:03,Team Allocated,1070,2/7/2024 6:45,3/21/2024 18:30,1998-11-10_Female_United States,2,Other,50,43,38,25,1,Churned
12/19/2023 5:23,00000000-0GRA-BD28-CXVV-EYEX21,Health Care Management,Internship,,11/10/1998,Female,United States,Saint Louis University,Health Data Science,3/11/2024 12:02,Team Allocated,1070,12/19/2023 5:39,1/8/2024 3:30,1998-11-10_Female_United States,2,Other,0,19,,25,1,Churned
12/19/2023 2:30,00000000-0GNT-FT74-MZT8-93VC0G,Digital Marketing,Internship,3/11/2024 18:00,6/18/2002,Female,United States,saint louis university,Computer Science,3/11/2024 12:02,Team Allocated,1070,12/25/2023 1:04,1/8/2024 3:30,2002-06-18_Female_United States,2,CS / IT,5,14,63,21,1,Churned
12/19/2023 2:30,00000000-0GN2-A0AY-7XK8-C5FZPP,Career Essentials: Getting Started with Your Professional Journey,Course,6/29/2024 18:52,6/18/2002,Female,United States,saint louis university,Computer Science,3/11/2024 12:01,Team Allocated,1070,,11/3/2022 18:30,2002-06-18_Female_United States,2,CS / IT,,,604,21,1,Churned
12/17/2023 23:47,00000000-106T-FSAJ-KDBX-40ZGNV,UrbanRenew Challenge,Competition,4/29/2024 18:29,3/30/1998,Male,United States,saint louis university,Epidemiology,3/11/2024 12:03,Team Allocated,1070,1/28/2024 7:40,3/21/2024 18:30,1998-03-30_Male_United States,2,Other,41,53,38,25,1,Churned
12/17/2023 23:47,00000000-0GRA-BD28-CXVV-EYEX21,Health Care Management,Internship,,3/30/1998,Male,United States,saint louis university,Epidemiology,3/11/2024 12:02,Team Allocated,1070,12/17/2023 23:59,1/8/2024 3:30,1998-03-30_Male_United States,2,Other,0,21,,25,1,Churned
12/17/2023 2:35,00000000-0GRA-BD28-CXVV-EYEX21,Health Care Management,Internship,,10/11/1997,Male,United States,Saint Louis University,Computer Science,3/11/2024 12:02,Team Allocated,1070,12/17/2023 2:45,1/8/2024 3:30,1997-10-11_Male_United States,2,CS / IT,0,22,,26,1,Churned
12/26/2023 21:18,00000000-0GRA-BD28-CXVV-EYEX21,Health Care Management,Internship,,4/7/2000,Female,United States,Saint Louis University,Information Systems,3/11/2024 12:02,Team Allocated,1070,12/26/2023 21:53,1/8/2024 3:30,2000-04-07_Female_United States,2,Other,0,12,,23,1,Churned
12/27/2023 17:27,00000000-0GRA-BD28-CXVV-EYEX21,Health Care Management,Internship,,11/25/1995,Male,United States,saint louis university,Health Data Science,3/11/2024 12:02,Team Allocated,1070,12/27/2023 17:40,1/8/2024 3:30,1995-11-25_Male_United States,2,Other,0,11,,28,1,Churned
12/28/2023 6:59,00000000-0GWQ-AXC5-X45C-2MHJ28,Data Visualization,Internship,3/11/2024 18:00,11/27/2000,Male,United States,Saint Louis university,Computer Science,3/11/2024 12:02,Team Allocated,1070,12/28/2023 15:06,1/8/2024 3:30,2000-11-27_Male_United States,2,CS / IT,0,10,63,23,1,Churned
12/6/2023 6:21,00000000-0GRA-BD28-CXVV-EYEX21,Health Care Management,Internship,,5/20/1994,Female,United States,Saint Louis University,Information Systems,3/11/2024 12:02,Team Allocated,1070,12/6/2023 6:55,1/8/2024 3:30,1994-05-20_Female_United States,2,Other,0,32,,29,1,Churned
12/5/2023 12:31,00000000-0GRA-BD28-CXVV-EYEX21,Health Care Management,Internship,,11/21/2000,Male,India,Saint Louis University,Information Systems,3/11/2024 12:02,Team Allocated,1070,12/6/2023 14:31,1/8/2024 3:30,2000-11-21_Male_India,2,Other,1,32,,23,1,Churned
12/3/2023 10:00,00000000-106T-FSAJ-KDBX-40ZGNV,UrbanRenew Challenge,Competition,4/29/2024 18:29,10/31/1999,Male,Ghana,Kwame Nkrumah university of Science and Technology,Land Economy,3/11/2024 12:03,Team Allocated,1070,2/22/2024 13:10,3/21/2024 18:30,1999-10-31_Male_Ghana,2,Other,81,28,38,24,1,Churned
12/10/2023 16:28,00000000-0GRA-BD28-CXVV-EYEX21,Health Care Management,Internship,,3/31/1999,Female,India,University of Lucknow,Psychology,3/11/2024 12:02,Team Allocated,1070,12/10/2023 17:16,1/8/2024 3:30,1999-03-31_Female_India,2,Other,0,28,,24,1,Churned
12/12/2023 20:40,00000000-0GRA-BD28-CXVV-EYEX21,Health Care Management,Internship,,8/15/1991,Male,India,Indian Institute of Information Technology  Allahabad,Information Technology,3/11/2024 12:02,Team Allocated,1070,12/12/2023 20:55,1/8/2024 3:30,1991-08-15_Male_India,2,Other,0,26,,32,1,Churned
12/12/2023 7:11,00000000-0GRA-BD28-CXVV-EYEX21,Health Care Management,Internship,,10/18/2002,Male,India,Sri Guru Gobind Singh College Of Commerce  Delhi University,Accounting and Finance,3/11/2024 12:02,Team Allocated,1070,12/12/2023 12:44,1/8/2024 3:30,2002-10-18_Male_India,2,Other,0,26,,21,1,Churned
12/12/2023 6:22,00000000-0GRA-BD28-CXVV-EYEX21,Health Care Management,Internship,,1/2/2001,Female,United States,SAINT LOUIS UNIVERSITY,Computer Information Systems,3/11/2024 12:02,Team Allocated,1070,12/12/2023 19:11,1/8/2024 3:30,2001-01-02_Female_United States,2,CS / IT,0,26,,22,1,Churned
12/12/2023 6:22,00000000-0GNT-FT74-MZT8-93VC0G,Digital Marketing,Internship,3/11/2024 18:00,1/2/2001,Female,United States,SAINT LOUIS UNIVERSITY,Computer Information Systems,3/11/2024 12:02,Team Allocated,1070,12/12/2023 19:23,1/8/2024 3:30,2001-01-02_Female_United States,2,CS / IT,0,26,63,22,1,Churned
12/12/2023 4:52,00000000-0GRA-BD28-CXVV-EYEX21,Health Care Management,Internship,,11/7/2001,Male,United States,Saintlouis university,Electrical and Computer Engineering,3/11/2024 12:02,Team Allocated,1070,12/12/2023 5:07,1/8/2024 3:30,2001-11-07_Male_United States,2,CS / IT,0,26,,22,1,Churned
12/12/2023 4:35,00000000-0GWQ-AXC5-X45C-2MHJ28,Data Visualization,Internship,3/11/2024 18:00,11/13/1996,Female,India,G naraynamma institute of technology and science,Job,3/11/2024 12:02,Team Allocated,1070,12/12/2023 4:55,1/8/2024 3:30,1996-11-13_Female_India,2,Other,0,26,63,27,1,Churned
12/11/2023 18:13,00000000-0GRA-BD28-CXVV-EYEX21,Health Care Management,Internship,,6/5/1996,Male,United States,Harrisburg University of Science and Technology,Bioinformatics,3/11/2024 12:02,Team Allocated,1070,12/11/2023 18:32,1/8/2024 3:30,1996-06-05_Male_United States,2,Other,0,27,,27,1,Churned
12/11/2023 14:39,00000000-0GRA-BD28-CXVV-EYEX21,Health Care Management,Internship,,8/28/1993,Male,Nigeria,International Islamic University Chittagong,Pharmacy and Pharmacology,3/11/2024 12:02,Team Allocated,1070,12/11/2023 15:21,1/8/2024 3:30,1993-08-28_Male_Nigeria,2,Other,0,27,,30,1,Churned
12/11/2023 8:39,00000000-0GRA-BD28-CXVV-EYEX21,Health Care Management,Internship,,9/5/2001,Male,India,Saint Louis University,Computer Science,3/11/2024 12:02,Team Allocated,1070,12/12/2023 13:46,1/8/2024 3:30,2001-09-05_Male_India,2,CS / IT,1,26,,22,1,Churned
12/11/2023 6:06,00000000-0GRA-BD28-CXVV-EYEX21,Health Care Management,Internship,,5/31/1999,Female,United States,Saint louis university,Health Data Science,3/11/2024 12:02,Team Allocated,1070,12/16/2023 6:36,1/8/2024 3:30,1999-05-31_Female_United States,2,Other,5,22,,24,1,Churned
12/11/2023 1:15,00000000-0GRA-BD28-CXVV-EYEX21,Health Care Management,Internship,,7/25/1985,Female,United Kingdom,Open University,Medical Sciences,3/11/2024 12:02,Team Allocated,1070,12/11/2023 1:28,1/8/2024 3:30,1985-07-25_Female_United Kingdom,2,Other,0,28,,38,1,Churned
12/10/2023 18:53,00000000-0GN2-A0AY-7XK8-C5FZPP,Career Essentials: Getting Started with Your Professional Journey,Course,6/29/2024 18:52,4/30/1999,Male,United States,Saint Louis University,Information Systems,3/11/2024 12:01,Team Allocated,1070,,11/3/2022 18:30,1999-04-30_Male_United States,2,Other,,,604,24,1,Churned
12/9/2023 9:37,00000000-0GRA-BD28-CXVV-EYEX21,Health Care Management,Internship,,11/16/1995,Female,India,saint louis university,Public Health,3/11/2024 12:02,Team Allocated,1070,12/10/2023 15:03,1/8/2024 3:30,1995-11-16_Female_India,2,Other,1,28,,28,1,Churned
12/14/2023 16:20,00000000-100J-PM3A-0WJ8-5T68M5,Jump Start: Developing your Emotional Intelligence,Course,12/24/2025 3:34,8/30/2001,Male,United States,Saint Louis University,Information Systems,3/11/2024 12:03,Team Allocated,1070,1/28/2024 2:02,1/28/2024 23:30,2001-08-30_Male_United States,2,Other,44,0,695,22,1,Churned
12/9/2023 5:13,00000000-0GWQ-AXC5-X45C-2MHJ28,Data Visualization,Internship,3/11/2024 18:00,9/27/1998,Male,United States,Saint Louis University,Information Systems,3/11/2024 12:02,Team Allocated,1070,12/28/2023 4:36,1/8/2024 3:30,1998-09-27_Male_United States,2,Other,18,10,63,25,1,Churned
12/9/2023 5:13,00000000-0GRA-BD28-CXVV-EYEX21,Health Care Management,Internship,,9/27/1998,Male,United States,Saint Louis University,Information Systems,3/11/2024 12:02,Team Allocated,1070,12/12/2023 2:48,1/8/2024 3:30,1998-09-27_Male_United States,2,Other,2,27,,25,1,Churned
12/9/2023 2:59,00000000-0GRA-BD28-CXVV-EYEX21,Health Care Management,Internship,,1/1/1990,Female,United States,Saint louis University,Health Data Science,3/11/2024 12:02,Team Allocated,1070,12/9/2023 3:36,1/8/2024 3:30,1990-01-01_Female_United States,2,Other,0,29,,33,1,Churned
12/8/2023 15:36,00000000-100J-PM3A-0WJ8-5T68M5,Jump Start: Developing your Emotional Intelligence,Course,12/24/2025 3:34,11/10/2003,Male,India,ANANTHA LAKSHMI INSTITUTE OF TECHNOLOGY AND SCIENCES,Artificial Intelligence and Machine learning,3/11/2024 12:03,Team Allocated,1070,1/26/2024 13:09,1/28/2024 23:30,2003-11-10_Male_India,2,Other,48,2,695,20,1,Churned
12/8/2023 15:35,00000000-0GRA-BD28-CXVV-EYEX21,Health Care Management,Internship,,6/16/2001,Male,India,Saint Louis University,Computer Science,3/11/2024 12:02,Team Allocated,1070,12/8/2023 19:09,1/8/2024 3:30,2001-06-16_Male_India,2,CS / IT,0,30,,22,1,Churned
11/2/2023 13:49,00000000-0GRA-BD28-CXVV-EYEX21,Health Care Management,Internship,,1/9/1998,Male,Nigeria,Kogi State University,Biochemistry,3/11/2024 12:02,Team Allocated,1070,11/2/2023 18:19,1/8/2024 3:30,1998-01-09_Male_Nigeria,2,Other,0,66,,25,1,Churned
12/7/2023 21:36,00000000-10RQ-JXA9-NNKD-EW5RCF,UX Redesign Challenge,Competition,4/19/2024 18:29,8/20/2001,Male,United States,Saint Louis University,Business Analytics,3/11/2024 12:03,Team Allocated,1070,2/12/2024 19:49,2/15/2024 18:30,2001-08-20_Male_United States,2,Business,66,2,63,22,1,Churned
12/7/2023 21:36,00000000-106T-FSAJ-KDBX-40ZGNV,UrbanRenew Challenge,Competition,4/29/2024 18:29,8/20/2001,Male,United States,Saint Louis University,Business Analytics,3/11/2024 12:03,Team Allocated,1070,2/12/2024 19:49,3/21/2024 18:30,2001-08-20_Male_United States,2,Business,66,37,38,22,1,Churned
12/7/2023 19:57,00000000-0GRA-BD28-CXVV-EYEX21,Health Care Management,Internship,,8/30/1998,Male,United States,SAINT LOUIS UNIVERSITY,Health Data Science,3/11/2024 12:02,Team Allocated,1070,12/7/2023 20:09,1/8/2024 3:30,1998-08-30_Male_United States,2,Other,0,31,,25,1,Churned
12/7/2023 13:33,00000000-0GRA-BD28-CXVV-EYEX21,Health Care Management,Internship,,4/30/2000,Female,Nigeria,University of Uyo,Home Economics,3/11/2024 12:02,Team Allocated,1070,12/7/2023 13:59,1/8/2024 3:30,2000-04-30_Female_Nigeria,2,Other,0,31,,23,1,Churned
1/4/2024 12:46,00000000-0GZY-NNHV-FJWW-PTA9VX,Innovation & Entrepreneurship,Internship,3/11/2024 18:00,2/10/2008,Female,India,Lotus valley international school,Accounting and Finance,3/11/2024 12:02,Team Allocated,1070,1/4/2024 13:17,1/8/2024 3:30,2008-02-10_Female_India,2,Other,0,3,63,15,1,Churned
8/21/2023 13:27,00000000-10QW-PYTT-CJCX-7VQBTT,Join a Student Organisation,Engagement,12/5/2025 12:59,9/28/2001,Male,India,Saint Louis University,Information Systems,3/11/2024 12:02,Team Allocated,1070,,8/21/2023 6:30,2001-09-28_Male_India,2,Other,,,837,21,1,Churned
12/14/2023 11:08,00000000-0GRA-BD28-CXVV-EYEX21,Health Care Management,Internship,,6/4/2000,Female,Ghana,University of Ghana,Engineering,3/11/2024 12:02,Team Allocated,1070,12/14/2023 11:34,1/8/2024 3:30,2000-06-04_Female_Ghana,2,Engineering,0,24,,23,1,Churned
12/14/2023 20:09,00000000-0GRA-BD28-CXVV-EYEX21,Health Care Management,Internship,,12/31/1983,Female,United Kingdom,The Open University,Public Health,3/11/2024 12:02,Team Allocated,1070,12/18/2023 19:54,1/8/2024 3:30,1983-12-31_Female_United Kingdom,2,Other,3,20,,39,1,Churned
12/3/2023 9:17,00000000-0GRA-BD28-CXVV-EYEX21,Health Care Management,Internship,,6/6/1997,Male,Ghana,Kwame Nkrumah University of Science and Technology,Marketing,3/11/2024 12:02,Team Allocated,1070,12/3/2023 11:33,1/8/2024 3:30,1997-06-06_Male_Ghana,2,Other,0,35,,26,1,Churned
11/22/2023 18:08,00000000-0GRA-BD28-CXVV-EYEX21,Health Care Management,Internship,,10/6/2000,Male,India,saint louis University,Information Systems,3/11/2024 12:02,Team Allocated,1070,11/25/2023 7:08,1/8/2024 3:30,2000-10-06_Male_India,2,Other,2,43,,23,1,Churned
12/2/2023 1:54,00000000-0GRA-BD28-CXVV-EYEX21,Health Care Management,Internship,,4/29/2004,Female,India,Vignan University,Bba Hr,3/11/2024 12:02,Team Allocated,1070,12/2/2023 5:47,1/8/2024 3:30,2004-04-29_Female_India,2,Other,0,36,,19,1,Churned
12/1/2023 22:13,00000000-0GRA-BD28-CXVV-EYEX21,Health Care Management,Internship,,5/5/1998,Male,United States,webster University,Information Technology and Management,3/11/2024 12:02,Team Allocated,1070,12/1/2023 22:23,1/8/2024 3:30,1998-05-05_Male_United States,2,Business,0,37,,25,1,Churned
12/1/2023 21:37,00000000-0GRA-BD28-CXVV-EYEX21,Health Care Management,Internship,,5/28/1989,Female,United States,Saint Louis University,Health Data Science,3/11/2024 12:02,Team Allocated,1070,12/6/2023 20:43,1/8/2024 3:30,1989-05-28_Female_United States,2,Other,4,32,,34,1,Churned
12/1/2023 8:56,00000000-10RQ-JXA9-NNKD-EW5RCF,UX Redesign Challenge,Competition,4/19/2024 18:29,8/19/2002,Female,India,Christ University,Computer Science and Engineering,3/11/2024 12:03,Team Allocated,1070,1/24/2024 16:30,2/15/2024 18:30,2002-08-19_Female_India,2,CS / IT,54,22,63,21,1,Churned
11/30/2023 20:17,00000000-106T-FSAJ-KDBX-40ZGNV,UrbanRenew Challenge,Competition,4/29/2024 18:29,4/27/1998,Female,United States,saint louis,Information Systems,3/11/2024 12:03,Team Allocated,1070,3/2/2024 3:47,3/21/2024 18:30,1998-04-27_Female_United States,2,Other,92,19,38,25,1,Churned
11/29/2023 21:11,00000000-0GRA-BD28-CXVV-EYEX21,Health Care Management,Internship,,10/5/2005,Female,United States,Ooltewah High School,Medicine,3/11/2024 12:02,Team Allocated,1070,11/29/2023 23:04,1/8/2024 3:30,2005-10-05_Female_United States,2,Other,0,39,,18,1,Churned
11/29/2023 17:27,00000000-0GRA-BD28-CXVV-EYEX21,Health Care Management,Internship,,8/9/1998,Female,United States,Saint Louis University I,Health Data Science,3/11/2024 12:02,Team Allocated,1070,12/6/2023 18:03,1/8/2024 3:30,1998-08-09_Female_United States,2,Other,7,32,,25,1,Churned
11/29/2023 10:45,00000000-0GHB-4N83-QX9K-JM48K2,Project Management,Internship,3/11/2024 18:00,11/7/2004,Male,Nigeria,Great faith alive school,Nursing,3/11/2024 12:02,Team Allocated,1070,11/29/2023 18:12,1/8/2024 3:30,2004-11-07_Male_Nigeria,2,Other,0,39,63,19,1,Churned
11/29/2023 10:45,00000000-0GRA-BD28-CXVV-EYEX21,Health Care Management,Internship,,11/7/2004,Male,Nigeria,Great faith alive school,Nursing,3/11/2024 12:02,Team Allocated,1070,11/29/2023 18:17,1/8/2024 3:30,2004-11-07_Male_Nigeria,2,Other,0,39,,19,1,Churned
11/27/2023 21:45,00000000-0GRA-BD28-CXVV-EYEX21,Health Care Management,Internship,,8/30/1997,Male,United States,saint louis university,Information Systems,3/11/2024 12:02,Team Allocated,1070,11/27/2023 22:00,1/8/2024 3:30,1997-08-30_Male_United States,2,Other,0,41,,26,1,Churned
11/24/2023 11:18,00000000-0GNT-FT74-MZT8-93VC0G,Digital Marketing,Internship,3/11/2024 18:00,4/26/1995,Female,Ghana,,Digital Marketing,3/11/2024 12:02,Team Allocated,1070,11/24/2023 11:37,1/8/2024 3:30,1995-04-26_Female_Ghana,2,CS / IT,0,44,63,28,1,Churned
11/23/2023 13:09,00000000-0GRA-BD28-CXVV-EYEX21,Health Care Management,Internship,,5/18/2003,Male,India,SRM Institute of Science and Technology,Computer Science and Engineering,3/11/2024 12:02,Team Allocated,1070,11/23/2023 13:26,1/8/2024 3:30,2003-05-18_Male_India,2,CS / IT,0,45,,20,1,Churned
11/21/2023 2:00,00000000-0GRA-BD28-CXVV-EYEX21,Health Care Management,Internship,,3/12/2000,Male,United States,Saint louis University,Health Data Science,3/11/2024 12:02,Team Allocated,1070,11/21/2023 2:09,1/8/2024 3:30,2000-03-12_Male_United States,2,Other,0,48,,23,1,Churned
12/6/2023 22:50,00000000-0GRA-BD28-CXVV-EYEX21,Health Care Management,Internship,,3/21/1994,Male,United States,st louis university,Health Data Science,3/11/2024 12:02,Team Allocated,1070,12/6/2023 23:04,1/8/2024 3:30,1994-03-21_Male_United States,2,Other,0,32,,29,1,Churned
11/16/2023 12:13,00000000-0GRA-BD28-CXVV-EYEX21,Health Care Management,Internship,,10/2/2007,Male,India,Diksha rising star,Medicine,3/11/2024 12:02,Team Allocated,1070,11/16/2023 12:35,1/8/2024 3:30,2007-10-02_Male_India,2,Other,0,52,,16,1,Churned
11/15/2023 13:19,00000000-0GRA-BD28-CXVV-EYEX21,Health Care Management,Internship,,12/13/2003,Female,Nigeria,Osun state University,Anatomy and Physiology,3/11/2024 12:02,Team Allocated,1070,12/2/2023 9:20,1/8/2024 3:30,2003-12-13_Female_Nigeria,2,Other,16,36,,19,1,Churned
11/12/2023 11:07,00000000-0GWQ-AXC5-X45C-2MHJ28,Data Visualization,Internship,3/11/2024 18:00,7/16/1993,Male,India,priyadarshini college of engineering,Artificial Intelligence and Data Science,3/11/2024 12:02,Team Allocated,1070,11/12/2023 11:20,1/8/2024 3:30,1993-07-16_Male_India,2,Other,0,56,63,30,1,Churned
11/11/2023 23:13,00000000-0GRA-BD28-CXVV-EYEX21,Health Care Management,Internship,,7/9/1999,Female,United States,saint louis university,Health Data Science,3/11/2024 12:02,Team Allocated,1070,11/11/2023 23:26,1/8/2024 3:30,1999-07-09_Female_United States,2,Other,0,57,,24,1,Churned
11/11/2023 2:11,00000000-0GRA-BD28-CXVV-EYEX21,Health Care Management,Internship,,1/19/2000,Female,India,sree ratna college of physiotherapy,To Study,3/11/2024 12:02,Team Allocated,1070,11/11/2023 3:17,1/8/2024 3:30,2000-01-19_Female_India,2,Other,0,58,,23,1,Churned
11/9/2023 18:24,00000000-0GRA-BD28-CXVV-EYEX21,Health Care Management,Internship,,12/12/2003,Female,United States,Illinois Institute of Technology,Biomedical Engineering,3/11/2024 12:02,Team Allocated,1070,11/9/2023 18:30,1/8/2024 3:30,2003-12-12_Female_United States,2,Engineering,0,59,,19,1,Churned
11/9/2023 17:28,00000000-0GRA-BD28-CXVV-EYEX21,Health Care Management,Internship,,6/13/2001,Female,United States,Saint Louis University,Business Analytics,3/11/2024 12:02,Team Allocated,1070,12/6/2023 21:10,1/8/2024 3:30,2001-06-13_Female_United States,2,Business,27,32,,22,1,Churned
11/8/2023 15:41,00000000-0GRA-BD28-CXVV-EYEX21,Health Care Management,Internship,,8/2/1998,Male,Ghana,Kwame Nkrumah University Of Science And Technology,Marketing,3/11/2024 12:02,Team Allocated,1070,11/20/2023 10:33,1/8/2024 3:30,1998-08-02_Male_Ghana,2,Other,11,48,,25,1,Churned
11/7/2023 14:25,00000000-0GRA-BD28-CXVV-EYEX21,Health Care Management,Internship,,12/29/1998,Female,United States,saint louis university,Health Data Science,3/11/2024 12:02,Team Allocated,1070,11/7/2023 14:34,1/8/2024 3:30,1998-12-29_Female_United States,2,Other,0,61,,24,1,Churned
12/6/2023 3:48,00000000-0GRA-BD28-CXVV-EYEX21,Health Care Management,Internship,,8/8/2001,Female,India,Saint louis university,Information Systems,3/11/2024 12:02,Team Allocated,1070,12/6/2023 4:25,1/8/2024 3:30,2001-08-08_Female_India,2,Other,0,32,,22,1,Churned
12/6/2023 7:30,00000000-0GRA-BD28-CXVV-EYEX21,Health Care Management,Internship,,11/23/1999,Female,United States,SAINT LOUIS UNIVERSITY,INFORMATION SYSTEMS,3/11/2024 12:02,Team Allocated,1070,12/6/2023 7:44,1/8/2024 3:30,1999-11-23_Female_United States,2,Other,0,32,,24,1,Churned
12/14/2023 21:00,00000000-0GRA-BD28-CXVV-EYEX21,Health Care Management,Internship,,4/27/1999,Male,India,Saint Louis University,Information Systems,3/11/2024 12:02,Team Allocated,1070,12/15/2023 6:17,1/8/2024 3:30,1999-04-27_Male_India,2,Other,0,23,,24,1,Churned
11/2/2023 15:09,00000000-0GRA-BD28-CXVV-EYEX21,Health Care Management,Internship,,2/28/2003,Male,India,KL Deemed to be University,Computer Science,3/11/2024 12:02,Team Allocated,1070,11/2/2023 15:39,1/8/2024 3:30,2003-02-28_Male_India,2,CS / IT,0,66,,20,1,Churned
8/31/2023 19:20,00000000-0GRA-BD28-CXVV-EYEX21,Health Care Management,Internship,,7/26/1998,Female,Nigeria,University of Ibadan,Biomedical Science,3/11/2024 12:02,Team Allocated,1070,9/3/2023 9:06,1/8/2024 3:30,1998-07-26_Female_Nigeria,2,Other,2,126,,25,1,Churned
8/31/2023 5:20,00000000-0GHB-4N83-QX9K-JM48K2,Project Management,Internship,3/11/2024 18:00,9/3/1991,Male,Nigeria,Kaduna polytechnic,Other,3/11/2024 12:02,Team Allocated,1070,8/31/2023 8:03,1/8/2024 3:30,1991-09-03_Male_Nigeria,2,Other,0,129,63,32,1,Churned
10/3/2023 1:43,00000000-10YM-B80K-RNNJ-YAVQ7V,Upload Your First Year Transcript,Engagement,12/6/2025 10:26,9/24/2000,Female,United States,Saint Louis University,Information Systems,3/11/2024 12:02,Team Allocated,1070,,5/31/2024 7:04,2000-09-24_Female_United States,2,Other,,,554,23,1,Churned
10/11/2023 4:28,00000000-106T-FSAJ-KDBX-40ZGNV,UrbanRenew Challenge,Competition,4/29/2024 18:29,7/13/2001,Female,United States,Centurion University,Masters,3/11/2024 12:03,Team Allocated,1070,3/2/2024 20:46,3/21/2024 18:30,2001-07-13_Female_United States,2,Other,143,18,38,22,1,Churned
11/1/2023 16:58,00000000-0GRA-BD28-CXVV-EYEX21,Health Care Management,Internship,,12/6/2001,Male,Nigeria,Osun State University,Anatomy and Physiology,3/11/2024 12:02,Team Allocated,1070,11/4/2023 5:17,1/8/2024 3:30,2001-12-06_Male_Nigeria,2,Other,2,64,,21,1,Churned
10/31/2023 5:40,00000000-0GRA-BD28-CXVV-EYEX21,Health Care Management,Internship,,11/5/2001,Female,United States,Depaul University,Computer Science,3/11/2024 12:02,Team Allocated,1070,10/31/2023 5:58,1/8/2024 3:30,2001-11-05_Female_United States,2,CS / IT,0,68,,22,1,Churned
10/30/2023 6:13,00000000-0GRA-BD28-CXVV-EYEX21,Health Care Management,Internship,,10/14/2000,Male,India,KBT COLLEGE OF ENGINEERING,Data Science,3/11/2024 12:02,Team Allocated,1070,11/18/2023 13:16,1/8/2024 3:30,2000-10-14_Male_India,2,Other,19,50,,23,1,Churned
10/28/2023 4:46,00000000-0GRA-BD28-CXVV-EYEX21,Health Care Management,Internship,,7/30/2002,Female,United States,saint louis university,Computer Science and Information Systems,3/11/2024 12:02,Team Allocated,1070,12/19/2023 6:11,1/8/2024 3:30,2002-07-30_Female_United States,2,CS / IT,52,19,,21,1,Churned
10/28/2023 4:15,00000000-0GRA-BD28-CXVV-EYEX21,Health Care Management,Internship,,9/23/2001,Male,United States,Saint Louis University,Information Systems,3/11/2024 12:02,Team Allocated,1070,12/14/2023 21:55,1/8/2024 3:30,2001-09-23_Male_United States,2,Other,47,24,,22,1,Churned
10/28/2023 4:02,00000000-0GRA-BD28-CXVV-EYEX21,Health Care Management,Internship,,5/23/2002,Female,United States,saint louis university,Information Systems,3/11/2024 12:02,Team Allocated,1070,12/30/2023 5:29,1/8/2024 3:30,2002-05-23_Female_United States,2,Other,63,8,,21,1,Churned
10/27/2023 21:25,00000000-0GRA-BD28-CXVV-EYEX21,Health Care Management,Internship,,5/31/2002,Female,United States,saint louis university,Information Systems,3/11/2024 12:02,Team Allocated,1070,12/14/2023 22:10,1/8/2024 3:30,2002-05-31_Female_United States,2,Other,48,24,,21,1,Churned
10/24/2023 21:01,00000000-0GRA-BD28-CXVV-EYEX21,Health Care Management,Internship,,4/29/2003,Female,United States,ST LOUIS UNIVERSITY,Information Systems,3/11/2024 12:02,Team Allocated,1070,12/11/2023 22:51,1/8/2024 3:30,2003-04-29_Female_United States,2,Other,48,27,,20,1,Churned
10/24/2023 13:18,00000000-0GRA-BD28-CXVV-EYEX21,Health Care Management,Internship,,6/16/1998,Male,India,Saint louis university,Computer Science,3/11/2024 12:02,Team Allocated,1070,11/6/2023 6:56,1/8/2024 3:30,1998-06-16_Male_India,2,CS / IT,12,62,,25,1,Churned
10/23/2023 7:33,00000000-106T-FSAJ-KDBX-40ZGNV,UrbanRenew Challenge,Competition,4/29/2024 18:29,7/23/2000,Male,United States,Saint Louis University,Information Systems,3/11/2024 12:03,Team Allocated,1070,2/25/2024 17:06,3/21/2024 18:30,2000-07-23_Male_United States,2,Other,125,25,38,23,1,Churned
10/21/2023 23:35,00000000-0GWQ-AXC5-X45C-2MHJ28,Data Visualization,Internship,3/11/2024 18:00,10/7/1997,Female,Kenya,Technical University of Kenya,Civil Engineering,3/11/2024 12:02,Team Allocated,1070,10/21/2023 23:46,1/8/2024 3:30,1997-10-07_Female_Kenya,2,Engineering,0,78,63,26,1,Churned
10/21/2023 20:31,00000000-0GNT-FT74-MZT8-93VC0G,Digital Marketing,Internship,3/11/2024 18:00,5/5/2007,Male,United States,Francis Howell North High School,Medical Marketing or Medical Administration,3/11/2024 12:02,Team Allocated,1070,10/21/2023 20:59,1/8/2024 3:30,2007-05-05_Male_United States,2,Other,0,78,63,16,1,Churned
10/20/2023 17:07,00000000-0GNT-FT74-MZT8-93VC0G,Digital Marketing,Internship,3/11/2024 18:00,10/3/2001,Female,Nigeria,University of Ilorin,Digital Marketing,3/11/2024 12:01,Team Allocated,1070,10/20/2023 18:13,1/8/2024 3:30,2001-10-03_Female_Nigeria,2,CS / IT,0,79,63,22,1,Churned
10/20/2023 14:44,00000000-0GRA-BD28-CXVV-EYEX21,Health Care Management,Internship,,3/24/2003,Male,India,ST. Joseph's Degree&PG College,Statistics,3/11/2024 12:02,Team Allocated,1070,11/10/2023 10:44,1/8/2024 3:30,2003-03-24_Male_India,2,Other,20,58,,20,1,Churned
10/20/2023 6:26,00000000-106T-FSAJ-KDBX-40ZGNV,UrbanRenew Challenge,Competition,4/29/2024 18:29,6/20/2000,Male,United States,Saint Louis University,Data Analytics,3/11/2024 12:03,Team Allocated,1070,2/24/2024 18:58,3/21/2024 18:30,2000-06-20_Male_United States,2,Other,127,25,38,23,1,Churned
10/19/2023 18:58,00000000-0GRA-BD28-CXVV-EYEX21,Health Care Management,Internship,,10/16/2001,Male,United States,Saint louis university,Information Systems,3/11/2024 12:02,Team Allocated,1070,11/2/2023 20:51,1/8/2024 3:30,2001-10-16_Male_United States,2,Other,14,66,,22,1,Churned
10/17/2023 15:35,00000000-0GHB-4N83-QX9K-JM48K2,Project Management,Internship,3/11/2024 18:00,4/21/1999,Male,India,BANSAL INSTITUTE OF SCIENCE AND TECHNOLOGY,Computer Science and Engineering,3/11/2024 12:02,Team Allocated,1070,12/8/2023 14:22,1/8/2024 3:30,1999-04-21_Male_India,2,CS / IT,51,30,63,24,1,Churned
10/17/2023 7:24,00000000-0GWQ-AXC5-X45C-2MHJ28,Data Visualization,Internship,3/11/2024 18:00,2/9/1994,Female,India,Kolhan University,Data Analysis,3/11/2024 12:02,Team Allocated,1070,10/17/2023 8:09,1/8/2024 3:30,1994-02-09_Female_India,2,Other,0,82,63,29,1,Churned
10/16/2023 13:16,00000000-0GWQ-AXC5-X45C-2MHJ28,Data Visualization,Internship,3/11/2024 18:00,5/28/2002,Male,India,University college of Technology  Osmania University,Chemical Engineering,3/11/2024 12:02,Team Allocated,1070,10/18/2023 13:44,1/8/2024 3:30,2002-05-28_Male_India,2,Engineering,2,81,63,21,1,Churned
10/15/2023 6:27,00000000-0GWQ-AXC5-X45C-2MHJ28,Data Visualization,Internship,3/11/2024 18:00,11/25/1994,Female,Nigeria,Osun State University,Cyber Security,3/11/2024 12:02,Team Allocated,1070,10/15/2023 7:00,1/8/2024 3:30,1994-11-25_Female_Nigeria,2,CS / IT,0,84,63,28,1,Churned
10/14/2023 20:59,00000000-0GRA-BD28-CXVV-EYEX21,Health Care Management,Internship,,3/31/2001,Male,United States,SAINT LOUIS UNIVERSITY,MASTERS in INFORMATION SYSTEMS,3/11/2024 12:02,Team Allocated,1070,11/25/2023 17:35,1/8/2024 3:30,2001-03-31_Male_United States,2,Other,41,43,,22,1,Churned
10/14/2023 18:26,00000000-0GRA-BD28-CXVV-EYEX21,Health Care Management,Internship,,3/12/2000,Female,United States,government city college,Nutrition Science,3/11/2024 12:02,Team Allocated,1070,10/14/2023 22:07,1/8/2024 3:30,2000-03-12_Female_United States,2,CS / IT,0,85,,23,1,Churned
10/13/2023 18:47,00000000-10RQ-JXA9-NNKD-EW5RCF,UX Redesign Challenge,Competition,4/19/2024 18:29,4/7/2001,Male,United States,SAINT LOUIS UNIVERSITY,Computer Science,3/11/2024 12:03,Team Allocated,1070,2/6/2024 20:07,2/15/2024 18:30,2001-04-07_Male_United States,2,CS / IT,116,8,63,22,1,Churned
10/13/2023 18:47,00000000-106T-FSAJ-KDBX-40ZGNV,UrbanRenew Challenge,Competition,4/29/2024 18:29,4/7/2001,Male,United States,SAINT LOUIS UNIVERSITY,Computer Science,3/11/2024 12:03,Team Allocated,1070,2/6/2024 20:06,3/21/2024 18:30,2001-04-07_Male_United States,2,CS / IT,116,43,38,22,1,Churned
10/12/2023 21:00,00000000-0GRA-BD28-CXVV-EYEX21,Health Care Management,Internship,,8/17/1998,Male,United States,saint louis university,Computer Information Systems,3/11/2024 12:02,Team Allocated,1070,10/14/2023 22:16,1/8/2024 3:30,1998-08-17_Male_United States,2,CS / IT,2,85,,25,1,Churned
10/12/2023 17:18,00000000-0GRA-BD28-CXVV-EYEX21,Health Care Management,Internship,,12/21/1999,Male,India,Saint Louis University,Health Data Science,3/11/2024 12:02,Team Allocated,1070,10/13/2023 15:13,1/8/2024 3:30,1999-12-21_Male_India,2,Other,0,86,,23,1,Churned
10/3/2023 1:43,00000000-10QW-PYTT-CJCX-7VQBTT,Join a Student Organisation,Engagement,12/5/2025 12:59,9/24/2000,Female,United States,Saint Louis University,Information Systems,3/11/2024 12:02,Team Allocated,1070,,8/21/2023 6:30,2000-09-24_Female_United States,2,Other,,,837,23,1,Churned
10/11/2023 4:28,00000000-0GRA-BD28-CXVV-EYEX21,Health Care Management,Internship,,7/13/2001,Female,United States,Centurion University,Masters,3/11/2024 12:02,Team Allocated,1070,10/11/2023 5:00,1/8/2024 3:30,2001-07-13_Female_United States,2,Other,0,88,,22,1,Churned
10/10/2023 8:56,00000000-0GRA-BD28-CXVV-EYEX21,Health Care Management,Internship,,12/14/1996,Male,Nigeria,University of Ibadan,Food Science,3/11/2024 12:02,Team Allocated,1070,10/10/2023 9:29,1/8/2024 3:30,1996-12-14_Male_Nigeria,2,Other,0,89,,26,1,Churned
10/6/2023 19:13,00000000-106T-FSAJ-KDBX-40ZGNV,UrbanRenew Challenge,Competition,4/29/2024 18:29,2/16/2001,Female,United States,Saint Louis University,Computer Science,3/11/2024 12:03,Team Allocated,1070,1/25/2024 16:11,3/21/2024 18:30,2001-02-16_Female_United States,2,CS / IT,110,56,38,22,1,Churned
9/12/2023 3:54,00000000-0GRA-BD28-CXVV-EYEX21,Health Care Management,Internship,,12/30/1997,Female,United States,saint Louis university,Information Systems,3/11/2024 12:02,Team Allocated,1070,9/12/2023 4:30,1/8/2024 3:30,1997-12-30_Female_United States,2,Other,0,117,,25,1,Churned
10/9/2023 19:46,00000000-0GRA-BD28-CXVV-EYEX21,Health Care Management,Internship,,10/18/1999,Female,United States,Saint Louis University,Information Systems,3/11/2024 12:02,Team Allocated,1070,10/9/2023 20:27,1/8/2024 3:30,1999-10-18_Female_United States,2,Other,0,90,,23,1,Churned
10/9/2023 14:01,00000000-0GRA-BD28-CXVV-EYEX21,Health Care Management,Internship,,1/24/2002,Female,India,MIT - WPU,Law and Legal Studies,3/11/2024 12:02,Team Allocated,1070,12/27/2023 6:19,1/8/2024 3:30,2002-01-24_Female_India,2,Other,78,11,,21,1,Churned
10/9/2023 10:21,00000000-0GWQ-AXC5-X45C-2MHJ28,Data Visualization,Internship,3/11/2024 18:00,11/28/2000,Female,India,Periyar maniammai institute of Science and technology,Bioinformatics,3/11/2024 12:02,Team Allocated,1070,10/9/2023 11:03,1/8/2024 3:30,2000-11-28_Female_India,2,Other,0,90,63,22,1,Churned
10/9/2023 10:21,00000000-0GZY-NNHV-FJWW-PTA9VX,Innovation & Entrepreneurship,Internship,3/11/2024 18:00,11/28/2000,Female,India,Periyar maniammai institute of Science and technology,Bioinformatics,3/11/2024 12:02,Team Allocated,1070,10/9/2023 11:01,1/8/2024 3:30,2000-11-28_Female_India,2,Other,0,90,63,22,1,Churned
10/9/2023 9:44,00000000-0GHB-4N83-QX9K-JM48K2,Project Management,Internship,3/11/2024 18:00,7/25/2000,Male,India,government college of engineering and research avasari  pune,Electronics and Communication,3/11/2024 12:02,Team Allocated,1070,10/9/2023 10:23,1/8/2024 3:30,2000-07-25_Male_India,2,Other,0,90,63,23,1,Churned
10/7/2023 18:02,00000000-0GWQ-AXC5-X45C-2MHJ28,Data Visualization,Internship,3/11/2024 18:00,1/9/2007,Male,India,DAV BOYS SENIOR SECONDARY SCHOOL,Aerospace Engineering,3/11/2024 12:02,Team Allocated,1070,10/7/2023 18:15,1/8/2024 3:30,2007-01-09_Male_India,2,Engineering,0,92,63,16,1,Churned
10/7/2023 17:15,00000000-0GRA-BD28-CXVV-EYEX21,Health Care Management,Internship,,9/30/1996,Male,Ghana,University for Development Studies,Pharmacy and Pharmacology,3/11/2024 12:02,Team Allocated,1070,10/7/2023 17:50,1/8/2024 3:30,1996-09-30_Male_Ghana,2,Other,0,92,,27,1,Churned
10/7/2023 13:45,00000000-0GNT-FT74-MZT8-93VC0G,Digital Marketing,Internship,3/11/2024 18:00,5/13/1985,Female,Nigeria,University of Benin,Biochemistry,3/11/2024 12:01,Team Allocated,1070,10/7/2023 13:59,1/8/2024 3:30,1985-05-13_Female_Nigeria,2,Other,0,92,63,38,1,Churned
10/6/2023 21:04,00000000-0GRA-BD28-CXVV-EYEX21,Health Care Management,Internship,,7/25/2000,Female,United States,Saint Louis University,Bioinformatics,3/11/2024 12:02,Team Allocated,1070,10/6/2023 21:58,1/8/2024 3:30,2000-07-25_Female_United States,2,Other,0,93,,23,1,Churned
10/6/2023 20:53,00000000-0GRA-BD28-CXVV-EYEX21,Health Care Management,Internship,,4/20/1999,Female,United States,Saint Louis University,Bioinformatics,3/11/2024 12:02,Team Allocated,1070,10/6/2023 21:29,1/8/2024 3:30,1999-04-20_Female_United States,2,Other,0,93,,24,1,Churned
10/6/2023 19:13,00000000-10RQ-JXA9-NNKD-EW5RCF,UX Redesign Challenge,Competition,4/19/2024 18:29,2/16/2001,Female,United States,Saint Louis University,Computer Science,3/11/2024 12:03,Team Allocated,1070,1/25/2024 16:08,2/15/2024 18:30,2001-02-16_Female_United States,2,CS / IT,110,21,63,22,1,Churned
10/6/2023 16:16,00000000-0GRA-BD28-CXVV-EYEX21,Health Care Management,Internship,,11/18/1998,Male,India,Saint Louis University,Computer Science,3/11/2024 12:02,Team Allocated,1070,10/6/2023 16:35,1/8/2024 3:30,1998-11-18_Male_India,2,CS / IT,0,93,,24,1,Churned
10/3/2023 1:43,00000000-106T-FSAJ-KDBX-40ZGNV,UrbanRenew Challenge,Competition,4/29/2024 18:29,9/24/2000,Female,United States,Saint Louis University,Information Systems,3/11/2024 12:03,Team Allocated,1070,2/9/2024 3:31,3/21/2024 18:30,2000-09-24_Female_United States,2,Other,129,41,38,23,1,Churned
10/6/2023 6:35,00000000-106T-FSAJ-KDBX-40ZGNV,UrbanRenew Challenge,Competition,4/29/2024 18:29,5/8/2000,Male,United States,Saint Louis University,Information Systems,3/11/2024 12:03,Team Allocated,1070,2/21/2024 6:07,3/21/2024 18:30,2000-05-08_Male_United States,2,Other,137,29,38,23,1,Churned
10/6/2023 1:38,00000000-0GRA-BD28-CXVV-EYEX21,Health Care Management,Internship,,4/16/1999,Male,United States,Saint Louis University,Information Systems,3/11/2024 12:02,Team Allocated,1070,10/6/2023 22:02,1/8/2024 3:30,1999-04-16_Male_United States,2,Other,0,93,,24,1,Churned
10/5/2023 17:48,00000000-0GRA-BD28-CXVV-EYEX21,Health Care Management,Internship,,8/31/2001,Male,United States,Saint Louis University,Computer Science,3/11/2024 12:02,Team Allocated,1070,10/6/2023 23:34,1/8/2024 3:30,2001-08-31_Male_United States,2,CS / IT,1,93,,22,1,Churned
10/5/2023 16:24,00000000-0GRA-BD28-CXVV-EYEX21,Health Care Management,Internship,,12/17/1989,Male,United States,Saint Louis University,Health Data Science,3/11/2024 12:02,Team Allocated,1070,10/5/2023 16:34,1/8/2024 3:30,1989-12-17_Male_United States,2,Other,0,94,,33,1,Churned
10/5/2023 13:04,00000000-0GRA-BD28-CXVV-EYEX21,Health Care Management,Internship,,4/20/2006,Female,Egypt,NIS- nermein ismail advanced education,Medicine,3/11/2024 12:02,Team Allocated,1070,10/5/2023 13:15,1/8/2024 3:30,2006-04-20_Female_Egypt,2,Other,0,94,,17,1,Churned
10/4/2023 21:22,00000000-0GRA-BD28-CXVV-EYEX21,Health Care Management,Internship,,5/6/1998,Female,United States,saint louis university,Health Data Science,3/11/2024 12:02,Team Allocated,1070,10/4/2023 21:38,1/8/2024 3:30,1998-05-06_Female_United States,2,Other,0,95,,25,1,Churned
10/3/2023 22:48,00000000-0GRA-BD28-CXVV-EYEX21,Health Care Management,Internship,,10/17/2000,Male,United States,saint louis university,Computer Information Systems,3/11/2024 12:02,Team Allocated,1070,12/19/2023 6:04,1/8/2024 3:30,2000-10-17_Male_United States,2,CS / IT,76,19,,22,1,Churned
10/3/2023 22:32,00000000-0GRA-BD28-CXVV-EYEX21,Health Care Management,Internship,,8/20/1998,Female,India,saint louis university,Health Data Science,3/11/2024 12:02,Team Allocated,1070,10/3/2023 22:54,1/8/2024 3:30,1998-08-20_Female_India,2,Other,0,96,,25,1,Churned
10/3/2023 22:32,00000000-0GRA-BD28-CXVV-EYEX21,Health Care Management,Internship,,10/12/1994,Female,India,SRM University,Health Data Science,3/11/2024 12:02,Team Allocated,1070,10/4/2023 7:14,1/8/2024 3:30,1994-10-12_Female_India,2,Other,0,95,,28,1,Churned
10/3/2023 19:44,00000000-0GRA-BD28-CXVV-EYEX21,Health Care Management,Internship,,9/21/2000,Female,United States,saint louis university,Business Analytics,3/11/2024 12:02,Team Allocated,1070,10/3/2023 21:14,1/8/2024 3:30,2000-09-21_Female_United States,2,Business,0,96,,23,1,Churned
10/3/2023 19:22,00000000-0GRA-BD28-CXVV-EYEX21,Health Care Management,Internship,,2/24/1996,Female,United States,Saint Louis University,Health Data Science,3/11/2024 12:02,Team Allocated,1070,10/3/2023 19:48,1/8/2024 3:30,1996-02-24_Female_United States,2,Other,0,96,,27,1,Churned
10/3/2023 1:43,00000000-10RQ-JXA9-NNKD-EW5RCF,UX Redesign Challenge,Competition,4/19/2024 18:29,9/24/2000,Female,United States,Saint Louis University,Information Systems,3/11/2024 12:03,Team Allocated,1070,2/9/2024 3:30,2/15/2024 18:30,2000-09-24_Female_United States,2,Other,129,6,63,23,1,Churned
10/12/2023 9:34,00000000-0GRA-BD28-CXVV-EYEX21,Health Care Management,Internship,,6/26/1994,Male,Nigeria,Micheal Okpara University of Agriculture  Umudike,Information Systems,3/11/2024 12:02,Team Allocated,1070,10/12/2023 12:03,1/8/2024 3:30,1994-06-26_Male_Nigeria,2,Other,0,87,,29,1,Churned
10/3/2023 1:43,00000000-10WW-X340-GTVH-RR52VF,Jump Start: Developing your Emotional Intelligence,Course,12/5/2025 11:06,9/24/2000,Female,United States,Saint Louis University,Information Systems,3/11/2024 12:02,Team Allocated,1070,,6/6/2023 11:06,2000-09-24_Female_United States,2,Other,,,913,23,1,Churned
9/11/2023 14:10,00000000-0GRA-BD28-CXVV-EYEX21,Health Care Management,Internship,,8/9/2003,Male,India,CMR ENGINEERING COLLEGE,Computer Science,3/11/2024 12:02,Team Allocated,1070,9/11/2023 14:34,1/8/2024 3:30,2003-08-09_Male_India,2,CS / IT,0,118,,20,1,Churned
9/12/2023 13:36,00000000-0GRA-BD28-CXVV-EYEX21,Health Care Management,Internship,,10/8/1992,Female,Nigeria,College of nursing umulogho obowo imo state,Nursing,3/11/2024 12:02,Team Allocated,1070,9/12/2023 15:05,1/8/2024 3:30,1992-10-08_Female_Nigeria,2,Other,0,117,,30,1,Churned
9/23/2023 7:18,00000000-0GRA-BD28-CXVV-EYEX21,Health Care Management,Internship,,3/12/2003,Male,India,Cmr Engineering College,Artificial Intelligence and Machine learning,3/11/2024 12:02,Team Allocated,1070,9/28/2023 14:28,1/8/2024 3:30,2003-03-12_Male_India,2,Other,5,101,,20,1,Churned
10/3/2023 1:10,00000000-10A5-TYD2-181G-D2J679,Xperience Design Hackathon,Competition,3/13/2024 18:29,10/28/2000,Female,United States,Saint Louis University,Information Systems,3/11/2024 12:03,Team Allocated,1070,1/27/2024 2:53,1/28/2024 18:30,2000-10-28_Female_United States,2,Other,116,1,44,22,1,Churned
10/3/2023 1:10,00000000-10RQ-JXA9-NNKD-EW5RCF,UX Redesign Challenge,Competition,4/19/2024 18:29,10/28/2000,Female,United States,Saint Louis University,Information Systems,3/11/2024 12:03,Team Allocated,1070,1/27/2024 2:54,2/15/2024 18:30,2000-10-28_Female_United States,2,Other,116,19,63,22,1,Churned
10/3/2023 1:10,00000000-106T-FSAJ-KDBX-40ZGNV,UrbanRenew Challenge,Competition,4/29/2024 18:29,10/28/2000,Female,United States,Saint Louis University,Information Systems,3/11/2024 12:03,Team Allocated,1070,1/27/2024 2:55,3/21/2024 18:30,2000-10-28_Female_United States,2,Other,116,54,38,22,1,Churned
10/3/2023 1:10,00000000-10YM-B80K-RNNJ-YAVQ7V,Upload Your First Year Transcript,Engagement,12/6/2025 10:26,10/28/2000,Female,United States,Saint Louis University,Information Systems,3/11/2024 12:02,Team Allocated,1070,12/21/2023 18:20,5/31/2024 7:04,2000-10-28_Female_United States,2,Other,79,161,554,22,1,Churned
10/2/2023 18:00,00000000-0GRA-BD28-CXVV-EYEX21,Health Care Management,Internship,,7/2/1998,Male,United States,SAINT LOUIS UNIVERSITY,Information Systems,3/11/2024 12:02,Team Allocated,1070,10/2/2023 18:27,1/8/2024 3:30,1998-07-02_Male_United States,2,Other,0,97,,25,1,Churned
10/2/2023 15:34,00000000-0GRA-BD28-CXVV-EYEX21,Health Care Management,Internship,,1/16/2002,Male,India,saint louis university,Information Systems,3/11/2024 12:02,Team Allocated,1070,10/2/2023 15:45,1/8/2024 3:30,2002-01-16_Male_India,2,Other,0,97,,21,1,Churned
10/2/2023 15:02,00000000-0GRA-BD28-CXVV-EYEX21,Health Care Management,Internship,,5/20/1994,Male,United States,Saint louis university,Information Systems,3/11/2024 12:02,Team Allocated,1070,10/2/2023 15:30,1/8/2024 3:30,1994-05-20_Male_United States,2,Other,0,97,,29,1,Churned
10/1/2023 1:20,00000000-0GHB-4N83-QX9K-JM48K2,Project Management,Internship,3/11/2024 18:00,2/7/2007,Male,Pakistan,Beaconhouse Margalla campus H-8 Islamabad,Computer Science,3/11/2024 12:02,Team Allocated,1070,10/1/2023 1:36,1/8/2024 3:30,2007-02-07_Male_Pakistan,2,CS / IT,0,99,63,16,1,Churned
9/30/2023 14:23,00000000-0GHB-4N83-QX9K-JM48K2,Project Management,Internship,3/11/2024 18:00,6/26/1996,Male,India,INTERNATIONAL SCHOOL OF MANAGEMENT EXCELLENCE,Project Management,3/11/2024 12:02,Team Allocated,1070,9/30/2023 14:42,1/8/2024 3:30,1996-06-26_Male_India,2,Business,0,99,63,27,1,Churned
9/29/2023 21:56,00000000-0GRA-BD28-CXVV-EYEX21,Health Care Management,Internship,,7/22/1999,Female,India,Saint Louis University,Computer Science,3/11/2024 12:02,Team Allocated,1070,10/3/2023 1:49,1/8/2024 3:30,1999-07-22_Female_India,2,CS / IT,3,97,,24,1,Churned
9/29/2023 19:50,00000000-0GRA-BD28-CXVV-EYEX21,Health Care Management,Internship,,8/5/1998,Male,India,saint louis university,Health Data Science,3/11/2024 12:02,Team Allocated,1070,10/4/2023 22:17,1/8/2024 3:30,1998-08-05_Male_India,2,Other,5,95,,25,1,Churned
9/29/2023 14:22,00000000-0GRA-BD28-CXVV-EYEX21,Health Care Management,Internship,,1/12/2002,Female,Pakistan,University of Management and Technology,Psychology,3/11/2024 12:02,Team Allocated,1070,9/30/2023 9:53,1/8/2024 3:30,2002-01-12_Female_Pakistan,2,Other,0,99,,21,1,Churned
9/29/2023 11:31,00000000-0GHB-4N83-QX9K-JM48K2,Project Management,Internship,3/11/2024 18:00,6/30/2006,Female,India,Vibgyor High,Advertising,3/11/2024 12:02,Team Allocated,1070,10/2/2023 8:39,1/8/2024 3:30,2006-06-30_Female_India,2,Other,2,97,63,17,1,Churned
9/29/2023 11:31,00000000-0GNT-FT74-MZT8-93VC0G,Digital Marketing,Internship,3/11/2024 18:00,6/30/2006,Female,India,Vibgyor High,Advertising,3/11/2024 12:01,Team Allocated,1070,9/29/2023 11:59,1/8/2024 3:30,2006-06-30_Female_India,2,Other,0,100,63,17,1,Churned
9/29/2023 8:06,00000000-0GRA-BD28-CXVV-EYEX21,Health Care Management,Internship,,4/10/2000,Male,India,saint louis university,Health Data Science,3/11/2024 12:02,Team Allocated,1070,9/29/2023 8:24,1/8/2024 3:30,2000-04-10_Male_India,2,Other,0,100,,23,1,Churned
9/28/2023 21:16,00000000-0GNT-FT74-MZT8-93VC0G,Digital Marketing,Internship,3/11/2024 18:00,9/30/2005,Male,United States,Lake Central High School,Information Technology and Management,3/11/2024 12:01,Team Allocated,1070,,1/8/2024 3:30,2005-09-30_Male_United States,2,Business,,,63,18,1,Churned
9/27/2023 7:21,00000000-0GRA-BD28-CXVV-EYEX21,Health Care Management,Internship,,9/12/1998,Male,Ethiopia,Hawassa university,Biomedical Engineering,3/11/2024 12:02,Team Allocated,1070,9/28/2023 9:54,1/8/2024 3:30,1998-09-12_Male_Ethiopia,2,Engineering,1,101,,25,1,Churned
9/27/2023 4:57,00000000-0GWQ-AXC5-X45C-2MHJ28,Data Visualization,Internship,3/11/2024 18:00,6/9/1996,Male,India,North maharashtra university,Data Science,3/11/2024 12:02,Team Allocated,1070,9/27/2023 5:14,1/8/2024 3:30,1996-06-09_Male_India,2,Other,0,102,63,27,1,Churned
9/26/2023 23:50,00000000-0GRA-BD28-CXVV-EYEX21,Health Care Management,Internship,,2/10/2000,Male,United States,Saint Louis University,Computer Information Systems,3/11/2024 12:02,Team Allocated,1070,9/27/2023 1:05,1/8/2024 3:30,2000-02-10_Male_United States,2,CS / IT,0,103,,23,1,Churned
9/26/2023 23:50,00000000-0GN2-A0AY-7XK8-C5FZPP,Career Essentials: Getting Started with Your Professional Journey,Course,6/29/2024 18:52,2/10/2000,Male,United States,Saint Louis University,Computer Information Systems,3/11/2024 12:01,Team Allocated,1070,,11/3/2022 18:30,2000-02-10_Male_United States,2,CS / IT,,,604,23,1,Churned
9/26/2023 14:48,00000000-10A5-TYD2-181G-D2J679,Xperience Design Hackathon,Competition,3/13/2024 18:29,11/12/1999,Male,United States,saint louis university,Information Systems,3/11/2024 12:03,Team Allocated,1070,,1/28/2024 18:30,1999-11-12_Male_United States,2,Other,,,44,23,1,Churned
9/26/2023 14:48,00000000-106T-FSAJ-KDBX-40ZGNV,UrbanRenew Challenge,Competition,4/29/2024 18:29,11/12/1999,Male,United States,saint louis university,Information Systems,3/11/2024 12:03,Team Allocated,1070,2/29/2024 22:14,3/21/2024 18:30,1999-11-12_Male_United States,2,Other,156,20,38,23,1,Churned
9/25/2023 19:07,00000000-0GHB-4N83-QX9K-JM48K2,Project Management,Internship,3/11/2024 18:00,6/1/2006,Male,Pakistan,Beaconhouse Juniper Campus,Physics,3/11/2024 12:02,Team Allocated,1070,10/8/2023 15:09,1/8/2024 3:30,2006-06-01_Male_Pakistan,2,Other,12,91,63,17,1,Churned
9/25/2023 4:03,00000000-106T-FSAJ-KDBX-40ZGNV,UrbanRenew Challenge,Competition,4/29/2024 18:29,7/23/2001,Male,United States,Saint Louis University,Information Systems,3/11/2024 12:03,Team Allocated,1070,2/16/2024 4:45,3/21/2024 18:30,2001-07-23_Male_United States,2,Other,144,34,38,22,1,Churned
9/25/2023 4:03,00000000-0GRA-BD28-CXVV-EYEX21,Health Care Management,Internship,,7/23/2001,Male,United States,Saint Louis University,Information Systems,3/11/2024 12:02,Team Allocated,1070,9/25/2023 4:50,1/8/2024 3:30,2001-07-23_Male_United States,2,Other,0,104,,22,1,Churned
9/23/2023 8:58,00000000-0GWQ-AXC5-X45C-2MHJ28,Data Visualization,Internship,3/11/2024 18:00,1/16/2002,Female,India,khalsa college for women amritsar,Data Analyst,3/11/2024 12:02,Team Allocated,1070,9/23/2023 9:19,1/8/2024 3:30,2002-01-16_Female_India,2,Other,0,106,63,21,1,Churned
10/3/2023 1:43,00000000-0GNT-FT74-MZT8-93VC0G,Digital Marketing,Internship,3/11/2024 18:00,9/24/2000,Female,United States,Saint Louis University,Information Systems,3/11/2024 12:02,Team Allocated,1070,1/4/2024 1:24,1/8/2024 3:30,2000-09-24_Female_United States,2,Other,92,4,63,23,1,Churned
9/23/2023 3:48,00000000-0GRA-BD28-CXVV-EYEX21,Health Care Management,Internship,,8/1/2001,Male,United States,saint louis university,Information Systems,3/11/2024 12:02,Team Allocated,1070,9/23/2023 4:41,1/8/2024 3:30,2001-08-01_Male_United States,2,Other,0,106,,22,1,Churned
9/22/2023 20:25,00000000-0GWQ-AXC5-X45C-2MHJ28,Data Visualization,Internship,3/11/2024 18:00,4/20/2002,Male,India,PG Program Specialized in Data Science and Machine Learning,Data Science,3/11/2024 12:02,Team Allocated,1070,9/22/2023 20:35,1/8/2024 3:30,2002-04-20_Male_India,2,Other,0,107,63,21,1,Churned
9/18/2023 12:22,00000000-0GRA-BD28-CXVV-EYEX21,Health Care Management,Internship,,9/26/2000,Male,Ghana,Kwame Nkrumah University of Science and Technology,Biochemistry,3/11/2024 12:02,Team Allocated,1070,9/18/2023 15:23,1/8/2024 3:30,2000-09-26_Male_Ghana,2,Other,0,111,,22,1,Churned
9/22/2023 21:58,00000000-0GRA-BD28-CXVV-EYEX21,Health Care Management,Internship,,6/16/1998,Male,"Virgin Islands, U.S.",Webster university,Computer Information Systems,3/11/2024 12:02,Team Allocated,1070,9/22/2023 22:19,1/8/2024 3:30,"1998-06-16_Male_Virgin Islands, U.S.",2,CS / IT,0,107,,25,1,Churned
9/22/2023 1:54,00000000-106T-FSAJ-KDBX-40ZGNV,UrbanRenew Challenge,Competition,4/29/2024 18:29,9/28/1998,Male,United States,Saint Louis University,Information Systems,3/11/2024 12:03,Team Allocated,1070,3/8/2024 14:55,3/21/2024 18:30,1998-09-28_Male_United States,2,Other,168,13,38,25,1,Churned
9/21/2023 22:06,00000000-0GWQ-AXC5-X45C-2MHJ28,Data Visualization,Internship,3/11/2024 18:00,11/5/1993,Female,Nigeria,Lagos state university,Data Analytics,3/11/2024 12:02,Team Allocated,1070,9/21/2023 22:48,1/8/2024 3:30,1993-11-05_Female_Nigeria,2,Other,0,108,63,29,1,Churned
9/20/2023 17:37,00000000-0GRA-BD28-CXVV-EYEX21,Health Care Management,Internship,,7/16/1999,Male,United States,ST LOUIS UNIVERSITY,Information Systems,3/11/2024 12:02,Team Allocated,1070,10/13/2023 1:46,1/8/2024 3:30,1999-07-16_Male_United States,2,Other,22,87,,24,1,Churned
9/20/2023 17:07,00000000-0GRA-BD28-CXVV-EYEX21,Health Care Management,Internship,,5/10/1999,Female,United States,Saint Louis University,Information Systems,3/11/2024 12:02,Team Allocated,1070,10/4/2023 18:24,1/8/2024 3:30,1999-05-10_Female_United States,2,Other,14,95,,24,1,Churned
9/20/2023 6:30,00000000-0GRA-BD28-CXVV-EYEX21,Health Care Management,Internship,,11/26/2000,Female,Nigeria,Imo state university,Microbiology,3/11/2024 12:02,Team Allocated,1070,9/20/2023 7:13,1/8/2024 3:30,2000-11-26_Female_Nigeria,2,Other,0,109,,22,1,Churned
9/19/2023 22:41,00000000-0GRA-BD28-CXVV-EYEX21,Health Care Management,Internship,,11/17/2002,Female,United States,Saint Louis University,Information Systems,3/11/2024 12:02,Team Allocated,1070,9/20/2023 1:59,1/8/2024 3:30,2002-11-17_Female_United States,2,Other,0,110,,20,1,Churned
9/19/2023 18:24,00000000-0GRA-BD28-CXVV-EYEX21,Health Care Management,Internship,,4/22/1996,Male,United States,saint louis university,Health Data Science,3/11/2024 12:02,Team Allocated,1070,9/19/2023 18:37,1/8/2024 3:30,1996-04-22_Male_United States,2,Other,0,110,,27,1,Churned
9/19/2023 5:43,00000000-0GWQ-AXC5-X45C-2MHJ28,Data Visualization,Internship,3/11/2024 18:00,11/10/1995,Female,Pakistan,Quaid e azam university Islamabad,Economics,3/11/2024 12:02,Team Allocated,1070,9/19/2023 6:19,1/8/2024 3:30,1995-11-10_Female_Pakistan,2,Other,0,110,63,27,1,Churned
9/19/2023 2:24,00000000-10RQ-JXA9-NNKD-EW5RCF,UX Redesign Challenge,Competition,4/19/2024 18:29,11/22/1999,Male,United States,Saint Louis University,Computer Science,3/11/2024 12:03,Team Allocated,1070,2/11/2024 16:27,2/15/2024 18:30,1999-11-22_Male_United States,2,CS / IT,145,4,63,23,1,Churned
9/19/2023 2:24,00000000-106T-FSAJ-KDBX-40ZGNV,UrbanRenew Challenge,Competition,4/29/2024 18:29,11/22/1999,Male,United States,Saint Louis University,Computer Science,3/11/2024 12:03,Team Allocated,1070,2/11/2024 16:32,3/21/2024 18:30,1999-11-22_Male_United States,2,CS / IT,145,39,38,23,1,Churned
9/18/2023 17:37,00000000-0GWQ-AXC5-X45C-2MHJ28,Data Visualization,Internship,3/11/2024 18:00,7/8/1998,Male,India,Savitribai Phule Pune University,Chemistry,3/11/2024 12:02,Team Allocated,1070,9/18/2023 17:46,1/8/2024 3:30,1998-07-08_Male_India,2,Other,0,111,63,25,1,Churned
9/16/2023 18:02,00000000-0GRA-BD28-CXVV-EYEX21,Health Care Management,Internship,,7/1/1997,Female,United States,SAINT LOUIS UNIVERSITY,Health Data Science,3/11/2024 12:02,Team Allocated,1070,9/17/2023 5:46,1/8/2024 3:30,1997-07-01_Female_United States,2,Other,0,112,,26,1,Churned
9/13/2023 4:41,00000000-106T-FSAJ-KDBX-40ZGNV,UrbanRenew Challenge,Competition,4/29/2024 18:29,8/8/2002,Male,United States,Saint Louis University,Information Systems,3/11/2024 12:03,Team Allocated,1070,2/8/2024 18:14,3/21/2024 18:30,2002-08-08_Male_United States,2,Other,148,42,38,21,1,Churned
9/16/2023 17:20,00000000-0GRA-BD28-CXVV-EYEX21,Health Care Management,Internship,,5/2/1999,Male,India,saint louis university,Information Systems,3/11/2024 12:02,Team Allocated,1070,12/23/2023 13:14,1/8/2024 3:30,1999-05-02_Male_India,2,Other,97,15,,24,1,Churned
9/16/2023 14:35,00000000-0GHB-4N83-QX9K-JM48K2,Project Management,Internship,3/11/2024 18:00,9/30/2006,Male,Turkey,TED Ankara College,Aerospace Engineering,3/11/2024 12:02,Team Allocated,1070,9/16/2023 14:54,1/8/2024 3:30,2006-09-30_Male_Turkey,2,Engineering,0,113,63,16,1,Churned
9/16/2023 5:56,00000000-106T-FSAJ-KDBX-40ZGNV,UrbanRenew Challenge,Competition,4/29/2024 18:29,8/28/2000,Female,United States,Saint Louis University,Information Systems,3/11/2024 12:03,Team Allocated,1070,3/6/2024 5:53,3/21/2024 18:30,2000-08-28_Female_United States,2,Other,171,15,38,23,1,Churned
9/16/2023 3:20,00000000-0GRA-BD28-CXVV-EYEX21,Health Care Management,Internship,,7/7/1999,Male,United States,SAINT LOUIS UNIVERSITY,Health Data Science,3/11/2024 12:02,Team Allocated,1070,9/16/2023 3:45,1/8/2024 3:30,1999-07-07_Male_United States,2,Other,0,113,,24,1,Churned
9/15/2023 21:09,00000000-0GRA-BD28-CXVV-EYEX21,Health Care Management,Internship,,3/27/2000,Male,Ghana,Kwame Nkrumah University of Science and Technology,Biochemistry,3/11/2024 12:02,Team Allocated,1070,9/15/2023 22:00,1/8/2024 3:30,2000-03-27_Male_Ghana,2,Other,0,114,,23,1,Churned
,00000000-0GRA-BD28-CXVV-EYEX21,Health Care Management,Internship,,5/26/1999,Female,Nigeria,University of Maiduguri,Medicine,3/11/2024 12:02,Team Allocated,1070,9/14/2023 2:08,1/8/2024 3:30,1999-05-26_Female_Nigeria,2,Other,,116,,,1,Churned
9/14/2023 14:32,00000000-0GWQ-AXC5-X45C-2MHJ28,Data Visualization,Internship,3/11/2024 18:00,4/8/1998,Male,India,NDUAT Ayodhya India,Computer Engineering,3/11/2024 12:02,Team Allocated,1070,9/14/2023 14:44,1/8/2024 3:30,1998-04-08_Male_India,2,CS / IT,0,115,63,25,1,Churned
9/14/2023 13:07,00000000-0GRA-BD28-CXVV-EYEX21,Health Care Management,Internship,,12/6/2001,Male,India,International Institute of Information Technology  Pune,Computer Engineering,3/11/2024 12:02,Team Allocated,1070,9/14/2023 13:26,1/8/2024 3:30,2001-12-06_Male_India,2,CS / IT,0,115,,21,1,Churned
9/14/2023 11:52,00000000-0GHB-4N83-QX9K-JM48K2,Project Management,Internship,3/11/2024 18:00,10/26/2001,Female,India,AEC,Other,3/11/2024 12:02,Team Allocated,1070,9/14/2023 11:54,1/8/2024 3:30,2001-10-26_Female_India,2,Other,0,115,63,21,1,Churned
9/13/2023 6:21,00000000-0GRA-BD28-CXVV-EYEX21,Health Care Management,Internship,,3/24/2003,Female,India,VNRVJIET,Computer Science and Engineering,3/11/2024 12:02,Team Allocated,1070,9/13/2023 7:20,1/8/2024 3:30,2003-03-24_Female_India,2,CS / IT,0,116,,20,1,Churned
9/13/2023 4:42,00000000-0GRA-BD28-CXVV-EYEX21,Health Care Management,Internship,,7/27/2000,Male,India,saint louis university,Health Data Science,3/11/2024 12:02,Team Allocated,1070,9/13/2023 5:07,1/8/2024 3:30,2000-07-27_Male_India,2,Other,0,116,,23,1,Churned
9/13/2023 4:41,00000000-10RQ-JXA9-NNKD-EW5RCF,UX Redesign Challenge,Competition,4/19/2024 18:29,8/8/2002,Male,United States,Saint Louis University,Information Systems,3/11/2024 12:03,Team Allocated,1070,2/8/2024 18:11,2/15/2024 18:30,2002-08-08_Male_United States,2,Other,148,7,63,21,1,Churned
9/11/2023 18:52,00000000-0GRA-BD28-CXVV-EYEX21,Health Care Management,Internship,,9/4/2001,Female,United States,Saint Louis University,Health Data Science,3/11/2024 12:02,Team Allocated,1070,9/11/2023 19:10,1/8/2024 3:30,2001-09-04_Female_United States,2,Other,0,118,,22,1,Churned
8/24/2023 3:51,00000000-0GRA-BD28-CXVV-EYEX21,Health Care Management,Internship,,11/15/1983,Male,Nigeria,Nigerian Army School of Medical Sciences,Post Graduate Diploma in Public Health,3/11/2024 12:02,Team Allocated,1070,8/24/2023 4:40,1/8/2024 3:30,1983-11-15_Male_Nigeria,2,Other,0,136,,39,1,Churned
9/2/2023 11:59,00000000-0GZY-NNHV-FJWW-PTA9VX,Innovation & Entrepreneurship,Internship,3/11/2024 18:00,3/26/2006,Male,Bangladesh,Birshreshtha Munshi Abdur Rouf Public College,Software Engineering,3/11/2024 12:02,Team Allocated,1070,9/2/2023 13:32,1/8/2024 3:30,2006-03-26_Male_Bangladesh,2,CS / IT,0,127,63,17,1,Churned
8/29/2023 5:18,00000000-0GRA-BD28-CXVV-EYEX21,Health Care Management,Internship,,3/9/2000,Male,United States,saint louis university,Information Systems,3/11/2024 12:02,Team Allocated,1070,8/29/2023 5:34,1/8/2024 3:30,2000-03-09_Male_United States,2,Other,0,131,,23,1,Churned
9/2/2023 12:34,00000000-0GRA-BD28-CXVV-EYEX21,Health Care Management,Internship,,5/5/1996,Female,Nigeria,Federal University of Technology Owerri,Biological Sciences,3/11/2024 12:02,Team Allocated,1070,9/2/2023 19:19,1/8/2024 3:30,1996-05-05_Female_Nigeria,2,Other,0,127,,27,1,Churned
9/11/2023 13:38,00000000-0GRA-BD28-CXVV-EYEX21,Health Care Management,Internship,,5/13/1998,Female,India,Symbiosis Statistical Institute,Statistics,3/11/2024 12:02,Team Allocated,1070,9/11/2023 13:49,1/8/2024 3:30,1998-05-13_Female_India,2,Other,0,118,,25,1,Churned
9/9/2023 22:12,00000000-0GRA-BD28-CXVV-EYEX21,Health Care Management,Internship,,11/24/1997,Male,Nigeria,Ladoke Akintola University of Technology,Accounting and Finance,3/11/2024 12:02,Team Allocated,1070,9/9/2023 22:38,1/8/2024 3:30,1997-11-24_Male_Nigeria,2,Other,0,120,,25,1,Churned
9/9/2023 21:26,00000000-0GRA-BD28-CXVV-EYEX21,Health Care Management,Internship,,3/19/2001,Female,United States,Saint Louis university,Health Data Science,3/11/2024 12:02,Team Allocated,1070,9/9/2023 21:58,1/8/2024 3:30,2001-03-19_Female_United States,2,Other,0,120,,22,1,Churned
9/9/2023 3:57,00000000-0GRA-BD28-CXVV-EYEX21,Health Care Management,Internship,,2/9/2001,Female,United States,Saint Louis University,Computer Information Systems,3/11/2024 12:02,Team Allocated,1070,11/22/2023 4:15,1/8/2024 3:30,2001-02-09_Female_United States,2,CS / IT,74,46,,22,1,Churned
9/9/2023 3:56,00000000-0GRA-BD28-CXVV-EYEX21,Health Care Management,Internship,,5/30/2001,Female,United States,Saint Louis University,Computer Information Systems,3/11/2024 12:02,Team Allocated,1070,,1/8/2024 3:30,2001-05-30_Female_United States,2,CS / IT,,,,22,1,Churned
9/8/2023 22:06,00000000-0GRA-BD28-CXVV-EYEX21,Health Care Management,Internship,,5/27/1998,Female,United States,Saint Louis university,Computer Science,3/11/2024 12:02,Team Allocated,1070,9/12/2023 15:39,1/8/2024 3:30,1998-05-27_Female_United States,2,CS / IT,3,117,,25,1,Churned
9/8/2023 18:30,00000000-106T-FSAJ-KDBX-40ZGNV,UrbanRenew Challenge,Competition,4/29/2024 18:29,7/8/2001,Female,United States,Saint Louis university,Computer Information Systems,3/11/2024 12:03,Team Allocated,1070,2/23/2024 21:26,3/21/2024 18:30,2001-07-08_Female_United States,2,CS / IT,168,26,38,22,1,Churned
9/8/2023 18:30,00000000-0GRA-BD28-CXVV-EYEX21,Health Care Management,Internship,,7/8/2001,Female,United States,Saint Louis university,Computer Information Systems,3/11/2024 12:02,Team Allocated,1070,11/10/2023 18:59,1/8/2024 3:30,2001-07-08_Female_United States,2,CS / IT,63,58,,22,1,Churned
9/8/2023 16:56,00000000-0GRA-BD28-CXVV-EYEX21,Health Care Management,Internship,,2/25/1995,Female,Ghana,Garden city university college,Midwifery,3/11/2024 12:02,Team Allocated,1070,9/8/2023 18:35,1/8/2024 3:30,1995-02-25_Female_Ghana,2,Other,0,121,,28,1,Churned
9/8/2023 15:48,00000000-0GRA-BD28-CXVV-EYEX21,Health Care Management,Internship,,11/3/1996,Male,United States,saint louis University,Health Data Science,3/11/2024 12:02,Team Allocated,1070,9/25/2023 18:52,1/8/2024 3:30,1996-11-03_Male_United States,2,Other,17,104,,26,1,Churned
9/7/2023 18:03,00000000-106T-FSAJ-KDBX-40ZGNV,UrbanRenew Challenge,Competition,4/29/2024 18:29,10/23/1999,Male,United States,Saint Louis University,Computer Science,3/11/2024 12:03,Team Allocated,1070,2/18/2024 23:00,3/21/2024 18:30,1999-10-23_Male_United States,2,CS / IT,164,31,38,23,1,Churned
9/7/2023 18:03,00000000-0GRA-BD28-CXVV-EYEX21,Health Care Management,Internship,,10/23/1999,Male,United States,Saint Louis University,Computer Science,3/11/2024 12:02,Team Allocated,1070,9/28/2023 17:16,1/8/2024 3:30,1999-10-23_Male_United States,2,CS / IT,20,101,,23,1,Churned
9/7/2023 14:11,00000000-0GRA-BD28-CXVV-EYEX21,Health Care Management,Internship,,11/14/2006,Female,United States,Saline High School,Medicine,3/11/2024 12:02,Team Allocated,1070,10/2/2023 2:04,1/8/2024 3:30,2006-11-14_Female_United States,2,Other,24,98,,16,1,Churned
9/7/2023 13:18,00000000-0GRA-BD28-CXVV-EYEX21,Health Care Management,Internship,,8/3/2002,Female,India,Government Stanley Medical College,Bsc Physician Assistant,3/11/2024 12:02,Team Allocated,1070,9/10/2023 7:19,1/8/2024 3:30,2002-08-03_Female_India,2,Other,2,119,,21,1,Churned
9/6/2023 17:54,00000000-0GRA-BD28-CXVV-EYEX21,Health Care Management,Internship,,3/2/1994,Male,United States,saint louis university,Information Systems,3/11/2024 12:02,Team Allocated,1070,9/12/2023 5:58,1/8/2024 3:30,1994-03-02_Male_United States,2,Other,5,117,,29,1,Churned
9/6/2023 7:51,00000000-0GWQ-AXC5-X45C-2MHJ28,Data Visualization,Internship,3/11/2024 18:00,4/16/2000,Female,India,Pondicherry University,Statistics,3/11/2024 12:02,Team Allocated,1070,9/6/2023 9:32,1/8/2024 3:30,2000-04-16_Female_India,2,Other,0,123,63,23,1,Churned
9/6/2023 6:55,00000000-0GRA-BD28-CXVV-EYEX21,Health Care Management,Internship,,10/25/2006,Female,India,CS Academy,Psychology,3/11/2024 12:02,Team Allocated,1070,10/16/2023 14:39,1/8/2024 3:30,2006-10-25_Female_India,2,Other,40,83,,16,1,Churned
9/5/2023 16:51,00000000-0GRA-BD28-CXVV-EYEX21,Health Care Management,Internship,,7/21/2001,Male,United States,Saint Louis University,Information Systems,3/11/2024 12:02,Team Allocated,1070,9/6/2023 19:38,1/8/2024 3:30,2001-07-21_Male_United States,2,Other,1,123,,22,1,Churned
9/5/2023 13:51,00000000-0GHB-4N83-QX9K-JM48K2,Project Management,Internship,3/11/2024 18:00,9/23/2006,Female,India,CHIREC International School,Applied Financial Economics,3/11/2024 12:02,Team Allocated,1070,9/5/2023 14:12,1/8/2024 3:30,2006-09-23_Female_India,2,Other,0,124,63,16,1,Churned
9/4/2023 5:21,00000000-0GRA-BD28-CXVV-EYEX21,Health Care Management,Internship,,8/21/2006,Female,Uganda,Victoria University,Computer Science,3/11/2024 12:02,Team Allocated,1070,9/4/2023 5:45,1/8/2024 3:30,2006-08-21_Female_Uganda,2,CS / IT,0,125,,17,1,Churned
9/3/2023 16:50,00000000-0GRA-BD28-CXVV-EYEX21,Health Care Management,Internship,,3/4/2000,Female,United States,Saint Louis University,Information Systems,3/11/2024 12:02,Team Allocated,1070,9/3/2023 17:49,1/8/2024 3:30,2000-03-04_Female_United States,2,Other,0,126,,23,1,Churned
9/3/2023 16:43,00000000-10WC-BS50-CYGD-X97ES4,CPR/AED Certification,Course,6/30/2024 16:18,3/20/2001,Male,United States,saint louis university,Computer Science,3/11/2024 12:02,Team Allocated,1070,,3/20/2023 2:30,2001-03-20_Male_United States,2,CS / IT,,,468,22,1,Churned
9/3/2023 16:43,00000000-0GRA-BD28-CXVV-EYEX21,Health Care Management,Internship,,3/20/2001,Male,United States,saint louis university,Computer Science,3/11/2024 12:02,Team Allocated,1070,9/3/2023 23:01,1/8/2024 3:30,2001-03-20_Male_United States,2,CS / IT,0,126,,22,1,Churned
9/3/2023 16:43,00000000-0GN2-A0AY-7XK8-C5FZPP,Career Essentials: Getting Started with Your Professional Journey,Course,6/29/2024 18:52,3/20/2001,Male,United States,saint louis university,Computer Science,3/11/2024 12:01,Team Allocated,1070,,11/3/2022 18:30,2001-03-20_Male_United States,2,CS / IT,,,604,22,1,Churned
9/3/2023 14:13,00000000-0GHB-4N83-QX9K-JM48K2,Project Management,Internship,3/11/2024 18:00,10/19/1988,Male,Sierra Leone,Institutes of Public Administration and Management,Project Management,3/11/2024 12:02,Team Allocated,1070,9/3/2023 14:53,1/8/2024 3:30,1988-10-19_Male_Sierra Leone,2,Business,0,126,63,34,1,Churned
9/3/2023 12:34,00000000-0GRA-BD28-CXVV-EYEX21,Health Care Management,Internship,,11/6/2003,Female,India,rajalakshmi engineering college,Biomedical Engineering,3/11/2024 12:02,Team Allocated,1070,9/3/2023 14:15,1/8/2024 3:30,2003-11-06_Female_India,2,Engineering,0,126,,19,1,Churned
9/2/2023 12:27,00000000-0GHB-4N83-QX9K-JM48K2,Project Management,Internship,3/11/2024 18:00,5/13/1985,Female,Nigeria,University of Benin,Biochemistry,3/11/2024 12:02,Team Allocated,1070,9/2/2023 14:23,1/8/2024 3:30,1985-05-13_Female_Nigeria,2,Other,0,127,63,38,1,Churned
9/2/2023 11:59,00000000-0GWQ-AXC5-X45C-2MHJ28,Data Visualization,Internship,3/11/2024 18:00,3/26/2006,Male,Bangladesh,Birshreshtha Munshi Abdur Rouf Public College,Software Engineering,3/11/2024 12:02,Team Allocated,1070,9/2/2023 12:40,1/8/2024 3:30,2006-03-26_Male_Bangladesh,2,CS / IT,0,127,63,17,1,Churned
9/2/2023 11:59,00000000-0GHB-4N83-QX9K-JM48K2,Project Management,Internship,3/11/2024 18:00,3/26/2006,Male,Bangladesh,Birshreshtha Munshi Abdur Rouf Public College,Software Engineering,3/11/2024 12:02,Team Allocated,1070,9/2/2023 13:33,1/8/2024 3:30,2006-03-26_Male_Bangladesh,2,CS / IT,0,127,63,17,1,Churned
8/30/2023 20:56,00000000-0GRA-BD28-CXVV-EYEX21,Health Care Management,Internship,,8/13/1998,Female,United States,Saint Louis university,Information Systems,3/11/2024 12:02,Team Allocated,1070,8/30/2023 21:18,1/8/2024 3:30,1998-08-13_Female_United States,2,Other,0,130,,25,1,Churned
9/2/2023 11:59,00000000-0GNT-FT74-MZT8-93VC0G,Digital Marketing,Internship,3/11/2024 18:00,3/26/2006,Male,Bangladesh,Birshreshtha Munshi Abdur Rouf Public College,Software Engineering,3/11/2024 12:02,Team Allocated,1070,9/2/2023 13:34,1/8/2024 3:30,2006-03-26_Male_Bangladesh,2,CS / IT,0,127,63,17,1,Churned
9/1/2023 16:36,00000000-0GRA-BD28-CXVV-EYEX21,Health Care Management,Internship,,3/24/1999,Male,United States,Saint Louis University,Information Systems,3/11/2024 12:02,Team Allocated,1070,9/11/2023 22:17,1/8/2024 3:30,1999-03-24_Male_United States,2,Other,10,118,,24,1,Churned
9/1/2023 14:59,00000000-0GRA-BD28-CXVV-EYEX21,Health Care Management,Internship,,3/4/2000,Male,United States,Saint Louis University,Information Systems,3/11/2024 12:02,Team Allocated,1070,9/8/2023 15:36,1/8/2024 3:30,2000-03-04_Male_United States,2,Other,7,121,,23,1,Churned
9/1/2023 4:42,00000000-0GWQ-AXC5-X45C-2MHJ28,Data Visualization,Internship,3/11/2024 18:00,9/22/1992,Female,India,Asansol Engineering College,Computer Applications,3/11/2024 12:02,Team Allocated,1070,9/1/2023 4:56,1/8/2024 3:30,1992-09-22_Female_India,2,CS / IT,0,128,63,30,1,Churned
,00000000-0GRA-BD28-CXVV-EYEX21,Health Care Management,Internship,,8/24/1997,Male,United States,Saint Louis University,Information Systems,3/11/2024 12:02,Team Allocated,1070,12/26/2023 5:45,1/8/2024 3:30,1997-08-24_Male_United States,2,Other,,12,,,1,Churned
8/31/2023 21:47,00000000-0GRA-BD28-CXVV-EYEX21,Health Care Management,Internship,,9/12/1973,Female,United States,Saint Louis University,Supply Chain Management,3/11/2024 12:02,Team Allocated,1070,8/31/2023 22:16,1/8/2024 3:30,1973-09-12_Female_United States,2,Business,0,129,,50,1,Churned
12/25/2023 19:00,00000000-10RQ-JXA9-NNKD-EW5RCF,UX Redesign Challenge,Competition,4/19/2024 18:29,6/26/1999,Male,United States,Saint Louis,Information Systems,3/11/2024 12:03,Team Allocated,1070,2/11/2024 16:34,2/15/2024 18:30,1999-06-26_Male_United States,2,Other,47,4,63,24,1,Churned
8/31/2023 17:28,00000000-0GRA-BD28-CXVV-EYEX21,Health Care Management,Internship,,7/17/2002,Male,India,NMAM INSTITUTE OF TECHNOLOGY,Other,3/11/2024 12:02,Team Allocated,1070,8/31/2023 17:53,1/8/2024 3:30,2002-07-17_Male_India,2,Other,0,129,,21,1,Churned
8/31/2023 15:28,00000000-0GRA-BD28-CXVV-EYEX21,Health Care Management,Internship,,1/1/1987,Male,Nigeria,Illinois Institute of Technology,Cyber Security,3/11/2024 12:02,Team Allocated,1070,8/31/2023 16:01,1/8/2024 3:30,1987-01-01_Male_Nigeria,2,CS / IT,0,129,,36,1,Churned
8/31/2023 14:24,00000000-0GHB-4N83-QX9K-JM48K2,Project Management,Internship,3/11/2024 18:00,9/9/2006,Male,India,Heritage Xperiential Learning School,Business and Management Studies,3/11/2024 12:02,Team Allocated,1070,8/31/2023 15:02,1/8/2024 3:30,2006-09-09_Male_India,2,Business,0,129,63,16,1,Churned
8/31/2023 13:40,00000000-0GRA-BD28-CXVV-EYEX21,Health Care Management,Internship,,10/27/1997,Female,United States,Saint Louis University,Information Systems,3/11/2024 12:02,Team Allocated,1070,9/1/2023 13:21,1/8/2024 3:30,1997-10-27_Female_United States,2,Other,0,128,,25,1,Churned
8/31/2023 7:02,00000000-0GRA-BD28-CXVV-EYEX21,Health Care Management,Internship,,8/29/2007,Male,China,珠海市一附属实验学校,Mathematics,3/11/2024 12:02,Team Allocated,1070,9/2/2023 6:18,1/8/2024 3:30,2007-08-29_Male_China,2,Other,1,127,,16,1,Churned
11/2/2023 3:03,00000000-0GRA-BD28-CXVV-EYEX21,Health Care Management,Internship,,7/4/1998,Male,United States,SAINT LOUIS UNIVERSITY,Health Data Science,3/11/2024 12:02,Team Allocated,1070,11/2/2023 3:42,1/8/2024 3:30,1998-07-04_Male_United States,2,Other,0,66,,25,1,Churned
8/29/2023 5:19,00000000-0GRA-BD28-CXVV-EYEX21,Health Care Management,Internship,,4/10/2000,Female,United States,Saint louis university,Information Systems,3/11/2024 12:02,Team Allocated,1070,8/29/2023 5:34,1/8/2024 3:30,2000-04-10_Female_United States,2,Other,0,131,,23,1,Churned
8/30/2023 15:48,00000000-0GHB-4N83-QX9K-JM48K2,Project Management,Internship,3/11/2024 18:00,10/2/1999,Female,Nigeria,Obafemi Awolowo University,Law and Legal Studies,3/11/2024 12:02,Team Allocated,1070,9/4/2023 18:24,1/8/2024 3:30,1999-10-02_Female_Nigeria,2,Other,5,125,63,23,1,Churned
8/30/2023 9:56,00000000-0GRA-BD28-CXVV-EYEX21,Health Care Management,Internship,,9/10/1990,Male,Nigeria,University of Toronto  Mississauga,Healthcare Management,3/11/2024 12:02,Team Allocated,1070,8/30/2023 10:46,1/8/2024 3:30,1990-09-10_Male_Nigeria,2,Business,0,130,,32,1,Churned
8/30/2023 5:02,00000000-10WC-BS50-CYGD-X97ES4,CPR/AED Certification,Course,6/30/2024 16:18,9/9/1999,Male,United States,Saint Louis University,Information Systems,3/11/2024 12:02,Team Allocated,1070,,3/20/2023 2:30,1999-09-09_Male_United States,2,Other,,,468,23,1,Churned
8/30/2023 5:02,00000000-0GN2-A0AY-7XK8-C5FZPP,Career Essentials: Getting Started with Your Professional Journey,Course,6/29/2024 18:52,9/9/1999,Male,United States,Saint Louis University,Information Systems,3/11/2024 12:01,Team Allocated,1070,,11/3/2022 18:30,1999-09-09_Male_United States,2,Other,,,604,23,1,Churned
8/30/2023 2:27,00000000-10RQ-JXA9-NNKD-EW5RCF,UX Redesign Challenge,Competition,4/19/2024 18:29,8/28/1997,Male,United States,Saint Louis University,Information Systems,3/11/2024 12:03,Team Allocated,1070,1/23/2024 17:02,2/15/2024 18:30,1997-08-28_Male_United States,2,Other,146,23,63,26,1,Churned
8/30/2023 2:27,00000000-106T-FSAJ-KDBX-40ZGNV,UrbanRenew Challenge,Competition,4/29/2024 18:29,8/28/1997,Male,United States,Saint Louis University,Information Systems,3/11/2024 12:03,Team Allocated,1070,1/23/2024 17:05,3/21/2024 18:30,1997-08-28_Male_United States,2,Other,146,58,38,26,1,Churned
8/30/2023 2:27,00000000-0GRA-BD28-CXVV-EYEX21,Health Care Management,Internship,,8/28/1997,Male,United States,Saint Louis University,Information Systems,3/11/2024 12:02,Team Allocated,1070,12/24/2023 5:45,1/8/2024 3:30,1997-08-28_Male_United States,2,Other,116,14,,26,1,Churned
8/30/2023 2:27,00000000-0GN2-A0AY-7XK8-C5FZPP,Career Essentials: Getting Started with Your Professional Journey,Course,6/29/2024 18:52,8/28/1997,Male,United States,Saint Louis University,Information Systems,3/11/2024 12:01,Team Allocated,1070,,11/3/2022 18:30,1997-08-28_Male_United States,2,Other,,,604,26,1,Churned
8/29/2023 22:44,00000000-0GRA-BD28-CXVV-EYEX21,Health Care Management,Internship,,3/28/1999,Male,India,Rise Krishna Sai Gandhi group of institutions,Information Systems,3/11/2024 12:02,Team Allocated,1070,8/30/2023 18:40,1/8/2024 3:30,1999-03-28_Male_India,2,Other,0,130,,24,1,Churned
8/29/2023 21:07,00000000-0GRA-BD28-CXVV-EYEX21,Health Care Management,Internship,,12/20/2000,Male,United States,Saint Louis University,Cyber Security,3/11/2024 12:02,Team Allocated,1070,9/19/2023 1:56,1/8/2024 3:30,2000-12-20_Male_United States,2,CS / IT,20,111,,22,1,Churned
8/29/2023 10:36,00000000-0GWQ-AXC5-X45C-2MHJ28,Data Visualization,Internship,3/11/2024 18:00,6/1/1986,Male,India,Nagarjuna College of Engineering & Technology,Data Science,3/11/2024 12:02,Team Allocated,1070,8/30/2023 6:02,1/8/2024 3:30,1986-06-01_Male_India,2,Other,0,130,63,37,1,Churned
8/29/2023 5:20,00000000-10RQ-JXA9-NNKD-EW5RCF,UX Redesign Challenge,Competition,4/19/2024 18:29,11/1/1999,Female,United States,Saint Louis University,Information Systems,3/11/2024 12:03,Team Allocated,1070,,2/15/2024 18:30,1999-11-01_Female_United States,2,Other,,,63,23,1,Churned
9/2/2023 15:18,00000000-0GHB-4N83-QX9K-JM48K2,Project Management,Internship,3/11/2024 18:00,11/1/2007,Male,Bangladesh,Sabujbagh Government College,Computer Engineering,3/11/2024 12:02,Team Allocated,1070,9/2/2023 15:49,1/8/2024 3:30,2007-11-01_Male_Bangladesh,2,CS / IT,0,127,63,15,1,Churned
8/29/2023 2:38,00000000-0GRA-BD28-CXVV-EYEX21,Health Care Management,Internship,,6/4/1998,Male,United States,Saint louis university,Health Data Science,3/11/2024 12:02,Team Allocated,1070,8/30/2023 8:16,1/8/2024 3:30,1998-06-04_Male_United States,2,Other,1,130,,25,1,Churned
8/24/2023 8:38,00000000-0GRA-BD28-CXVV-EYEX21,Health Care Management,Internship,,4/26/1993,Female,Australia,The University of Queensland,Biotechnology,3/11/2024 12:02,Team Allocated,1070,8/25/2023 1:51,1/8/2024 3:30,1993-04-26_Female_Australia,2,Other,0,136,,30,1,Churned
8/29/2023 2:18,00000000-100J-PM3A-0WJ8-5T68M5,Jump Start: Developing your Emotional Intelligence,Course,12/24/2025 3:34,8/31/2000,Female,United States,Kakatiya Institute of Technology,Information Systems,3/11/2024 12:03,Team Allocated,1070,1/27/2024 3:30,1/28/2024 23:30,2000-08-31_Female_United States,2,Other,151,1,695,23,1,Churned
8/28/2023 16:03,00000000-0GHB-4N83-QX9K-JM48K2,Project Management,Internship,3/11/2024 18:00,2/10/1999,Male,United States,Saint Louis University,Computer Information Systems,3/11/2024 12:02,Team Allocated,1070,1/3/2024 21:31,1/8/2024 3:30,1999-02-10_Male_United States,2,CS / IT,128,4,63,24,1,Churned
8/24/2023 3:27,00000000-0GRA-BD28-CXVV-EYEX21,Health Care Management,Internship,,4/27/2001,Female,United States,saint louis university,Information Systems,3/11/2024 12:02,Team Allocated,1070,8/24/2023 4:35,1/8/2024 3:30,2001-04-27_Female_United States,2,Other,0,136,,22,1,Churned
8/28/2023 13:30,00000000-0GWQ-AXC5-X45C-2MHJ28,Data Visualization,Internship,3/11/2024 18:00,7/22/1997,Male,India,Avs enginnering college,Civil Engineering,3/11/2024 12:02,Team Allocated,1070,8/28/2023 13:37,1/8/2024 3:30,1997-07-22_Male_India,2,Engineering,0,132,63,26,1,Churned
8/28/2023 13:30,00000000-0GRA-BD28-CXVV-EYEX21,Health Care Management,Internship,,7/22/1997,Male,India,Avs enginnering college,Civil Engineering,3/11/2024 12:02,Team Allocated,1070,11/1/2023 1:53,1/8/2024 3:30,1997-07-22_Male_India,2,Engineering,64,68,,26,1,Churned
8/28/2023 13:11,00000000-0GWQ-AXC5-X45C-2MHJ28,Data Visualization,Internship,3/11/2024 18:00,10/22/2003,Male,Nepal,Model Secondary School,Computer Science,3/11/2024 12:02,Team Allocated,1070,8/28/2023 13:20,1/8/2024 3:30,2003-10-22_Male_Nepal,2,CS / IT,0,132,63,19,1,Churned
8/28/2023 12:23,00000000-0GNT-FT74-MZT8-93VC0G,Digital Marketing,Internship,3/11/2024 18:00,5/6/2000,Male,India,Master ji degree college,Digital Marketing,3/11/2024 12:01,Team Allocated,1070,8/28/2023 12:48,1/8/2024 3:30,2000-05-06_Male_India,2,CS / IT,0,132,63,23,1,Churned
8/28/2023 11:13,00000000-0GWQ-AXC5-X45C-2MHJ28,Data Visualization,Internship,3/11/2024 18:00,9/16/1996,Male,India,Gujarat Technological University,Other,3/11/2024 12:02,Team Allocated,1070,8/28/2023 11:43,1/8/2024 3:30,1996-09-16_Male_India,2,Other,0,132,63,26,1,Churned
8/27/2023 18:52,00000000-0GRA-BD28-CXVV-EYEX21,Health Care Management,Internship,,3/31/1994,Female,United States,Saint louis university,Health Data Science,3/11/2024 12:02,Team Allocated,1070,8/27/2023 19:14,1/8/2024 3:30,1994-03-31_Female_United States,2,Other,0,133,,29,1,Churned
8/27/2023 17:20,00000000-0GWQ-AXC5-X45C-2MHJ28,Data Visualization,Internship,3/11/2024 18:00,9/22/2003,Female,India,SRNIST RAMAPURAM,Computer Engineering,3/11/2024 12:02,Team Allocated,1070,8/27/2023 17:35,1/8/2024 3:30,2003-09-22_Female_India,2,CS / IT,0,133,63,19,1,Churned
8/27/2023 12:58,00000000-0GHB-4N83-QX9K-JM48K2,Project Management,Internship,3/11/2024 18:00,2/14/2006,Female,India,Heritage Experiential Learning School,Finance and Banking,3/11/2024 12:02,Team Allocated,1070,8/27/2023 13:19,1/8/2024 3:30,2006-02-14_Female_India,2,Other,0,133,63,17,1,Churned
8/27/2023 9:28,00000000-0GWQ-AXC5-X45C-2MHJ28,Data Visualization,Internship,3/11/2024 18:00,11/21/1997,Female,India,NIT-Agartala,Data Analytics,3/11/2024 12:02,Team Allocated,1070,8/27/2023 10:04,1/8/2024 3:30,1997-11-21_Female_India,2,Other,0,133,63,25,1,Churned
8/26/2023 20:35,00000000-10RQ-JXA9-NNKD-EW5RCF,UX Redesign Challenge,Competition,4/19/2024 18:29,8/25/2002,Female,United States,Saint Louis university,Cyber Security,3/11/2024 12:03,Team Allocated,1070,2/13/2024 19:35,2/15/2024 18:30,2002-08-25_Female_United States,2,CS / IT,170,1,63,21,1,Churned
8/26/2023 20:35,00000000-106T-FSAJ-KDBX-40ZGNV,UrbanRenew Challenge,Competition,4/29/2024 18:29,8/25/2002,Female,United States,Saint Louis university,Cyber Security,3/11/2024 12:03,Team Allocated,1070,2/13/2024 19:36,3/21/2024 18:30,2002-08-25_Female_United States,2,CS / IT,170,36,38,21,1,Churned
8/26/2023 20:35,00000000-0GRA-BD28-CXVV-EYEX21,Health Care Management,Internship,,8/25/2002,Female,United States,Saint Louis university,Cyber Security,3/11/2024 12:02,Team Allocated,1070,9/1/2023 16:34,1/8/2024 3:30,2002-08-25_Female_United States,2,CS / IT,5,128,,21,1,Churned
8/26/2023 16:42,00000000-0GWQ-AXC5-X45C-2MHJ28,Data Visualization,Internship,3/11/2024 18:00,10/30/2006,Male,India,Indus International School Pune,Computer Science,3/11/2024 12:02,Team Allocated,1070,8/26/2023 16:52,1/8/2024 3:30,2006-10-30_Male_India,2,CS / IT,0,134,63,16,1,Churned
8/25/2023 22:05,00000000-0GRA-BD28-CXVV-EYEX21,Health Care Management,Internship,,8/18/2001,Male,Pakistan,University of Poonch Rawlakot,Veterinary Science,3/11/2024 12:02,Team Allocated,1070,8/25/2023 22:15,1/8/2024 3:30,2001-08-18_Male_Pakistan,2,Other,0,135,,22,1,Churned
8/25/2023 16:20,00000000-106T-FSAJ-KDBX-40ZGNV,UrbanRenew Challenge,Competition,4/29/2024 18:29,6/21/2000,Male,United States,Saint Louis University,Cyber Security,3/11/2024 12:03,Team Allocated,1070,1/23/2024 17:45,3/21/2024 18:30,2000-06-21_Male_United States,2,CS / IT,151,58,38,23,1,Churned
8/25/2023 15:51,00000000-0GWQ-AXC5-X45C-2MHJ28,Data Visualization,Internship,3/11/2024 18:00,9/27/1989,Female,Nigeria,Applying,Agriculture and Forestry,3/11/2024 12:02,Team Allocated,1070,8/25/2023 16:31,1/8/2024 3:30,1989-09-27_Female_Nigeria,2,Other,0,135,63,33,1,Churned
8/25/2023 2:19,00000000-0GRA-BD28-CXVV-EYEX21,Health Care Management,Internship,,8/21/1999,Female,United States,Saint Louis University,Health Data Science,3/11/2024 12:02,Team Allocated,1070,8/25/2023 2:33,1/8/2024 3:30,1999-08-21_Female_United States,2,Other,0,136,,24,1,Churned
8/24/2023 17:34,00000000-0GRA-BD28-CXVV-EYEX21,Health Care Management,Internship,,11/4/1998,Female,India,Saint Louis University,Information Systems,3/11/2024 12:02,Team Allocated,1070,8/29/2023 16:43,1/8/2024 3:30,1998-11-04_Female_India,2,Other,4,131,,24,1,Churned
8/24/2023 16:37,00000000-100J-PM3A-0WJ8-5T68M5,Jump Start: Developing your Emotional Intelligence,Course,12/24/2025 3:34,7/22/1996,Male,United States,Saint Louis,MS Biostatistics and Health Analytics,3/11/2024 12:03,Team Allocated,1070,1/26/2024 3:35,1/28/2024 23:30,1996-07-22_Male_United States,2,Other,154,2,695,27,1,Churned
8/24/2023 16:37,00000000-10A5-TYD2-181G-D2J679,Xperience Design Hackathon,Competition,3/13/2024 18:29,7/22/1996,Male,United States,Saint Louis,MS Biostatistics and Health Analytics,3/11/2024 12:03,Team Allocated,1070,1/26/2024 3:36,1/28/2024 18:30,1996-07-22_Male_United States,2,Other,154,2,44,27,1,Churned
8/24/2023 16:37,00000000-10RQ-JXA9-NNKD-EW5RCF,UX Redesign Challenge,Competition,4/19/2024 18:29,7/22/1996,Male,United States,Saint Louis,MS Biostatistics and Health Analytics,3/11/2024 12:03,Team Allocated,1070,1/24/2024 3:02,2/15/2024 18:30,1996-07-22_Male_United States,2,Other,152,22,63,27,1,Churned
8/24/2023 16:37,00000000-106T-FSAJ-KDBX-40ZGNV,UrbanRenew Challenge,Competition,4/29/2024 18:29,7/22/1996,Male,United States,Saint Louis,MS Biostatistics and Health Analytics,3/11/2024 12:03,Team Allocated,1070,1/24/2024 3:05,3/21/2024 18:30,1996-07-22_Male_United States,2,Other,152,57,38,27,1,Churned
8/24/2023 16:37,00000000-0GRA-BD28-CXVV-EYEX21,Health Care Management,Internship,,7/22/1996,Male,United States,Saint Louis,MS Biostatistics and Health Analytics,3/11/2024 12:02,Team Allocated,1070,8/24/2023 17:38,1/8/2024 3:30,1996-07-22_Male_United States,2,Other,0,136,,27,1,Churned
8/24/2023 12:33,00000000-106T-FSAJ-KDBX-40ZGNV,UrbanRenew Challenge,Competition,4/29/2024 18:29,11/15/2002,Male,India,seshadri rao gudlavalleru engineering college,Computer Science and Engineering,3/11/2024 12:03,Team Allocated,1070,2/18/2024 4:38,3/21/2024 18:30,2002-11-15_Male_India,2,CS / IT,177,32,38,20,1,Churned
8/24/2023 10:48,00000000-0GRA-BD28-CXVV-EYEX21,Health Care Management,Internship,,10/20/1998,Female,Nigeria,Kwara state university,Public Health,3/11/2024 12:02,Team Allocated,1070,8/24/2023 11:08,1/8/2024 3:30,1998-10-20_Female_Nigeria,2,Other,0,136,,24,1,Churned
8/23/2023 23:28,00000000-0GRA-BD28-CXVV-EYEX21,Health Care Management,Internship,,10/5/1997,Female,Germany,University of Applied Sciences Aachen,Biomedical Engineering,3/11/2024 12:02,Team Allocated,1070,9/6/2023 3:00,1/8/2024 3:30,1997-10-05_Female_Germany,2,Engineering,13,124,,25,1,Churned
8/23/2023 18:53,00000000-0GRA-BD28-CXVV-EYEX21,Health Care Management,Internship,,1/14/1999,Male,United States,Saint Louis University,Data Analytics,3/11/2024 12:02,Team Allocated,1070,8/29/2023 18:02,1/8/2024 3:30,1999-01-14_Male_United States,2,Other,5,131,,24,1,Churned
8/21/2023 13:27,00000000-10YM-B80K-RNNJ-YAVQ7V,Upload Your First Year Transcript,Engagement,12/6/2025 10:26,9/28/2001,Male,India,Saint Louis University,Information Systems,3/11/2024 12:02,Team Allocated,1070,,5/31/2024 7:04,2001-09-28_Male_India,2,Other,,,554,21,1,Churned
8/22/2023 18:39,00000000-0GRA-BD28-CXVV-EYEX21,Health Care Management,Internship,,2/20/2000,Female,United States,Saint Louis University,Information Systems,3/11/2024 12:02,Team Allocated,1070,8/22/2023 18:49,1/8/2024 3:30,2000-02-20_Female_United States,2,Other,0,138,,23,1,Churned
8/23/2023 21:18,00000000-0GRA-BD28-CXVV-EYEX21,Health Care Management,Internship,,8/26/2000,Male,United States,Saint louis university,Computer Information Systems,3/11/2024 12:02,Team Allocated,1070,9/17/2023 3:39,1/8/2024 3:30,2000-08-26_Male_United States,2,CS / IT,24,112,,23,1,Churned
8/23/2023 18:53,00000000-0GRA-BD28-CXVV-EYEX21,Health Care Management,Internship,,9/22/1998,Female,United States,saint louis university,Medical Informatics,3/11/2024 12:02,Team Allocated,1070,,1/8/2024 3:30,1998-09-22_Female_United States,2,Other,,,,24,1,Churned
8/23/2023 18:30,00000000-0GHB-4N83-QX9K-JM48K2,Project Management,Internship,3/11/2024 18:00,11/7/1996,Female,India,Sv college of engineering for women,Data Analysis,3/11/2024 12:02,Team Allocated,1070,8/24/2023 8:24,1/8/2024 3:30,1996-11-07_Female_India,2,Other,0,136,63,26,1,Churned
8/23/2023 18:28,00000000-0GRA-BD28-CXVV-EYEX21,Health Care Management,Internship,,12/15/1999,Female,United States,St. Louis university,Computer Information Systems,3/11/2024 12:02,Team Allocated,1070,8/28/2023 23:21,1/8/2024 3:30,1999-12-15_Female_United States,2,CS / IT,5,132,,23,1,Churned
8/23/2023 18:05,00000000-0GRA-BD28-CXVV-EYEX21,Health Care Management,Internship,,9/1/1999,Male,India,saint louis university,Information Systems,3/11/2024 12:02,Team Allocated,1070,,1/8/2024 3:30,1999-09-01_Male_India,2,Other,,,,23,1,Churned
8/23/2023 17:51,00000000-0GRA-BD28-CXVV-EYEX21,Health Care Management,Internship,,6/4/2001,Male,United States,Saint Louis University,Information Systems,3/11/2024 12:02,Team Allocated,1070,9/29/2023 23:25,1/8/2024 3:30,2001-06-04_Male_United States,2,Other,37,100,,22,1,Churned
8/23/2023 15:19,00000000-0GRA-BD28-CXVV-EYEX21,Health Care Management,Internship,,11/21/1999,Female,United States,Saint Louis University,Public Health,3/11/2024 12:02,Team Allocated,1070,8/25/2023 23:30,1/8/2024 3:30,1999-11-21_Female_United States,2,Other,2,135,,23,1,Churned
8/23/2023 15:19,00000000-0GRA-BD28-CXVV-EYEX21,Health Care Management,Internship,,10/17/1998,Female,United States,Saint Louis university,Health Data Science,3/11/2024 12:02,Team Allocated,1070,9/1/2023 6:32,1/8/2024 3:30,1998-10-17_Female_United States,2,Other,8,128,,24,1,Churned
8/23/2023 7:47,00000000-0GWQ-AXC5-X45C-2MHJ28,Data Visualization,Internship,3/11/2024 18:00,9/22/2001,Female,India,Keshav memorial Institute of commerce and science,Mathematics,3/11/2024 12:02,Team Allocated,1070,8/23/2023 8:03,1/8/2024 3:30,2001-09-22_Female_India,2,Other,0,137,63,21,1,Churned
8/23/2023 4:21,00000000-0GRA-BD28-CXVV-EYEX21,Health Care Management,Internship,,6/3/1998,Male,United States,Saint Louis University,Health Data Science,3/11/2024 12:02,Team Allocated,1070,11/16/2023 19:20,1/8/2024 3:30,1998-06-03_Male_United States,2,Other,85,52,,25,1,Churned
8/22/2023 23:38,00000000-0GRA-BD28-CXVV-EYEX21,Health Care Management,Internship,,6/14/1999,Male,United States,Saint Louis University,Information Systems,3/11/2024 12:02,Team Allocated,1070,8/25/2023 2:22,1/8/2024 3:30,1999-06-14_Male_United States,2,Other,2,136,,24,1,Churned
8/22/2023 19:48,00000000-0GRA-BD28-CXVV-EYEX21,Health Care Management,Internship,,9/28/1997,Male,United States,saint louis university,Health Data Science,3/11/2024 12:02,Team Allocated,1070,8/22/2023 20:10,1/8/2024 3:30,1997-09-28_Male_United States,2,Other,0,138,,25,1,Churned
8/22/2023 16:45,00000000-0GRA-BD28-CXVV-EYEX21,Health Care Management,Internship,,6/4/2001,Female,India,Karunya Institute of Technology and Sciences,Biotechnology,3/11/2024 12:02,Team Allocated,1070,9/1/2023 13:08,1/8/2024 3:30,2001-06-04_Female_India,2,Other,9,128,,22,1,Churned
8/21/2023 13:27,00000000-106T-FSAJ-KDBX-40ZGNV,UrbanRenew Challenge,Competition,4/29/2024 18:29,9/28/2001,Male,India,Saint Louis University,Information Systems,3/11/2024 12:03,Team Allocated,1070,1/27/2024 2:10,3/21/2024 18:30,2001-09-28_Male_India,2,Other,158,54,38,21,1,Churned
8/22/2023 13:53,00000000-0GRA-BD28-CXVV-EYEX21,Health Care Management,Internship,,5/9/2001,Male,India,Camellia institute of engineering and technology,Electrical Engineering,3/11/2024 12:02,Team Allocated,1070,8/22/2023 14:30,1/8/2024 3:30,2001-05-09_Male_India,2,Engineering,0,138,,22,1,Churned
8/22/2023 13:34,00000000-0GWQ-AXC5-X45C-2MHJ28,Data Visualization,Internship,3/11/2024 18:00,7/30/1998,Male,India,K.S.G.M COLLAGE,Data Science and Artificial Intelligence,3/11/2024 12:02,Team Allocated,1070,8/23/2023 6:00,1/8/2024 3:30,1998-07-30_Male_India,2,Other,0,137,63,25,1,Churned
8/22/2023 10:59,00000000-0GRA-BD28-CXVV-EYEX21,Health Care Management,Internship,,6/6/2007,Female,India,oakridge,Mathematics,3/11/2024 12:02,Team Allocated,1070,8/22/2023 11:49,1/8/2024 3:30,2007-06-06_Female_India,2,Other,0,138,,16,1,Churned
8/22/2023 10:18,00000000-0GWQ-AXC5-X45C-2MHJ28,Data Visualization,Internship,3/11/2024 18:00,1/19/1998,Male,Nigeria,University of Ilorin,Library and Information Management,3/11/2024 12:02,Team Allocated,1070,8/30/2023 9:35,1/8/2024 3:30,1998-01-19_Male_Nigeria,2,Business,7,130,63,25,1,Churned
8/22/2023 10:07,00000000-0GWQ-AXC5-X45C-2MHJ28,Data Visualization,Internship,3/11/2024 18:00,1/28/1998,Male,Ghana,KNUST,Physics and Astronomy,3/11/2024 12:02,Team Allocated,1070,8/22/2023 11:19,1/8/2024 3:30,1998-01-28_Male_Ghana,2,Other,0,138,63,25,1,Churned
8/22/2023 3:09,00000000-0GRA-BD28-CXVV-EYEX21,Health Care Management,Internship,,7/2/1993,Male,United States,Saint Louis University,Data Analytics,3/11/2024 12:02,Team Allocated,1070,12/23/2023 22:07,1/8/2024 3:30,1993-07-02_Male_United States,2,Other,123,15,,30,1,Churned
8/22/2023 1:23,00000000-0GRA-BD28-CXVV-EYEX21,Health Care Management,Internship,,6/3/2000,Male,United States,Saint Louis University,Information Systems,3/11/2024 12:02,Team Allocated,1070,8/22/2023 16:10,1/8/2024 3:30,2000-06-03_Male_United States,2,Other,0,138,,23,1,Churned
8/21/2023 19:55,00000000-0GRA-BD28-CXVV-EYEX21,Health Care Management,Internship,,9/15/2000,Female,United States,University of Central Missouri,Computer Science,3/11/2024 12:02,Team Allocated,1070,8/21/2023 21:17,1/8/2024 3:30,2000-09-15_Female_United States,2,CS / IT,0,139,,22,1,Churned
8/21/2023 18:07,00000000-0GRA-BD28-CXVV-EYEX21,Health Care Management,Internship,,7/30/2002,Female,India,Saint Louis University,Computer Science,3/11/2024 12:02,Team Allocated,1070,8/29/2023 16:50,1/8/2024 3:30,2002-07-30_Female_India,2,CS / IT,7,131,,21,1,Churned
8/21/2023 14:44,00000000-0GRA-BD28-CXVV-EYEX21,Health Care Management,Internship,,11/3/1986,Male,Nigeria,University Of Calabar,Health Data Science,3/11/2024 12:02,Team Allocated,1070,8/22/2023 11:08,1/8/2024 3:30,1986-11-03_Male_Nigeria,2,Other,0,138,,36,1,Churned
8/21/2023 13:27,00000000-10A5-TYD2-181G-D2J679,Xperience Design Hackathon,Competition,3/13/2024 18:29,9/28/2001,Male,India,Saint Louis University,Information Systems,3/11/2024 12:03,Team Allocated,1070,1/27/2024 2:09,1/28/2024 18:30,2001-09-28_Male_India,2,Other,158,1,44,21,1,Churned
8/21/2023 13:27,00000000-10RQ-JXA9-NNKD-EW5RCF,UX Redesign Challenge,Competition,4/19/2024 18:29,9/28/2001,Male,India,Saint Louis University,Information Systems,3/11/2024 12:03,Team Allocated,1070,1/27/2024 2:10,2/15/2024 18:30,2001-09-28_Male_India,2,Other,158,19,63,21,1,Churned
12/25/2023 19:00,00000000-106T-FSAJ-KDBX-40ZGNV,UrbanRenew Challenge,Competition,4/29/2024 18:29,6/26/1999,Male,United States,Saint Louis,Information Systems,3/11/2024 12:03,Team Allocated,1070,2/11/2024 16:34,3/21/2024 18:30,1999-06-26_Male_United States,2,Other,47,39,38,24,1,Churned
6/25/2023 8:04,00000000-0GRA-BD28-CXVV-EYEX21,Health Care Management,Internship,,11/8/2004,Male,Nigeria,Airforce Secondary School Makurdi,Psychology,3/11/2024 12:02,Team Allocated,1070,6/25/2023 8:35,1/8/2024 3:30,2004-11-08_Male_Nigeria,2,Other,0,196,,18,1,Churned
12/26/2023 5:23,00000000-0GRA-BD28-CXVV-EYEX21,Health Care Management,Internship,,3/15/2000,Female,United States,saint louis university,Computer Science,3/11/2024 12:02,Team Allocated,1070,12/26/2023 5:39,1/8/2024 3:30,2000-03-15_Female_United States,2,CS / IT,0,12,,23,1,Churned
8/16/2023 20:32,00000000-0GN2-A0AY-7XK8-C5FZPP,Career Essentials: Getting Started with Your Professional Journey,Course,6/29/2024 18:52,7/28/2000,Male,India,Saint Louis University,Information Systems,3/11/2024 12:01,Team Allocated,1070,,11/3/2022 18:30,2000-07-28_Male_India,2,Other,,,604,23,1,Churned
8/20/2023 3:41,00000000-0GRA-BD28-CXVV-EYEX21,Health Care Management,Internship,,12/9/2003,Female,India,PSGR KRISHNAMMAL COLLEGE FOR WOMEN,Zoology,3/11/2024 12:02,Team Allocated,1070,8/20/2023 4:20,1/8/2024 3:30,2003-12-09_Female_India,2,Other,0,140,,19,1,Churned
8/21/2023 10:49,00000000-0GWQ-AXC5-X45C-2MHJ28,Data Visualization,Internship,3/11/2024 18:00,3/2/2001,Male,India,St.Joseph’s degree and PG college,Statistics and Computeri Science,3/11/2024 12:02,Team Allocated,1070,8/21/2023 11:13,1/8/2024 3:30,2001-03-02_Male_India,2,CS / IT,0,139,63,22,1,Churned
8/21/2023 10:43,00000000-0GWQ-AXC5-X45C-2MHJ28,Data Visualization,Internship,3/11/2024 18:00,8/18/1990,Male,Ethiopia,University of Twente,Data Science and Artificial Intelligence,3/11/2024 12:02,Team Allocated,1070,8/21/2023 11:05,1/8/2024 3:30,1990-08-18_Male_Ethiopia,2,Other,0,139,63,33,1,Churned
8/21/2023 8:10,00000000-0GZY-NNHV-FJWW-PTA9VX,Innovation & Entrepreneurship,Internship,3/11/2024 18:00,1/14/2004,Male,"Tanzania, United Republic Of Tanzania",ILBORU HIGH SCHOOL,Software Engineering,3/11/2024 12:02,Team Allocated,1070,8/21/2023 8:57,1/8/2024 3:30,"2004-01-14_Male_Tanzania, United Republic Of Tanzania",2,CS / IT,0,139,63,19,1,Churned
8/21/2023 5:00,00000000-0GRA-BD28-CXVV-EYEX21,Health Care Management,Internship,,7/24/2001,Female,United States,saint louis university,Bioinformatics,3/11/2024 12:02,Team Allocated,1070,8/21/2023 5:43,1/8/2024 3:30,2001-07-24_Female_United States,2,Other,0,139,,22,1,Churned
8/20/2023 23:53,00000000-10WC-BS50-CYGD-X97ES4,CPR/AED Certification,Course,6/30/2024 16:18,7/13/1997,Female,United States,saint louis university,Epidemiology,3/11/2024 12:02,Team Allocated,1070,,3/20/2023 2:30,1997-07-13_Female_United States,2,Other,,,468,26,1,Churned
8/20/2023 23:53,00000000-0GRA-BD28-CXVV-EYEX21,Health Care Management,Internship,,7/13/1997,Female,United States,saint louis university,Epidemiology,3/11/2024 12:02,Team Allocated,1070,8/22/2023 11:43,1/8/2024 3:30,1997-07-13_Female_United States,2,Other,1,138,,26,1,Churned
8/20/2023 22:13,00000000-0GRA-BD28-CXVV-EYEX21,Health Care Management,Internship,,5/15/2001,Male,India,Saint Louis university,Public Health,3/11/2024 12:02,Team Allocated,1070,8/28/2023 19:15,1/8/2024 3:30,2001-05-15_Male_India,2,Other,7,132,,22,1,Churned
8/20/2023 21:29,00000000-0GRA-BD28-CXVV-EYEX21,Health Care Management,Internship,,10/12/2001,Female,United States,saint louis univeristy,Artificial Intelligence,3/11/2024 12:02,Team Allocated,1070,,1/8/2024 3:30,2001-10-12_Female_United States,2,Other,,,,21,1,Churned
8/20/2023 19:32,00000000-0GHB-4N83-QX9K-JM48K2,Project Management,Internship,3/11/2024 18:00,9/17/2002,Female,India,St. Joseph's degree and pg college,Computer Science,3/11/2024 12:02,Team Allocated,1070,8/20/2023 19:49,1/8/2024 3:30,2002-09-17_Female_India,2,CS / IT,0,140,63,20,1,Churned
8/20/2023 18:21,00000000-0GRA-BD28-CXVV-EYEX21,Health Care Management,Internship,,8/15/2000,Female,United States,Saint Louis University,Bioinformatics,3/11/2024 12:02,Team Allocated,1070,11/1/2023 17:51,1/8/2024 3:30,2000-08-15_Female_United States,2,Other,72,67,,23,1,Churned
8/20/2023 18:21,00000000-0GRA-BD28-CXVV-EYEX21,Health Care Management,Internship,,9/12/1999,Female,United States,Saint Louis University,Bioinformatics,3/11/2024 12:02,Team Allocated,1070,11/1/2023 17:57,1/8/2024 3:30,1999-09-12_Female_United States,2,Other,72,67,,23,1,Churned
8/20/2023 7:44,00000000-0GZY-NNHV-FJWW-PTA9VX,Innovation & Entrepreneurship,Internship,3/11/2024 18:00,1/1/2007,Male,India,vibgyor,MBA,3/11/2024 12:02,Team Allocated,1070,9/15/2023 13:53,1/8/2024 3:30,2007-01-01_Male_India,2,Other,26,114,63,16,1,Churned
8/20/2023 3:03,00000000-0GRA-BD28-CXVV-EYEX21,Health Care Management,Internship,,10/22/1997,Male,United States,saint louis university,Information Systems,3/11/2024 12:02,Team Allocated,1070,8/20/2023 3:27,1/8/2024 3:30,1997-10-22_Male_United States,2,Other,0,141,,25,1,Churned
8/19/2023 9:54,00000000-0GHB-4N83-QX9K-JM48K2,Project Management,Internship,3/11/2024 18:00,9/24/2006,Male,India,Alpha Junior College of Science & Commerce,Computer Science and Engineering,3/11/2024 12:02,Team Allocated,1070,12/8/2023 18:36,1/8/2024 3:30,2006-09-24_Male_India,2,CS / IT,111,30,63,16,1,Churned
8/19/2023 22:20,00000000-0GRA-BD28-CXVV-EYEX21,Health Care Management,Internship,,8/27/1994,Male,India,saint louis university,Health Data Science,3/11/2024 12:02,Team Allocated,1070,8/19/2023 22:52,1/8/2024 3:30,1994-08-27_Male_India,2,Other,0,141,,28,1,Churned
8/19/2023 19:51,00000000-0GNT-FT74-MZT8-93VC0G,Digital Marketing,Internship,3/11/2024 18:00,4/12/2007,Male,India,Podar International School,Computer Engineering,3/11/2024 12:02,Team Allocated,1070,8/19/2023 20:19,1/8/2024 3:30,2007-04-12_Male_India,2,CS / IT,0,141,63,16,1,Churned
8/19/2023 19:37,00000000-100J-PM3A-0WJ8-5T68M5,Jump Start: Developing your Emotional Intelligence,Course,12/24/2025 3:34,10/30/2001,Male,United States,Saint louis university,Information Systems,3/11/2024 12:03,Team Allocated,1070,1/27/2024 2:08,1/28/2024 23:30,2001-10-30_Male_United States,2,Other,160,1,695,21,1,Churned
8/19/2023 19:37,00000000-10A5-TYD2-181G-D2J679,Xperience Design Hackathon,Competition,3/13/2024 18:29,10/30/2001,Male,United States,Saint louis university,Information Systems,3/11/2024 12:03,Team Allocated,1070,1/27/2024 2:02,1/28/2024 18:30,2001-10-30_Male_United States,2,Other,160,1,44,21,1,Churned
8/19/2023 19:37,00000000-10RQ-JXA9-NNKD-EW5RCF,UX Redesign Challenge,Competition,4/19/2024 18:29,10/30/2001,Male,United States,Saint louis university,Information Systems,3/11/2024 12:03,Team Allocated,1070,1/27/2024 2:02,2/15/2024 18:30,2001-10-30_Male_United States,2,Other,160,19,63,21,1,Churned
8/19/2023 19:37,00000000-106T-FSAJ-KDBX-40ZGNV,UrbanRenew Challenge,Competition,4/29/2024 18:29,10/30/2001,Male,United States,Saint louis university,Information Systems,3/11/2024 12:03,Team Allocated,1070,1/27/2024 2:03,3/21/2024 18:30,2001-10-30_Male_United States,2,Other,160,54,38,21,1,Churned
8/19/2023 19:37,00000000-0GRA-BD28-CXVV-EYEX21,Health Care Management,Internship,,10/30/2001,Male,United States,Saint louis university,Information Systems,3/11/2024 12:02,Team Allocated,1070,8/19/2023 21:22,1/8/2024 3:30,2001-10-30_Male_United States,2,Other,0,141,,21,1,Churned
8/19/2023 16:29,00000000-0GRA-BD28-CXVV-EYEX21,Health Care Management,Internship,,3/19/2007,Female,China,广州市实验外语学校,Chemistry,3/11/2024 12:02,Team Allocated,1070,8/20/2023 4:53,1/8/2024 3:30,2007-03-19_Female_China,2,Other,0,140,,16,1,Churned
8/19/2023 15:59,00000000-0GWQ-AXC5-X45C-2MHJ28,Data Visualization,Internship,3/11/2024 18:00,6/15/2007,Female,Nigeria,James Hope College,Digital Media,3/11/2024 12:02,Team Allocated,1070,8/19/2023 16:46,1/8/2024 3:30,2007-06-15_Female_Nigeria,2,CS / IT,0,141,63,16,1,Churned
8/19/2023 15:27,00000000-0GRA-BD28-CXVV-EYEX21,Health Care Management,Internship,,8/18/2010,Female,China,珠海一附国际部,Chemistry,3/11/2024 12:02,Team Allocated,1070,8/27/2023 7:16,1/8/2024 3:30,2010-08-18_Female_China,2,Other,7,133,,13,1,Churned
8/19/2023 15:27,00000000-0GNT-FT74-MZT8-93VC0G,Digital Marketing,Internship,3/11/2024 18:00,8/18/2010,Female,China,珠海一附国际部,Chemistry,3/11/2024 12:01,Team Allocated,1070,8/27/2023 7:21,1/8/2024 3:30,2010-08-18_Female_China,2,Other,7,133,63,13,1,Churned
8/19/2023 14:52,00000000-10RQ-JXA9-NNKD-EW5RCF,UX Redesign Challenge,Competition,4/19/2024 18:29,8/22/1999,Male,United States,saint louis university,Information Systems,3/11/2024 12:03,Team Allocated,1070,2/12/2024 18:35,2/15/2024 18:30,1999-08-22_Male_United States,2,Other,177,2,63,24,1,Churned
8/19/2023 9:54,00000000-0GNT-FT74-MZT8-93VC0G,Digital Marketing,Internship,3/11/2024 18:00,9/24/2006,Male,India,Alpha Junior College of Science & Commerce,Computer Science and Engineering,3/11/2024 12:01,Team Allocated,1070,12/8/2023 14:42,1/8/2024 3:30,2006-09-24_Male_India,2,CS / IT,111,30,63,16,1,Churned
8/19/2023 7:53,00000000-0GRA-BD28-CXVV-EYEX21,Health Care Management,Internship,,8/30/2002,Female,India,Jawaharlal Nehru Medical College,Bachelor of Medicine Bachelor of Surgery,3/11/2024 12:02,Team Allocated,1070,9/8/2023 6:05,1/8/2024 3:30,2002-08-30_Female_India,2,Other,19,121,,20,1,Churned
8/19/2023 4:58,00000000-0GRA-BD28-CXVV-EYEX21,Health Care Management,Internship,,10/1/1997,Female,India,Rajiv gandhi Institute of Health sciences,Public Health,3/11/2024 12:02,Team Allocated,1070,8/19/2023 5:14,1/8/2024 3:30,1997-10-01_Female_India,2,Other,0,141,,25,1,Churned
8/18/2023 1:46,00000000-0GRA-BD28-CXVV-EYEX21,Health Care Management,Internship,,8/10/2000,Male,United States,Saint Louis University,Cyber Security,3/11/2024 12:02,Team Allocated,1070,12/12/2023 19:11,1/8/2024 3:30,2000-08-10_Male_United States,2,CS / IT,116,26,,23,1,Churned
8/19/2023 3:18,00000000-0GRA-BD28-CXVV-EYEX21,Health Care Management,Internship,,5/17/1996,Female,United States,Saint Louis University,Public Health,3/11/2024 12:02,Team Allocated,1070,10/12/2023 6:34,1/8/2024 3:30,1996-05-17_Female_United States,2,Other,54,87,,27,1,Churned
8/18/2023 23:14,00000000-0GRA-BD28-CXVV-EYEX21,Health Care Management,Internship,,6/29/1997,Male,United States,Saint louisuniversity,Health Data Science,3/11/2024 12:02,Team Allocated,1070,8/19/2023 1:33,1/8/2024 3:30,1997-06-29_Male_United States,2,Other,0,142,,26,1,Churned
8/18/2023 22:50,00000000-0GN2-A0AY-7XK8-C5FZPP,Career Essentials: Getting Started with Your Professional Journey,Course,6/29/2024 18:52,7/6/1998,Male,United States,Saint Louis University,Cyber Security,3/11/2024 12:01,Team Allocated,1070,,11/3/2022 18:30,1998-07-06_Male_United States,2,CS / IT,,,604,25,1,Churned
8/18/2023 22:40,00000000-0GRA-BD28-CXVV-EYEX21,Health Care Management,Internship,,8/29/1997,Male,India,Saint Louis University,Information Systems,3/11/2024 12:02,Team Allocated,1070,,1/8/2024 3:30,1997-08-29_Male_India,2,Other,,,,25,1,Churned
8/18/2023 22:34,00000000-0GRA-BD28-CXVV-EYEX21,Health Care Management,Internship,,4/23/2000,Male,United States,Saint Louis University,Information Systems,3/11/2024 12:02,Team Allocated,1070,10/8/2023 4:54,1/8/2024 3:30,2000-04-23_Male_United States,2,Other,50,91,,23,1,Churned
8/18/2023 20:59,00000000-0GRA-BD28-CXVV-EYEX21,Health Care Management,Internship,,12/22/1998,Female,United States,Saint Louis University,Public Health,3/11/2024 12:02,Team Allocated,1070,8/18/2023 21:19,1/8/2024 3:30,1998-12-22_Female_United States,2,Other,0,142,,24,1,Churned
8/18/2023 20:27,00000000-0GRA-BD28-CXVV-EYEX21,Health Care Management,Internship,,2/1/2000,Male,United States,Saint Louis University,Computer Science,3/11/2024 12:02,Team Allocated,1070,8/21/2023 15:38,1/8/2024 3:30,2000-02-01_Male_United States,2,CS / IT,2,139,,23,1,Churned
8/18/2023 19:58,00000000-0GRA-BD28-CXVV-EYEX21,Health Care Management,Internship,,6/20/1998,Female,United States,siddhpur dental college and hospital,Epidemiology,3/11/2024 12:02,Team Allocated,1070,8/22/2023 20:24,1/8/2024 3:30,1998-06-20_Female_United States,2,Other,4,138,,25,1,Churned
8/18/2023 17:52,00000000-10YM-B80K-RNNJ-YAVQ7V,Upload Your First Year Transcript,Engagement,12/6/2025 10:26,2/26/2000,Female,United States,Saint Louis University,Computer Science,3/11/2024 12:02,Team Allocated,1070,1/15/2024 7:15,5/31/2024 7:04,2000-02-26_Female_United States,2,CS / IT,149,136,554,23,1,Churned
8/18/2023 11:09,00000000-0GRA-BD28-CXVV-EYEX21,Health Care Management,Internship,,6/21/2002,Female,India,Victoria Institution college,Geography,3/11/2024 12:02,Team Allocated,1070,8/18/2023 13:51,1/8/2024 3:30,2002-06-21_Female_India,2,Other,0,142,,21,1,Churned
8/18/2023 4:41,00000000-0GWQ-AXC5-X45C-2MHJ28,Data Visualization,Internship,3/11/2024 18:00,6/17/1992,Female,India,Kumanu University Nainital Uttarakhand,Mathematics,3/11/2024 12:02,Team Allocated,1070,8/18/2023 4:59,1/8/2024 3:30,1992-06-17_Female_India,2,Other,0,142,63,31,1,Churned
8/18/2023 2:54,00000000-0GRA-BD28-CXVV-EYEX21,Health Care Management,Internship,,6/17/1998,Male,United States,ST. Louis University,Health Data Science,3/11/2024 12:02,Team Allocated,1070,8/18/2023 3:30,1/8/2024 3:30,1998-06-17_Male_United States,2,Other,0,143,,25,1,Churned
8/17/2023 17:58,00000000-0GWQ-AXC5-X45C-2MHJ28,Data Visualization,Internship,3/11/2024 18:00,6/6/2000,Male,Ethiopia,Addis Ababa Science and Technology University,Cyber Security,3/11/2024 12:02,Team Allocated,1070,8/17/2023 19:35,1/8/2024 3:30,2000-06-06_Male_Ethiopia,2,CS / IT,0,143,63,23,1,Churned
8/16/2023 21:37,00000000-0GRA-BD28-CXVV-EYEX21,Health Care Management,Internship,,11/3/1999,Female,United States,Saint Louis University,Computer Science,3/11/2024 12:02,Team Allocated,1070,8/16/2023 21:50,1/8/2024 3:30,1999-11-03_Female_United States,2,CS / IT,0,144,,23,1,Churned
8/17/2023 17:58,00000000-0GRA-BD28-CXVV-EYEX21,Health Care Management,Internship,,6/6/2000,Male,Ethiopia,Addis Ababa Science and Technology University,Cyber Security,3/11/2024 12:02,Team Allocated,1070,8/17/2023 19:30,1/8/2024 3:30,2000-06-06_Male_Ethiopia,2,CS / IT,0,143,,23,1,Churned
8/17/2023 17:58,00000000-0GNT-FT74-MZT8-93VC0G,Digital Marketing,Internship,3/11/2024 18:00,6/6/2000,Male,Ethiopia,Addis Ababa Science and Technology University,Cyber Security,3/11/2024 12:01,Team Allocated,1070,8/17/2023 19:21,1/8/2024 3:30,2000-06-06_Male_Ethiopia,2,CS / IT,0,143,63,23,1,Churned
8/17/2023 17:52,00000000-0GRA-BD28-CXVV-EYEX21,Health Care Management,Internship,,7/24/1993,Female,United States,Saint Louis University,Data Analytics,3/11/2024 12:02,Team Allocated,1070,12/9/2023 23:30,1/8/2024 3:30,1993-07-24_Female_United States,2,Other,114,29,,30,1,Churned
8/17/2023 17:00,00000000-0GRA-BD28-CXVV-EYEX21,Health Care Management,Internship,,12/17/2002,Female,Qatar,University of Doha for Science and Technology,Healthcare Management,3/11/2024 12:02,Team Allocated,1070,8/17/2023 17:13,1/8/2024 3:30,2002-12-17_Female_Qatar,2,Business,0,143,,20,1,Churned
8/17/2023 16:57,00000000-0GNT-FT74-MZT8-93VC0G,Digital Marketing,Internship,3/11/2024 18:00,10/30/2000,Male,Ghana,eMarketing Institute,Digital Marketing,3/11/2024 12:01,Team Allocated,1070,8/18/2023 12:35,1/8/2024 3:30,2000-10-30_Male_Ghana,2,CS / IT,0,142,63,22,1,Churned
8/17/2023 15:50,00000000-0GRA-BD28-CXVV-EYEX21,Health Care Management,Internship,,5/26/1999,Female,India,Sarojini naidu vanitha pharmacy mahavidyalaya,Health Data Science,3/11/2024 12:02,Team Allocated,1070,,1/8/2024 3:30,1999-05-26_Female_India,2,Other,,,,24,1,Churned
8/17/2023 11:36,00000000-0GWQ-AXC5-X45C-2MHJ28,Data Visualization,Internship,3/11/2024 18:00,8/5/1999,Female,Nigeria,University of Port-harcourt,Bioinformatics,3/11/2024 12:02,Team Allocated,1070,8/17/2023 12:28,1/8/2024 3:30,1999-08-05_Female_Nigeria,2,Other,0,143,63,24,1,Churned
8/17/2023 10:18,00000000-0GWQ-AXC5-X45C-2MHJ28,Data Visualization,Internship,3/11/2024 18:00,6/16/2002,Male,India,Kakinada institute of engineering and technology,Computer Science and Engineering,3/11/2024 12:02,Team Allocated,1070,8/17/2023 10:25,1/8/2024 3:30,2002-06-16_Male_India,2,CS / IT,0,143,63,21,1,Churned
8/17/2023 7:13,00000000-0GWQ-AXC5-X45C-2MHJ28,Data Visualization,Internship,3/11/2024 18:00,1/12/1996,Male,India,Shri Shankaracharya College Of Engineering And Technology,Computer Science and Engineering,3/11/2024 12:02,Team Allocated,1070,8/18/2023 7:59,1/8/2024 3:30,1996-01-12_Male_India,2,CS / IT,1,142,63,27,1,Churned
8/17/2023 5:25,00000000-0GNT-FT74-MZT8-93VC0G,Digital Marketing,Internship,3/11/2024 18:00,8/3/1996,Male,India,Carlox teacher's university,Manager,3/11/2024 12:02,Team Allocated,1070,8/17/2023 5:34,1/8/2024 3:30,1996-08-03_Male_India,2,Other,0,143,63,27,1,Churned
8/17/2023 3:37,00000000-0GRA-BD28-CXVV-EYEX21,Health Care Management,Internship,,7/4/1999,Male,United States,Nalla narsimha Reddy group of institutions,Computer Information Systems,3/11/2024 12:02,Team Allocated,1070,9/28/2023 6:08,1/8/2024 3:30,1999-07-04_Male_United States,2,CS / IT,42,101,,24,1,Churned
8/17/2023 1:08,00000000-0GRA-BD28-CXVV-EYEX21,Health Care Management,Internship,,2/10/2002,Female,United States,Springfield College,Biology,3/11/2024 12:02,Team Allocated,1070,8/19/2023 16:28,1/8/2024 3:30,2002-02-10_Female_United States,2,Other,2,141,,21,1,Churned
8/16/2023 20:32,00000000-10RQ-JXA9-NNKD-EW5RCF,UX Redesign Challenge,Competition,4/19/2024 18:29,7/28/2000,Male,India,Saint Louis University,Information Systems,3/11/2024 12:03,Team Allocated,1070,1/24/2024 5:40,2/15/2024 18:30,2000-07-28_Male_India,2,Other,160,22,63,23,1,Churned
8/10/2023 22:03,00000000-0GRA-BD28-CXVV-EYEX21,Health Care Management,Internship,,8/6/2001,Male,India,Saint Louis university,Computer Information Systems,3/11/2024 12:02,Team Allocated,1070,8/10/2023 23:02,1/8/2024 3:30,2001-08-06_Male_India,2,CS / IT,0,150,,22,1,Churned
7/9/2023 11:06,00000000-10QW-PYTT-CJCX-7VQBTT,Join a Student Organisation,Engagement,12/5/2025 12:59,8/14/1997,Female,India,saint louis university,Public Health,3/11/2024 12:02,Team Allocated,1070,,8/21/2023 6:30,1997-08-14_Female_India,2,Other,,,837,25,1,Churned
8/16/2023 15:30,00000000-0GRA-BD28-CXVV-EYEX21,Health Care Management,Internship,,6/26/2002,Male,India,Saint Louis University,Computer Science,3/11/2024 12:02,Team Allocated,1070,12/12/2023 17:09,1/8/2024 3:30,2002-06-26_Male_India,2,CS / IT,118,26,,21,1,Churned
8/15/2023 12:41,00000000-0GNT-FT74-MZT8-93VC0G,Digital Marketing,Internship,3/11/2024 18:00,5/15/1998,Female,United Kingdom,Caleb university,Project Management,3/11/2024 12:01,Team Allocated,1070,8/15/2023 14:27,1/8/2024 3:30,1998-05-15_Female_United Kingdom,2,Business,0,145,63,25,1,Churned
8/16/2023 14:55,00000000-0GHB-4N83-QX9K-JM48K2,Project Management,Internship,3/11/2024 18:00,11/21/1989,Female,Nigeria,Ahmadu Bello University,International Relations,3/11/2024 12:02,Team Allocated,1070,8/16/2023 15:31,1/8/2024 3:30,1989-11-21_Female_Nigeria,2,Other,0,144,63,33,1,Churned
8/16/2023 13:35,00000000-0GN2-A0AY-7XK8-C5FZPP,Career Essentials: Getting Started with Your Professional Journey,Course,6/29/2024 18:52,3/26/1977,Female,United States,Saint Louis University,Applied Financial Economics,3/11/2024 12:01,Team Allocated,1070,,11/3/2022 18:30,1977-03-26_Female_United States,2,Other,,,604,46,1,Churned
8/16/2023 9:51,00000000-0GWQ-AXC5-X45C-2MHJ28,Data Visualization,Internship,3/11/2024 18:00,12/16/1997,Female,Nigeria,University of Port-Harcourt,Bioinformatics,3/11/2024 12:02,Team Allocated,1070,8/17/2023 12:28,1/8/2024 3:30,1997-12-16_Female_Nigeria,2,Other,1,143,63,25,1,Churned
,00000000-0GRA-BD28-CXVV-EYEX21,Health Care Management,Internship,,1/24/2002,Female,Nigeria,Global wealth University Togo,Health Care Management,3/11/2024 12:02,Team Allocated,1070,,1/8/2024 3:30,2002-01-24_Female_Nigeria,2,Business,,,,,1,Churned
8/15/2023 20:58,00000000-0GHB-4N83-QX9K-JM48K2,Project Management,Internship,3/11/2024 18:00,9/20/1984,Male,Nigeria,University of Jos,Film Making,3/11/2024 12:02,Team Allocated,1070,8/15/2023 21:08,1/8/2024 3:30,1984-09-20_Male_Nigeria,2,Other,0,145,63,38,1,Churned
8/15/2023 19:08,00000000-0GHB-4N83-QX9K-JM48K2,Project Management,Internship,3/11/2024 18:00,11/9/1998,Male,Nigeria,Babcock University,Project Management,3/11/2024 12:02,Team Allocated,1070,8/15/2023 19:16,1/8/2024 3:30,1998-11-09_Male_Nigeria,2,Business,0,145,63,24,1,Churned
8/15/2023 17:34,00000000-100J-PM3A-0WJ8-5T68M5,Jump Start: Developing your Emotional Intelligence,Course,12/24/2025 3:34,4/21/2001,Male,India,Upgrad,Data Analysis,3/11/2024 12:03,Team Allocated,1070,1/27/2024 6:10,1/28/2024 23:30,2001-04-21_Male_India,2,Other,164,1,695,22,1,Churned
8/15/2023 16:56,00000000-0GRA-BD28-CXVV-EYEX21,Health Care Management,Internship,,1/11/1998,Male,Nigeria,Federal  university of technology akure,Statistics,3/11/2024 12:02,Team Allocated,1070,8/15/2023 17:13,1/8/2024 3:30,1998-01-11_Male_Nigeria,2,Other,0,145,,25,1,Churned
8/15/2023 14:41,00000000-0GRA-BD28-CXVV-EYEX21,Health Care Management,Internship,,11/16/2001,Female,India,St.Francis College For Women,Biotechnology,3/11/2024 12:02,Team Allocated,1070,8/15/2023 14:46,1/8/2024 3:30,2001-11-16_Female_India,2,Other,0,145,,21,1,Churned
8/15/2023 14:17,00000000-0GRA-BD28-CXVV-EYEX21,Health Care Management,Internship,,7/2/2002,Female,India,SASTRA University,Bioengineering,3/11/2024 12:02,Team Allocated,1070,8/15/2023 14:24,1/8/2024 3:30,2002-07-02_Female_India,2,Engineering,0,145,,21,1,Churned
8/15/2023 13:36,00000000-0GRA-BD28-CXVV-EYEX21,Health Care Management,Internship,,4/26/2002,Female,India,Kelkar College,Biotechnology,3/11/2024 12:02,Team Allocated,1070,8/15/2023 13:42,1/8/2024 3:30,2002-04-26_Female_India,2,Other,0,145,,21,1,Churned
8/15/2023 12:41,00000000-0GHB-4N83-QX9K-JM48K2,Project Management,Internship,3/11/2024 18:00,5/15/1998,Female,United Kingdom,Caleb university,Project Management,3/11/2024 12:02,Team Allocated,1070,8/15/2023 13:55,1/8/2024 3:30,1998-05-15_Female_United Kingdom,2,Business,0,145,63,25,1,Churned
8/15/2023 8:35,00000000-0GRA-BD28-CXVV-EYEX21,Health Care Management,Internship,,7/26/2001,Female,Nigeria,Imo State University Teaching Hospital  Orlu,Nursing,3/11/2024 12:02,Team Allocated,1070,8/15/2023 8:48,1/8/2024 3:30,2001-07-26_Female_Nigeria,2,Other,0,145,,22,1,Churned
8/14/2023 18:28,00000000-0GRA-BD28-CXVV-EYEX21,Health Care Management,Internship,,4/30/1999,Female,India,Holkar science college,Biochemistry,3/11/2024 12:02,Team Allocated,1070,8/14/2023 18:39,1/8/2024 3:30,1999-04-30_Female_India,2,Other,0,146,,24,1,Churned
8/15/2023 6:42,00000000-0GRA-BD28-CXVV-EYEX21,Health Care Management,Internship,,3/14/1997,Male,Nigeria,Annunciation Catholic College,Bsc,3/11/2024 12:02,Team Allocated,1070,8/15/2023 7:14,1/8/2024 3:30,1997-03-14_Male_Nigeria,2,Other,0,145,,26,1,Churned
8/15/2023 6:25,00000000-0GWQ-AXC5-X45C-2MHJ28,Data Visualization,Internship,3/11/2024 18:00,11/20/1998,Female,Ethiopia,Addis Ababa Science and Technology University,Software Engineering,3/11/2024 12:02,Team Allocated,1070,8/15/2023 6:42,1/8/2024 3:30,1998-11-20_Female_Ethiopia,2,CS / IT,0,145,63,24,1,Churned
8/15/2023 6:06,00000000-0GHB-4N83-QX9K-JM48K2,Project Management,Internship,3/11/2024 18:00,4/29/2005,Male,Japan,Yokohama Ichiritsu Kanazawa Koko,Business Administration,3/11/2024 12:02,Team Allocated,1070,8/15/2023 6:19,1/8/2024 3:30,2005-04-29_Male_Japan,2,Business,0,145,63,18,1,Churned
8/15/2023 5:09,00000000-0GRA-BD28-CXVV-EYEX21,Health Care Management,Internship,,2/5/1997,Female,India,JAGANNATH UNIVERSITY,Master of Public Health,3/11/2024 12:02,Team Allocated,1070,8/15/2023 5:17,1/8/2024 3:30,1997-02-05_Female_India,2,Other,0,145,,26,1,Churned
8/15/2023 4:18,00000000-0GWQ-AXC5-X45C-2MHJ28,Data Visualization,Internship,3/11/2024 18:00,5/23/2001,Female,India,Indian institute of information technology NUZVID,Computer Science,3/11/2024 12:02,Team Allocated,1070,8/15/2023 4:24,1/8/2024 3:30,2001-05-23_Female_India,2,CS / IT,0,145,63,22,1,Churned
8/14/2023 23:53,00000000-0GWQ-AXC5-X45C-2MHJ28,Data Visualization,Internship,3/11/2024 18:00,8/15/1989,Male,"Iran, Islamic Republic Of Persian Gulf",islamic azad university,Software Engineering,3/11/2024 12:02,Team Allocated,1070,,1/8/2024 3:30,"1989-08-15_Male_Iran, Islamic Republic Of Persian Gulf",2,CS / IT,,,63,34,1,Churned
8/14/2023 22:15,00000000-0GNT-FT74-MZT8-93VC0G,Digital Marketing,Internship,3/11/2024 18:00,11/9/2006,Male,Nigeria,Bright Stars Model Secondary School,Artificial Intelligence and Robotics,3/11/2024 12:01,Team Allocated,1070,8/14/2023 22:57,1/8/2024 3:30,2006-11-09_Male_Nigeria,2,Other,0,146,63,16,1,Churned
8/14/2023 20:20,00000000-0GNT-FT74-MZT8-93VC0G,Digital Marketing,Internship,3/11/2024 18:00,1/16/1986,Male,Egypt,Cairo university,Business Administration,3/11/2024 12:01,Team Allocated,1070,8/14/2023 21:10,1/8/2024 3:30,1986-01-16_Male_Egypt,2,Business,0,146,63,37,1,Churned
8/14/2023 19:51,00000000-0GWQ-AXC5-X45C-2MHJ28,Data Visualization,Internship,3/11/2024 18:00,9/6/1995,Male,India,Ips college,Other,3/11/2024 12:02,Team Allocated,1070,8/14/2023 19:56,1/8/2024 3:30,1995-09-06_Male_India,2,Other,0,146,63,27,1,Churned
8/14/2023 19:09,00000000-0GZY-NNHV-FJWW-PTA9VX,Innovation & Entrepreneurship,Internship,3/11/2024 18:00,12/27/1998,Male,Ethiopia,Saint Louis University,Cyber Security,3/11/2024 12:02,Team Allocated,1070,8/17/2023 9:03,1/8/2024 3:30,1998-12-27_Male_Ethiopia,2,CS / IT,2,143,63,24,1,Churned
8/14/2023 19:09,00000000-0GRA-BD28-CXVV-EYEX21,Health Care Management,Internship,,12/27/1998,Male,Ethiopia,Saint Louis University,Cyber Security,3/11/2024 12:02,Team Allocated,1070,8/17/2023 8:58,1/8/2024 3:30,1998-12-27_Male_Ethiopia,2,CS / IT,2,143,,24,1,Churned
8/14/2023 19:09,00000000-0GNT-FT74-MZT8-93VC0G,Digital Marketing,Internship,3/11/2024 18:00,12/27/1998,Male,Ethiopia,Saint Louis University,Cyber Security,3/11/2024 12:01,Team Allocated,1070,8/17/2023 8:56,1/8/2024 3:30,1998-12-27_Male_Ethiopia,2,CS / IT,2,143,63,24,1,Churned
8/14/2023 15:40,00000000-0GRA-BD28-CXVV-EYEX21,Health Care Management,Internship,,4/27/1998,Female,Bangladesh,national university bangladesh,Mathematics,3/11/2024 12:02,Team Allocated,1070,8/15/2023 15:16,1/8/2024 3:30,1998-04-27_Female_Bangladesh,2,Other,0,145,,25,1,Churned
8/14/2023 15:26,00000000-0GRA-BD28-CXVV-EYEX21,Health Care Management,Internship,,5/10/1990,Female,Nigeria,Osun State College of Health Technology,Other,3/11/2024 12:02,Team Allocated,1070,8/27/2023 16:37,1/8/2024 3:30,1990-05-10_Female_Nigeria,2,Other,13,133,,33,1,Churned
8/14/2023 15:01,00000000-0GRA-BD28-CXVV-EYEX21,Health Care Management,Internship,,7/5/2000,Male,India,Jamia Hamdard,MBA,3/11/2024 12:02,Team Allocated,1070,8/14/2023 15:08,1/8/2024 3:30,2000-07-05_Male_India,2,Other,0,146,,23,1,Churned
8/13/2023 2:19,00000000-0GWQ-AXC5-X45C-2MHJ28,Data Visualization,Internship,3/11/2024 18:00,10/4/1997,Male,India,Aishawsrya college Jodhpur,Health Education,3/11/2024 12:02,Team Allocated,1070,8/16/2023 10:57,1/8/2024 3:30,1997-10-04_Male_India,2,Other,3,144,63,25,1,Churned
8/14/2023 13:57,00000000-10RQ-JXA9-NNKD-EW5RCF,UX Redesign Challenge,Competition,4/19/2024 18:29,9/16/2002,Female,United States,Saint Louis University,Information Systems,3/11/2024 12:03,Team Allocated,1070,2/7/2024 22:46,2/15/2024 18:30,2002-09-16_Female_United States,2,Other,177,7,63,20,1,Churned
8/14/2023 13:57,00000000-106T-FSAJ-KDBX-40ZGNV,UrbanRenew Challenge,Competition,4/29/2024 18:29,9/16/2002,Female,United States,Saint Louis University,Information Systems,3/11/2024 12:03,Team Allocated,1070,2/7/2024 22:34,3/21/2024 18:30,2002-09-16_Female_United States,2,Other,177,42,38,20,1,Churned
8/14/2023 9:44,00000000-0GRA-BD28-CXVV-EYEX21,Health Care Management,Internship,,10/3/2000,Female,India,Lucknow University,Food Safety and Technology,3/11/2024 12:02,Team Allocated,1070,8/14/2023 10:11,1/8/2024 3:30,2000-10-03_Female_India,2,Other,0,146,,22,1,Churned
8/14/2023 7:33,00000000-0GWQ-AXC5-X45C-2MHJ28,Data Visualization,Internship,3/11/2024 18:00,7/16/1994,Male,Cote D'Ivoire,Université Félix Houphouët Boigny Cocody Abidjan,Linguistics,3/11/2024 12:02,Team Allocated,1070,8/14/2023 7:57,1/8/2024 3:30,1994-07-16_Male_Cote D'Ivoire,2,Other,0,146,63,29,1,Churned
8/14/2023 7:18,00000000-0GHB-4N83-QX9K-JM48K2,Project Management,Internship,3/11/2024 18:00,7/8/1999,Male,India,Jamia Millia Islamia,Msc in Disaster Management and Climate Sustainability Studies,3/11/2024 12:02,Team Allocated,1070,8/14/2023 7:23,1/8/2024 3:30,1999-07-08_Male_India,2,CS / IT,0,146,63,24,1,Churned
8/14/2023 5:42,00000000-0GWQ-AXC5-X45C-2MHJ28,Data Visualization,Internship,3/11/2024 18:00,5/1/1997,Male,Kenya,Pioneer International University,Software Engineering,3/11/2024 12:02,Team Allocated,1070,8/14/2023 5:51,1/8/2024 3:30,1997-05-01_Male_Kenya,2,CS / IT,0,146,63,26,1,Churned
8/14/2023 5:39,00000000-0GNT-FT74-MZT8-93VC0G,Digital Marketing,Internship,3/11/2024 18:00,3/6/2008,Male,India,Ramjas,Computer Applications,3/11/2024 12:01,Team Allocated,1070,8/14/2023 5:49,1/8/2024 3:30,2008-03-06_Male_India,2,CS / IT,0,146,63,15,1,Churned
8/13/2023 20:02,00000000-0GRA-BD28-CXVV-EYEX21,Health Care Management,Internship,,6/22/1999,Female,Pakistan,Dow University of Health Sciences,Other,3/11/2024 12:02,Team Allocated,1070,8/13/2023 20:16,1/8/2024 3:30,1999-06-22_Female_Pakistan,2,Other,0,147,,24,1,Churned
8/13/2023 17:34,00000000-0GRA-BD28-CXVV-EYEX21,Health Care Management,Internship,,6/12/2004,Female,India,Vels Institute of Science and technology,Biomedical Engineering,3/11/2024 12:02,Team Allocated,1070,8/13/2023 17:54,1/8/2024 3:30,2004-06-12_Female_India,2,Engineering,0,147,,19,1,Churned
8/13/2023 13:48,00000000-0GWQ-AXC5-X45C-2MHJ28,Data Visualization,Internship,3/11/2024 18:00,10/1/2001,Male,Pakistan,National University of Technology(NUTECH)Islamabad,Computer Science,3/11/2024 12:02,Team Allocated,1070,8/13/2023 14:08,1/8/2024 3:30,2001-10-01_Male_Pakistan,2,CS / IT,0,147,63,21,1,Churned
8/13/2023 7:04,00000000-0GHB-4N83-QX9K-JM48K2,Project Management,Internship,3/11/2024 18:00,12/15/1997,Female,Nigeria,Federal University Oye-Ekiti Ekiti,Development Economics,3/11/2024 12:02,Team Allocated,1070,8/13/2023 7:16,1/8/2024 3:30,1997-12-15_Female_Nigeria,2,Other,0,147,63,25,1,Churned
8/13/2023 6:49,00000000-0GRA-BD28-CXVV-EYEX21,Health Care Management,Internship,,3/30/1998,Female,Ghana,university of Ghana,Food Process Engineering,3/11/2024 12:02,Team Allocated,1070,8/13/2023 7:06,1/8/2024 3:30,1998-03-30_Female_Ghana,2,Engineering,0,147,,25,1,Churned
8/12/2023 17:18,00000000-0GRA-BD28-CXVV-EYEX21,Health Care Management,Internship,,3/5/2002,Female,India,PSIT,Pharmacy and Pharmacology,3/11/2024 12:02,Team Allocated,1070,8/12/2023 17:33,1/8/2024 3:30,2002-03-05_Female_India,2,Other,0,148,,21,1,Churned
8/10/2023 23:20,00000000-0GRA-BD28-CXVV-EYEX21,Health Care Management,Internship,,6/21/1989,Male,India,PVP Siddhartha Institute of Technology,Information Systems,3/11/2024 12:02,Team Allocated,1070,8/25/2023 4:39,1/8/2024 3:30,1989-06-21_Male_India,2,Other,14,135,,34,1,Churned
8/12/2023 17:06,00000000-0GHB-4N83-QX9K-JM48K2,Project Management,Internship,3/11/2024 18:00,5/18/2001,Male,Nigeria,Ogun State Institute Of Technology,Artificial Intelligence and Robotics,3/11/2024 12:02,Team Allocated,1070,8/12/2023 17:43,1/8/2024 3:30,2001-05-18_Male_Nigeria,2,Other,0,148,63,22,1,Churned
8/12/2023 14:35,00000000-100J-PM3A-0WJ8-5T68M5,Jump Start: Developing your Emotional Intelligence,Course,12/24/2025 3:34,4/1/2000,Male,India,st. louis University,Computer Information Systems,3/11/2024 12:03,Team Allocated,1070,1/28/2024 3:59,1/28/2024 23:30,2000-04-01_Male_India,2,CS / IT,168,0,695,23,1,Churned
8/12/2023 14:35,00000000-106T-FSAJ-KDBX-40ZGNV,UrbanRenew Challenge,Competition,4/29/2024 18:29,4/1/2000,Male,India,st. louis University,Computer Information Systems,3/11/2024 12:03,Team Allocated,1070,1/28/2024 3:57,3/21/2024 18:30,2000-04-01_Male_India,2,CS / IT,168,53,38,23,1,Churned
8/12/2023 9:27,00000000-0GRA-BD28-CXVV-EYEX21,Health Care Management,Internship,,10/24/2004,Female,Egypt,Cairo university,Medicine,3/11/2024 12:02,Team Allocated,1070,8/12/2023 9:32,1/8/2024 3:30,2004-10-24_Female_Egypt,2,Other,0,148,,18,1,Churned
8/11/2023 22:54,00000000-0GRA-BD28-CXVV-EYEX21,Health Care Management,Internship,,1/21/1999,Male,United States,Saint Louis University,Computer Information Systems,3/11/2024 12:02,Team Allocated,1070,10/31/2023 13:53,1/8/2024 3:30,1999-01-21_Male_United States,2,CS / IT,80,68,,24,1,Churned
8/11/2023 18:39,00000000-0GRA-BD28-CXVV-EYEX21,Health Care Management,Internship,,11/3/1976,Female,United States,webster university,Business Administration,3/11/2024 12:02,Team Allocated,1070,8/11/2023 19:00,1/8/2024 3:30,1976-11-03_Female_United States,2,Business,0,149,,46,1,Churned
8/11/2023 18:32,00000000-0GRA-BD28-CXVV-EYEX21,Health Care Management,Internship,,8/21/2001,Male,India,KTHM College,Biotechnology,3/11/2024 12:02,Team Allocated,1070,8/11/2023 18:44,1/8/2024 3:30,2001-08-21_Male_India,2,Other,0,149,,21,1,Churned
8/11/2023 17:56,00000000-0GRA-BD28-CXVV-EYEX21,Health Care Management,Internship,,9/12/1998,Male,Bangladesh,AUST,Electrical and Electronic Engineering,3/11/2024 12:02,Team Allocated,1070,10/6/2023 15:10,1/8/2024 3:30,1998-09-12_Male_Bangladesh,2,Engineering,55,93,,24,1,Churned
8/11/2023 17:26,00000000-0GRA-BD28-CXVV-EYEX21,Health Care Management,Internship,,3/12/1998,Female,India,Mit Wpu,Public Health,3/11/2024 12:02,Team Allocated,1070,8/11/2023 17:39,1/8/2024 3:30,1998-03-12_Female_India,2,Other,0,149,,25,1,Churned
8/11/2023 8:42,00000000-0GHB-4N83-QX9K-JM48K2,Project Management,Internship,3/11/2024 18:00,6/15/2007,Male,Belarus,Vetka High School,Marketing,3/11/2024 12:02,Team Allocated,1070,8/11/2023 8:55,1/8/2024 3:30,2007-06-15_Male_Belarus,2,Other,0,149,63,16,1,Churned
8/11/2023 2:34,00000000-0GHB-4N83-QX9K-JM48K2,Project Management,Internship,3/11/2024 18:00,5/30/2000,Male,United States,Saint Louis University,Information Systems,3/11/2024 12:02,Team Allocated,1070,1/4/2024 4:47,1/8/2024 3:30,2000-05-30_Male_United States,2,Other,146,3,63,23,1,Churned
7/11/2023 17:41,00000000-0GWQ-AXC5-X45C-2MHJ28,Data Visualization,Internship,3/11/2024 18:00,4/28/1990,Female,India,University of Wollongong Australia,Other,3/11/2024 12:02,Team Allocated,1070,7/11/2023 17:50,1/8/2024 3:30,1990-04-28_Female_India,2,Other,0,180,63,33,1,Churned
8/16/2023 20:32,00000000-106T-FSAJ-KDBX-40ZGNV,UrbanRenew Challenge,Competition,4/29/2024 18:29,7/28/2000,Male,India,Saint Louis University,Information Systems,3/11/2024 12:03,Team Allocated,1070,1/24/2024 5:41,3/21/2024 18:30,2000-07-28_Male_India,2,Other,160,57,38,23,1,Churned
8/10/2023 22:01,00000000-0GRA-BD28-CXVV-EYEX21,Health Care Management,Internship,,10/9/2001,Male,India,Saint Louis University,Information Systems,3/11/2024 12:02,Team Allocated,1070,8/10/2023 23:20,1/8/2024 3:30,2001-10-09_Male_India,2,Other,0,150,,21,1,Churned
8/11/2023 2:34,00000000-0GRA-BD28-CXVV-EYEX21,Health Care Management,Internship,,5/30/2000,Male,United States,Saint Louis University,Information Systems,3/11/2024 12:02,Team Allocated,1070,8/13/2023 22:18,1/8/2024 3:30,2000-05-30_Male_United States,2,Other,2,147,,23,1,Churned
8/10/2023 16:23,00000000-0GHB-4N83-QX9K-JM48K2,Project Management,Internship,3/11/2024 18:00,3/18/2000,Female,Ghana,Kwame Nkrumah University of Science and Technology,Agriculture and Forestry,3/11/2024 12:02,Team Allocated,1070,8/11/2023 17:06,1/8/2024 3:30,2000-03-18_Female_Ghana,2,Other,1,149,63,23,1,Churned
8/10/2023 16:04,00000000-0GZY-NNHV-FJWW-PTA9VX,Innovation & Entrepreneurship,Internship,3/11/2024 18:00,6/9/1996,Male,India,Saint Louis University,Information Systems,3/11/2024 12:02,Team Allocated,1070,1/3/2024 22:55,1/8/2024 3:30,1996-06-09_Male_India,2,Other,146,4,63,27,1,Churned
8/10/2023 12:57,00000000-10RQ-JXA9-NNKD-EW5RCF,UX Redesign Challenge,Competition,4/19/2024 18:29,11/9/2000,Female,India,Saint Louis University,Computer Science,3/11/2024 12:03,Team Allocated,1070,2/9/2024 16:17,2/15/2024 18:30,2000-11-09_Female_India,2,CS / IT,183,6,63,22,1,Churned
8/10/2023 12:57,00000000-106T-FSAJ-KDBX-40ZGNV,UrbanRenew Challenge,Competition,4/29/2024 18:29,11/9/2000,Female,India,Saint Louis University,Computer Science,3/11/2024 12:03,Team Allocated,1070,2/9/2024 16:18,3/21/2024 18:30,2000-11-09_Female_India,2,CS / IT,183,41,38,22,1,Churned
8/10/2023 11:53,00000000-0GRA-BD28-CXVV-EYEX21,Health Care Management,Internship,,1/22/2002,Female,United States,Saint Louis University,Electrical and Computer Engineering,3/11/2024 12:02,Team Allocated,1070,8/10/2023 13:20,1/8/2024 3:30,2002-01-22_Female_United States,2,CS / IT,0,150,,21,1,Churned
8/10/2023 10:17,00000000-0GWQ-AXC5-X45C-2MHJ28,Data Visualization,Internship,3/11/2024 18:00,12/27/1991,Male,Pakistan,Allama iqbal open University,Accounting and Finance,3/11/2024 12:02,Team Allocated,1070,8/10/2023 11:10,1/8/2024 3:30,1991-12-27_Male_Pakistan,2,Other,0,150,63,31,1,Churned
8/10/2023 1:38,00000000-10QW-PYTT-CJCX-7VQBTT,Join a Student Organisation,Engagement,12/5/2025 12:59,12/17/2001,Male,India,Saint Louis University,Computer Science,3/11/2024 12:02,Team Allocated,1070,8/20/2023 23:30,8/21/2023 6:30,2001-12-17_Male_India,2,CS / IT,10,0,837,21,1,Churned
8/9/2023 21:23,00000000-0GRA-BD28-CXVV-EYEX21,Health Care Management,Internship,,10/29/1999,Female,United States,Saint Louis University,Information Systems,3/11/2024 12:02,Team Allocated,1070,8/9/2023 21:52,1/8/2024 3:30,1999-10-29_Female_United States,2,Other,0,151,,23,1,Churned
8/9/2023 18:03,00000000-0GRA-BD28-CXVV-EYEX21,Health Care Management,Internship,,8/10/1996,Female,United States,Saint Louis University,Public Health,3/11/2024 12:02,Team Allocated,1070,8/10/2023 1:54,1/8/2024 3:30,1996-08-10_Female_United States,2,Other,0,151,,27,1,Churned
8/9/2023 17:56,00000000-0GWQ-AXC5-X45C-2MHJ28,Data Visualization,Internship,3/11/2024 18:00,8/18/2005,Female,Egypt,ismailia secondary governmental language school,Physics and Astronomy,3/11/2024 12:02,Team Allocated,1070,8/18/2023 2:44,1/8/2024 3:30,2005-08-18_Female_Egypt,2,Other,8,143,63,17,1,Churned
8/9/2023 16:01,00000000-0GWQ-AXC5-X45C-2MHJ28,Data Visualization,Internship,3/11/2024 18:00,6/19/1999,Female,India,CCSIT Calicut university campus,Data Science,3/11/2024 12:02,Team Allocated,1070,8/9/2023 16:10,1/8/2024 3:30,1999-06-19_Female_India,2,Other,0,151,63,24,1,Churned
8/9/2023 15:15,00000000-0GWQ-AXC5-X45C-2MHJ28,Data Visualization,Internship,3/11/2024 18:00,2/26/2000,Male,United States,saint louis university,Information Systems,3/11/2024 12:02,Team Allocated,1070,8/9/2023 15:40,1/8/2024 3:30,2000-02-26_Male_United States,2,Other,0,151,63,23,1,Churned
8/8/2023 19:36,00000000-0GHB-4N83-QX9K-JM48K2,Project Management,Internship,3/11/2024 18:00,3/9/1990,Female,United States,Saint Louis University,Epidemiology,3/11/2024 12:02,Team Allocated,1070,1/4/2024 1:39,1/8/2024 3:30,1990-03-09_Female_United States,2,Other,148,4,63,33,1,Churned
8/5/2023 8:26,00000000-0GRA-BD28-CXVV-EYEX21,Health Care Management,Internship,,8/3/1998,Male,Ethiopia,Unity University,Computer Science,3/11/2024 12:02,Team Allocated,1070,8/5/2023 8:57,1/8/2024 3:30,1998-08-03_Male_Ethiopia,2,CS / IT,0,155,,25,1,Churned
8/8/2023 14:48,00000000-0GWQ-AXC5-X45C-2MHJ28,Data Visualization,Internship,3/11/2024 18:00,9/15/1989,Female,Nigeria,University of Port Harcourt  Rivers State,Data Visualization,3/11/2024 12:02,Team Allocated,1070,8/8/2023 15:19,1/8/2024 3:30,1989-09-15_Female_Nigeria,2,Other,0,152,63,33,1,Churned
8/8/2023 4:25,00000000-0GN2-A0AY-7XK8-C5FZPP,Career Essentials: Getting Started with Your Professional Journey,Course,6/29/2024 18:52,3/4/2004,Male,United States,Saint Louis University,Computer Science,3/11/2024 12:01,Team Allocated,1070,,11/3/2022 18:30,2004-03-04_Male_United States,2,CS / IT,,,604,19,1,Churned
8/7/2023 17:58,00000000-10QW-PYTT-CJCX-7VQBTT,Join a Student Organisation,Engagement,12/5/2025 12:59,1/19/1996,Male,Turkey,İstanbul Bilgi University,International Business Management,3/11/2024 12:02,Team Allocated,1070,8/17/2023 10:17,8/21/2023 6:30,1996-01-19_Male_Turkey,2,Business,9,3,837,27,1,Churned
8/7/2023 15:59,00000000-106T-FSAJ-KDBX-40ZGNV,UrbanRenew Challenge,Competition,4/29/2024 18:29,4/28/2000,Male,United States,Saint Louis University,Information Systems,3/11/2024 12:03,Team Allocated,1070,2/19/2024 20:26,3/21/2024 18:30,2000-04-28_Male_United States,2,Other,196,30,38,23,1,Churned
7/27/2023 5:27,00000000-100J-PM3A-0WJ8-5T68M5,Jump Start: Developing your Emotional Intelligence,Course,12/24/2025 3:34,4/4/1998,Male,United States,Saint Louis University,Information Systems,3/11/2024 12:03,Team Allocated,1070,1/26/2024 21:48,1/28/2024 23:30,1998-04-04_Male_United States,2,Other,183,2,695,25,1,Churned
8/6/2023 18:30,00000000-0GRA-BD28-CXVV-EYEX21,Health Care Management,Internship,,1/4/1998,Female,India,Jiwaji University,Electronics and Communication,3/11/2024 12:02,Team Allocated,1070,10/3/2023 10:48,1/8/2024 3:30,1998-01-04_Female_India,2,Other,57,96,,25,1,Churned
8/6/2023 18:09,00000000-0GRA-BD28-CXVV-EYEX21,Health Care Management,Internship,,4/22/2000,Female,Nigeria,Federal University DutsinMa Katsina state,Biochemistry,3/11/2024 12:02,Team Allocated,1070,8/6/2023 18:26,1/8/2024 3:30,2000-04-22_Female_Nigeria,2,Other,0,154,,23,1,Churned
8/6/2023 11:59,00000000-0GHB-4N83-QX9K-JM48K2,Project Management,Internship,3/11/2024 18:00,6/18/1997,Female,Nigeria,University of Uyo,International Development,3/11/2024 12:02,Team Allocated,1070,8/6/2023 17:51,1/8/2024 3:30,1997-06-18_Female_Nigeria,2,Other,0,154,63,26,1,Churned
8/6/2023 1:31,00000000-10QW-PYTT-CJCX-7VQBTT,Join a Student Organisation,Engagement,12/5/2025 12:59,2/10/1996,Male,United States,Saint louis university,Health Data Science,3/11/2024 12:02,Team Allocated,1070,8/9/2023 6:33,8/21/2023 6:30,1996-02-10_Male_United States,2,Other,3,11,837,27,1,Churned
8/5/2023 16:20,00000000-10RQ-JXA9-NNKD-EW5RCF,UX Redesign Challenge,Competition,4/19/2024 18:29,5/28/1997,Male,Nigeria,Adekunle Ajasin University,Computer Science,3/11/2024 12:03,Team Allocated,1070,2/13/2024 14:09,2/15/2024 18:30,1997-05-28_Male_Nigeria,2,CS / IT,191,2,63,26,1,Churned
8/5/2023 9:33,00000000-0GHB-4N83-QX9K-JM48K2,Project Management,Internship,3/11/2024 18:00,4/22/1982,Male,Nigeria,Lagos State University,Computer Science,3/11/2024 12:02,Team Allocated,1070,8/5/2023 9:56,1/8/2024 3:30,1982-04-22_Male_Nigeria,2,CS / IT,0,155,63,41,1,Churned
7/28/2023 4:57,00000000-0GNT-FT74-MZT8-93VC0G,Digital Marketing,Internship,3/11/2024 18:00,6/24/1994,Male,Nigeria,Saint Peter's Minor Seminary Yola,Dropped Out,3/11/2024 12:01,Team Allocated,1070,8/2/2023 3:42,1/8/2024 3:30,1994-06-24_Male_Nigeria,2,Other,4,158,63,29,1,Churned
7/25/2023 13:26,00000000-0GRA-BD28-CXVV-EYEX21,Health Care Management,Internship,,12/12/1999,Female,United States,saint louis university,Cyber Security,3/11/2024 12:02,Team Allocated,1070,12/19/2023 4:01,1/8/2024 3:30,1999-12-12_Female_United States,2,CS / IT,146,19,,23,1,Churned
7/26/2023 7:27,00000000-0GRA-BD28-CXVV-EYEX21,Health Care Management,Internship,,12/22/1995,Male,Nigeria,Michael Okpara University of Agriculture Umudike Abia State,Civil Engineering,3/11/2024 12:02,Team Allocated,1070,7/26/2023 10:51,1/8/2024 3:30,1995-12-22_Male_Nigeria,2,Engineering,0,165,,27,1,Churned
8/9/2023 3:04,00000000-0GRA-BD28-CXVV-EYEX21,Health Care Management,Internship,,9/26/2000,Male,India,Saint louis University,Computer Science,3/11/2024 12:02,Team Allocated,1070,10/2/2023 16:02,1/8/2024 3:30,2000-09-26_Male_India,2,CS / IT,54,97,,22,1,Churned
8/5/2023 6:18,00000000-0GRA-BD28-CXVV-EYEX21,Health Care Management,Internship,,3/10/2004,Male,Pakistan,International Islamic university Islamabad,English Language and Literature,3/11/2024 12:02,Team Allocated,1070,8/5/2023 6:38,1/8/2024 3:30,2004-03-10_Male_Pakistan,2,CS / IT,0,155,,19,1,Churned
8/7/2023 1:11,00000000-0GRA-BD28-CXVV-EYEX21,Health Care Management,Internship,,8/12/2005,Female,United States,St. Mary's Dominican High School,Other,3/11/2024 12:02,Team Allocated,1070,,1/8/2024 3:30,2005-08-12_Female_United States,2,Other,,,,17,1,Churned
8/2/2023 7:48,00000000-0GRA-BD28-CXVV-EYEX21,Health Care Management,Internship,,5/7/2001,Female,United States,St. Louis University,Medical Science,3/11/2024 12:02,Team Allocated,1070,8/14/2023 11:14,1/8/2024 3:30,2001-05-07_Female_United States,2,Other,12,146,,22,1,Churned
8/2/2023 12:39,00000000-0GRA-BD28-CXVV-EYEX21,Health Care Management,Internship,,8/6/2000,Male,India,Lj University,Accounting and Finance,3/11/2024 12:02,Team Allocated,1070,8/2/2023 12:46,1/8/2024 3:30,2000-08-06_Male_India,2,Other,0,158,,23,1,Churned
8/3/2023 21:10,00000000-0GRA-BD28-CXVV-EYEX21,Health Care Management,Internship,,10/23/1997,Female,United States,saint louis university,Health Data Science,3/11/2024 12:02,Team Allocated,1070,,1/8/2024 3:30,1997-10-23_Female_United States,2,Other,,,,25,1,Churned
8/3/2023 21:10,00000000-10QW-PYTT-CJCX-7VQBTT,Join a Student Organisation,Engagement,12/5/2025 12:59,10/23/1997,Female,United States,saint louis university,Health Data Science,3/11/2024 12:02,Team Allocated,1070,8/13/2023 3:01,8/21/2023 6:30,1997-10-23_Female_United States,2,Other,9,8,837,25,1,Churned
8/4/2023 15:18,00000000-0GWQ-AXC5-X45C-2MHJ28,Data Visualization,Internship,3/11/2024 18:00,9/9/1996,Male,Nigeria,Olabisi Onabanjo University,Digital Marketing,3/11/2024 12:02,Team Allocated,1070,8/6/2023 13:15,1/8/2024 3:30,1996-09-09_Male_Nigeria,2,CS / IT,1,154,63,26,1,Churned
8/3/2023 9:13,00000000-0GHB-4N83-QX9K-JM48K2,Project Management,Internship,3/11/2024 18:00,12/15/1993,Male,Pakistan,University of Agriculture Faisalabad,Computer Engineering,3/11/2024 12:02,Team Allocated,1070,8/3/2023 9:25,1/8/2024 3:30,1993-12-15_Male_Pakistan,2,CS / IT,0,157,63,29,1,Churned
8/4/2023 16:24,00000000-0GWQ-AXC5-X45C-2MHJ28,Data Visualization,Internship,3/11/2024 18:00,9/28/1993,Male,Ghana,University for Development Studies,Mathematics,3/11/2024 12:02,Team Allocated,1070,8/4/2023 16:37,1/8/2024 3:30,1993-09-28_Male_Ghana,2,Other,0,156,63,29,1,Churned
8/4/2023 16:31,00000000-0GHB-4N83-QX9K-JM48K2,Project Management,Internship,3/11/2024 18:00,11/22/1996,Male,India,Anna university,Mechanical Engineering,3/11/2024 12:02,Team Allocated,1070,8/27/2023 10:41,1/8/2024 3:30,1996-11-22_Male_India,2,Engineering,22,133,63,26,1,Churned
8/4/2023 16:31,00000000-0GWQ-AXC5-X45C-2MHJ28,Data Visualization,Internship,3/11/2024 18:00,11/22/1996,Male,India,Anna university,Mechanical Engineering,3/11/2024 12:02,Team Allocated,1070,8/27/2023 10:49,1/8/2024 3:30,1996-11-22_Male_India,2,Engineering,22,133,63,26,1,Churned
8/2/2023 17:53,00000000-0GRA-BD28-CXVV-EYEX21,Health Care Management,Internship,,4/21/2000,Female,Nigeria,University of Ilorin Teaching Hospital,Medicine,3/11/2024 12:02,Team Allocated,1070,8/2/2023 18:03,1/8/2024 3:30,2000-04-21_Female_Nigeria,2,Other,0,158,,23,1,Churned
8/4/2023 18:10,00000000-0GNT-FT74-MZT8-93VC0G,Digital Marketing,Internship,3/11/2024 18:00,6/8/1997,Male,Nigeria,University of Benin,Data Analytics,3/11/2024 12:01,Team Allocated,1070,8/4/2023 18:37,1/8/2024 3:30,1997-06-08_Male_Nigeria,2,Other,0,156,63,26,1,Churned
,00000000-0GRA-BD28-CXVV-EYEX21,Health Care Management,Internship,,5/30/1999,Female,United States,saintlouis university,Health Data Science,3/11/2024 12:02,Team Allocated,1070,11/1/2023 17:50,1/8/2024 3:30,1999-05-30_Female_United States,2,Other,,67,,,1,Churned
7/31/2023 17:24,00000000-0GRA-BD28-CXVV-EYEX21,Health Care Management,Internship,,6/5/2001,Male,India,Institute Of Aeronautical Engineering,Computer Science and Engineering,3/11/2024 12:02,Team Allocated,1070,7/31/2023 17:35,1/8/2024 3:30,2001-06-05_Male_India,2,CS / IT,0,160,,22,1,Churned
8/2/2023 6:46,00000000-0GRA-BD28-CXVV-EYEX21,Health Care Management,Internship,,2/11/2002,Male,India,Pimpri Chinchwad College Of Engineering And Research College Ravet,Civil Engineering,3/11/2024 12:02,Team Allocated,1070,8/2/2023 7:00,1/8/2024 3:30,2002-02-11_Male_India,2,Engineering,0,158,,21,1,Churned
8/5/2023 6:04,00000000-0GHB-4N83-QX9K-JM48K2,Project Management,Internship,3/11/2024 18:00,11/3/1993,Female,Nigeria,Federal University of Technology Akure,MBA,3/11/2024 12:02,Team Allocated,1070,8/5/2023 6:13,1/8/2024 3:30,1993-11-03_Female_Nigeria,2,Other,0,155,63,29,1,Churned
8/2/2023 5:44,00000000-0GRA-BD28-CXVV-EYEX21,Health Care Management,Internship,,8/20/2008,Male,United States,Bayside High School,Other,3/11/2024 12:02,Team Allocated,1070,8/2/2023 6:15,1/8/2024 3:30,2008-08-20_Male_United States,2,Other,0,158,,14,1,Churned
8/2/2023 5:03,00000000-0GRA-BD28-CXVV-EYEX21,Health Care Management,Internship,,5/28/2003,Female,United States,St. John's University,Biomedical Science,3/11/2024 12:02,Team Allocated,1070,8/2/2023 5:15,1/8/2024 3:30,2003-05-28_Female_United States,2,Other,0,158,,20,1,Churned
7/31/2023 8:16,00000000-0GRA-BD28-CXVV-EYEX21,Health Care Management,Internship,,10/3/2001,Female,Nigeria,Imo state university,Biochemistry,3/11/2024 12:02,Team Allocated,1070,7/31/2023 8:52,1/8/2024 3:30,2001-10-03_Female_Nigeria,2,Other,0,160,,21,1,Churned
7/30/2023 20:28,00000000-0GRA-BD28-CXVV-EYEX21,Health Care Management,Internship,,11/13/2003,Male,United States,SAINT LOUIS University,Health Management,3/11/2024 12:02,Team Allocated,1070,7/30/2023 20:51,1/8/2024 3:30,2003-11-13_Male_United States,2,Business,0,161,,19,1,Churned
7/30/2023 18:30,00000000-0GRA-BD28-CXVV-EYEX21,Health Care Management,Internship,,3/21/1999,Female,United States,saint louis university,Information Systems,3/11/2024 12:02,Team Allocated,1070,10/27/2023 23:11,1/8/2024 3:30,1999-03-21_Female_United States,2,Other,89,72,,24,1,Churned
7/30/2023 17:13,00000000-106T-FSAJ-KDBX-40ZGNV,UrbanRenew Challenge,Competition,4/29/2024 18:29,10/26/2003,Male,India,Vellore Institute of Technology - Andhra Pradesh,Computer Science and Engineering,3/11/2024 12:03,Team Allocated,1070,3/4/2024 12:14,3/21/2024 18:30,2003-10-26_Male_India,2,CS / IT,217,17,38,19,1,Churned
7/29/2023 10:04,00000000-0GRA-BD28-CXVV-EYEX21,Health Care Management,Internship,,8/18/2006,Female,Nigeria,Federal Government College,Law and Legal Studies,3/11/2024 12:02,Team Allocated,1070,7/29/2023 10:18,1/8/2024 3:30,2006-08-18_Female_Nigeria,2,Other,0,162,,16,1,Churned
7/29/2023 10:00,00000000-0GRA-BD28-CXVV-EYEX21,Health Care Management,Internship,,6/2/2000,Female,United States,saint louis university,Health Data Science,3/11/2024 12:02,Team Allocated,1070,8/20/2023 1:03,1/8/2024 3:30,2000-06-02_Female_United States,2,Other,21,141,,23,1,Churned
7/29/2023 8:37,00000000-0GHB-4N83-QX9K-JM48K2,Project Management,Internship,3/11/2024 18:00,7/18/2009,Male,India,Prudence,Information Technology,3/11/2024 12:02,Team Allocated,1070,7/31/2023 9:20,1/8/2024 3:30,2009-07-18_Male_India,2,Other,2,160,63,14,1,Churned
7/28/2023 12:53,00000000-0GRA-BD28-CXVV-EYEX21,Health Care Management,Internship,,11/19/1999,Female,Kenya,kirinyaga university,Nursing,3/11/2024 12:02,Team Allocated,1070,7/28/2023 13:07,1/8/2024 3:30,1999-11-19_Female_Kenya,2,Other,0,163,,23,1,Churned
7/28/2023 7:38,00000000-0GWQ-AXC5-X45C-2MHJ28,Data Visualization,Internship,3/11/2024 18:00,9/13/1995,Male,Nigeria,University of Nigeria  Nsukka,Public Health,3/11/2024 12:02,Team Allocated,1070,7/28/2023 7:51,1/8/2024 3:30,1995-09-13_Male_Nigeria,2,Other,0,163,63,27,1,Churned
7/28/2023 4:57,00000000-0GWQ-AXC5-X45C-2MHJ28,Data Visualization,Internship,3/11/2024 18:00,6/24/1994,Male,Nigeria,Saint Peter's Minor Seminary Yola,Dropped Out,3/11/2024 12:02,Team Allocated,1070,7/28/2023 5:08,1/8/2024 3:30,1994-06-24_Male_Nigeria,2,Other,0,163,63,29,1,Churned
7/18/2023 22:30,00000000-0GRA-BD28-CXVV-EYEX21,Health Care Management,Internship,,7/24/1999,Female,United States,SAINT LOUIS UNIVERSITY,Computer Science,3/11/2024 12:02,Team Allocated,1070,8/26/2023 23:36,1/8/2024 3:30,1999-07-24_Female_United States,2,CS / IT,39,134,,24,1,Churned
,00000000-0GRA-BD28-CXVV-EYEX21,Health Care Management,Internship,,1/20/1989,Female,United States,Veer Narmad south Gujarat university,Biology,3/11/2024 12:02,Team Allocated,1070,,1/8/2024 3:30,1989-01-20_Female_United States,2,Other,,,,,1,Churned
,00000000-10WC-BS50-CYGD-X97ES4,CPR/AED Certification,Course,6/30/2024 16:18,10/13/2001,Female,Nigeria,Redeemer's University,Law and Legal Studies,3/11/2024 12:02,Team Allocated,1070,,3/20/2023 2:30,2001-10-13_Female_Nigeria,2,Other,,,468,,1,Churned
7/24/2023 20:55,00000000-0GRA-BD28-CXVV-EYEX21,Health Care Management,Internship,,12/24/1991,Female,Ghana,St. Karol School of Nursing,Nursing,3/11/2024 12:02,Team Allocated,1070,8/17/2023 1:46,1/8/2024 3:30,1991-12-24_Female_Ghana,2,Other,23,144,,31,1,Churned
7/25/2023 14:38,00000000-10QW-PYTT-CJCX-7VQBTT,Join a Student Organisation,Engagement,12/5/2025 12:59,12/26/1999,Male,United States,Djr College of engineering and technology,Information Systems,3/11/2024 12:02,Team Allocated,1070,8/7/2023 14:13,8/21/2023 6:30,1999-12-26_Male_United States,2,Other,12,13,837,23,1,Churned
8/10/2023 18:41,00000000-0GHB-4N83-QX9K-JM48K2,Project Management,Internship,3/11/2024 18:00,7/14/1994,Male,Nigeria,Federal college of Education Akoka,Biology,3/11/2024 12:02,Team Allocated,1070,8/10/2023 18:53,1/8/2024 3:30,1994-07-14_Male_Nigeria,2,Other,0,150,63,29,1,Churned
7/25/2023 13:25,00000000-0GRA-BD28-CXVV-EYEX21,Health Care Management,Internship,,4/19/1998,Male,United States,Saint Louis University,Health Data Science,3/11/2024 12:02,Team Allocated,1070,8/19/2023 4:08,1/8/2024 3:30,1998-04-19_Male_United States,2,Other,24,141,,25,1,Churned
7/25/2023 13:24,00000000-0GRA-BD28-CXVV-EYEX21,Health Care Management,Internship,,8/5/1997,Female,India,Saintlouis university,Other,3/11/2024 12:02,Team Allocated,1070,8/15/2023 23:46,1/8/2024 3:30,1997-08-05_Female_India,2,Other,21,145,,25,1,Churned
7/25/2023 13:08,00000000-0GRA-BD28-CXVV-EYEX21,Health Care Management,Internship,,10/16/1997,Male,India,Saint Louis University,Computer Science,3/11/2024 12:02,Team Allocated,1070,12/4/2023 23:04,1/8/2024 3:30,1997-10-16_Male_India,2,CS / IT,132,34,,25,1,Churned
7/25/2023 12:58,00000000-10QW-PYTT-CJCX-7VQBTT,Join a Student Organisation,Engagement,12/5/2025 12:59,1/5/1998,Male,United States,Saint Louis University,Artificial Intelligence,3/11/2024 12:02,Team Allocated,1070,7/25/2023 14:04,8/21/2023 6:30,1998-01-05_Male_United States,2,Other,0,26,837,25,1,Churned
7/25/2023 12:49,00000000-10A5-TYD2-181G-D2J679,Xperience Design Hackathon,Competition,3/13/2024 18:29,3/15/1999,Male,India,Gujarat technological university,Data Analysis,3/11/2024 12:03,Team Allocated,1070,1/25/2024 20:58,1/28/2024 18:30,1999-03-15_Male_India,2,Other,184,2,44,24,1,Churned
7/25/2023 12:49,00000000-10RQ-JXA9-NNKD-EW5RCF,UX Redesign Challenge,Competition,4/19/2024 18:29,3/15/1999,Male,India,Gujarat technological university,Data Analysis,3/11/2024 12:03,Team Allocated,1070,1/25/2024 20:58,2/15/2024 18:30,1999-03-15_Male_India,2,Other,184,20,63,24,1,Churned
7/25/2023 12:49,00000000-106T-FSAJ-KDBX-40ZGNV,UrbanRenew Challenge,Competition,4/29/2024 18:29,3/15/1999,Male,India,Gujarat technological university,Data Analysis,3/11/2024 12:03,Team Allocated,1070,1/25/2024 20:57,3/21/2024 18:30,1999-03-15_Male_India,2,Other,184,55,38,24,1,Churned
7/25/2023 11:23,00000000-0GWQ-AXC5-X45C-2MHJ28,Data Visualization,Internship,3/11/2024 18:00,3/11/2000,Male,Ghana,University of Ghana,Economics,3/11/2024 12:02,Team Allocated,1070,11/12/2023 16:27,1/8/2024 3:30,2000-03-11_Male_Ghana,2,Other,110,56,63,23,1,Churned
7/25/2023 11:23,00000000-0GRA-BD28-CXVV-EYEX21,Health Care Management,Internship,,3/11/2000,Male,Ghana,University of Ghana,Economics,3/11/2024 12:02,Team Allocated,1070,11/12/2023 16:31,1/8/2024 3:30,2000-03-11_Male_Ghana,2,Other,110,56,,23,1,Churned
7/25/2023 5:08,00000000-0GRA-BD28-CXVV-EYEX21,Health Care Management,Internship,,1/6/1996,Female,United States,saint louis university,Health Data Science,3/11/2024 12:02,Team Allocated,1070,11/23/2023 7:09,1/8/2024 3:30,1996-01-06_Female_United States,2,Other,121,45,,27,1,Churned
7/24/2023 14:31,00000000-0GZY-NNHV-FJWW-PTA9VX,Innovation & Entrepreneurship,Internship,3/11/2024 18:00,7/21/2006,Male,India,little flower junior college,Computer Engineering,3/11/2024 12:02,Team Allocated,1070,12/24/2023 8:04,1/8/2024 3:30,2006-07-21_Male_India,2,CS / IT,152,14,63,17,1,Churned
7/22/2023 18:08,00000000-0GRA-BD28-CXVV-EYEX21,Health Care Management,Internship,,8/12/1998,Female,Nigeria,Ekiti State University,Library and Information Management,3/11/2024 12:02,Team Allocated,1070,8/6/2023 17:41,1/8/2024 3:30,1998-08-12_Female_Nigeria,2,Business,14,154,,24,1,Churned
7/24/2023 14:19,00000000-0GZY-NNHV-FJWW-PTA9VX,Innovation & Entrepreneurship,Internship,3/11/2024 18:00,3/2/2009,Female,India,DPS Ruby Park,Biomedical Engineering,3/11/2024 12:02,Team Allocated,1070,7/24/2023 14:41,1/8/2024 3:30,2009-03-02_Female_India,2,Engineering,0,167,63,14,1,Churned
7/24/2023 14:19,00000000-0GRA-BD28-CXVV-EYEX21,Health Care Management,Internship,,3/2/2009,Female,India,DPS Ruby Park,Biomedical Engineering,3/11/2024 12:02,Team Allocated,1070,7/24/2023 14:49,1/8/2024 3:30,2009-03-02_Female_India,2,Engineering,0,167,,14,1,Churned
,00000000-10WC-BS50-CYGD-X97ES4,CPR/AED Certification,Course,6/30/2024 16:18,4/22/1997,Male,Egypt,Kafr Elsheikh University,Physiotherapy,3/11/2024 12:02,Team Allocated,1070,,3/20/2023 2:30,1997-04-22_Male_Egypt,2,Other,,,468,,1,Churned
7/23/2023 20:08,00000000-0GWQ-AXC5-X45C-2MHJ28,Data Visualization,Internship,3/11/2024 18:00,12/28/2003,Female,India,G.D. Goenka Global School,Business and Management Studies,3/11/2024 12:02,Team Allocated,1070,9/21/2023 16:37,1/8/2024 3:30,2003-12-28_Female_India,2,Business,59,108,63,19,1,Churned
7/23/2023 20:08,00000000-0GRA-BD28-CXVV-EYEX21,Health Care Management,Internship,,12/28/2003,Female,India,G.D. Goenka Global School,Business and Management Studies,3/11/2024 12:02,Team Allocated,1070,9/21/2023 16:39,1/8/2024 3:30,2003-12-28_Female_India,2,Business,59,108,,19,1,Churned
7/23/2023 18:07,00000000-0GWQ-AXC5-X45C-2MHJ28,Data Visualization,Internship,3/11/2024 18:00,3/9/2006,Female,Pakistan,Lgs 55main,Computer Science,3/11/2024 12:02,Team Allocated,1070,7/23/2023 18:16,1/8/2024 3:30,2006-03-09_Female_Pakistan,2,CS / IT,0,168,63,17,1,Churned
7/23/2023 17:47,00000000-0GHB-4N83-QX9K-JM48K2,Project Management,Internship,3/11/2024 18:00,9/6/2004,Female,Nigeria,Best schools international,Data Science,3/11/2024 12:02,Team Allocated,1070,8/16/2023 11:20,1/8/2024 3:30,2004-09-06_Female_Nigeria,2,Other,23,144,63,18,1,Churned
7/23/2023 14:14,00000000-0GRA-BD28-CXVV-EYEX21,Health Care Management,Internship,,11/23/2002,Male,United States,The university of Texas at Dallas,Neuroscience,3/11/2024 12:02,Team Allocated,1070,7/24/2023 3:45,1/8/2024 3:30,2002-11-23_Male_United States,2,Other,0,167,,20,1,Churned
7/23/2023 14:12,00000000-0GRA-BD28-CXVV-EYEX21,Health Care Management,Internship,,3/29/1994,Female,Nigeria,University of Port Harcourt,Biochemistry,3/11/2024 12:02,Team Allocated,1070,7/23/2023 15:09,1/8/2024 3:30,1994-03-29_Female_Nigeria,2,Other,0,168,,29,1,Churned
7/23/2023 13:24,00000000-0GRA-BD28-CXVV-EYEX21,Health Care Management,Internship,,6/26/1971,Female,Ghana,University of Ghana Medical School,Medicine,3/11/2024 12:02,Team Allocated,1070,7/23/2023 13:59,1/8/2024 3:30,1971-06-26_Female_Ghana,2,Other,0,168,,52,1,Churned
7/23/2023 10:44,00000000-0GRA-BD28-CXVV-EYEX21,Health Care Management,Internship,,5/12/1986,Male,Nigeria,Delta State University,Economics,3/11/2024 12:02,Team Allocated,1070,7/23/2023 10:51,1/8/2024 3:30,1986-05-12_Male_Nigeria,2,Other,0,168,,37,1,Churned
,00000000-0GHB-4N83-QX9K-JM48K2,Project Management,Internship,3/11/2024 18:00,1/22/1994,Male,Nigeria,Ibadan polytechnic,Library and Information Management,3/11/2024 12:02,Team Allocated,1070,,1/8/2024 3:30,1994-01-22_Male_Nigeria,2,Business,,,63,,1,Churned
7/25/2023 22:14,00000000-0GRA-BD28-CXVV-EYEX21,Health Care Management,Internship,,10/26/1998,Male,India,saint louis university,Cyber Security,3/11/2024 12:02,Team Allocated,1070,8/27/2023 21:12,1/8/2024 3:30,1998-10-26_Male_India,2,CS / IT,32,133,,24,1,Churned
7/21/2023 20:36,00000000-0GRA-BD28-CXVV-EYEX21,Health Care Management,Internship,,12/19/1999,Female,United States,Saint Louis University,Computer Science,3/11/2024 12:02,Team Allocated,1070,7/21/2023 20:48,1/8/2024 3:30,1999-12-19_Female_United States,2,CS / IT,0,170,,23,1,Churned
,00000000-0GN2-A0AY-7XK8-C5FZPP,Career Essentials: Getting Started with Your Professional Journey,Course,6/29/2024 18:52,10/13/2001,Female,Nigeria,Redeemer's University,Law and Legal Studies,3/11/2024 12:01,Team Allocated,1070,,11/3/2022 18:30,2001-10-13_Female_Nigeria,2,Other,,,604,,1,Churned
7/18/2023 16:01,00000000-0GRA-BD28-CXVV-EYEX21,Health Care Management,Internship,,4/8/2004,Female,Nigeria,Allen High school,Psychology,3/11/2024 12:02,Team Allocated,1070,7/18/2023 16:14,1/8/2024 3:30,2004-04-08_Female_Nigeria,2,Other,0,173,,19,1,Churned
7/20/2023 22:39,00000000-0GRA-BD28-CXVV-EYEX21,Health Care Management,Internship,,1/13/1997,Female,India,Great lakes institute of technology,Data Science and Business Analytics,3/11/2024 12:02,Team Allocated,1070,7/21/2023 11:23,1/8/2024 3:30,1997-01-13_Female_India,2,Business,0,170,,26,1,Churned
7/20/2023 21:05,00000000-0GWQ-AXC5-X45C-2MHJ28,Data Visualization,Internship,3/11/2024 18:00,9/28/1985,Female,Nigeria,Kedrus Academy,Data Analytics,3/11/2024 12:02,Team Allocated,1070,8/21/2023 9:48,1/8/2024 3:30,1985-09-28_Female_Nigeria,2,Other,31,139,63,37,1,Churned
7/20/2023 11:55,00000000-0GHB-4N83-QX9K-JM48K2,Project Management,Internship,3/11/2024 18:00,9/4/2006,Male,India,saint peters senior secondary school,Computer Science and Engineering,3/11/2024 12:02,Team Allocated,1070,7/20/2023 12:07,1/8/2024 3:30,2006-09-04_Male_India,2,CS / IT,0,171,63,16,1,Churned
7/20/2023 9:53,00000000-0GN2-A0AY-7XK8-C5FZPP,Career Essentials: Getting Started with Your Professional Journey,Course,6/29/2024 18:52,5/10/1987,Male,United States,Boston University,Public Health,3/11/2024 12:01,Team Allocated,1070,,11/3/2022 18:30,1987-05-10_Male_United States,2,Other,,,604,36,1,Churned
7/19/2023 23:47,00000000-0GRA-BD28-CXVV-EYEX21,Health Care Management,Internship,,3/18/2005,Female,United States,The University of Texas at Austin,Medical Laboratory Science,3/11/2024 12:02,Team Allocated,1070,7/19/2023 23:54,1/8/2024 3:30,2005-03-18_Female_United States,2,Other,0,172,,18,1,Churned
7/19/2023 22:46,00000000-0GZY-NNHV-FJWW-PTA9VX,Innovation & Entrepreneurship,Internship,3/11/2024 18:00,12/12/1993,Female,United States,St Augustine college,Respiratory Therapy,3/11/2024 12:02,Team Allocated,1070,12/30/2023 2:48,1/8/2024 3:30,1993-12-12_Female_United States,2,Other,163,9,63,29,1,Churned
7/19/2023 11:36,00000000-0GRA-BD28-CXVV-EYEX21,Health Care Management,Internship,,5/26/2003,Female,India,Vemana institute of technology,Computer Science,3/11/2024 12:02,Team Allocated,1070,9/1/2023 5:22,1/8/2024 3:30,2003-05-26_Female_India,2,CS / IT,43,128,,20,1,Churned
7/19/2023 10:55,00000000-0GWQ-AXC5-X45C-2MHJ28,Data Visualization,Internship,3/11/2024 18:00,12/5/2000,Male,Pakistan,Ned University of science & Technology,Electrical and Computer Engineering,3/11/2024 12:02,Team Allocated,1070,8/7/2023 5:49,1/8/2024 3:30,2000-12-05_Male_Pakistan,2,CS / IT,18,153,63,22,1,Churned
7/19/2023 10:35,00000000-0GZY-NNHV-FJWW-PTA9VX,Innovation & Entrepreneurship,Internship,3/11/2024 18:00,1/24/2007,Male,Pakistan,govt national college,Chemistry,3/11/2024 12:02,Team Allocated,1070,7/19/2023 10:53,1/8/2024 3:30,2007-01-24_Male_Pakistan,2,Other,0,172,63,16,1,Churned
7/19/2023 3:02,00000000-0GRA-BD28-CXVV-EYEX21,Health Care Management,Internship,,9/3/1999,Female,Ghana,Kwame Nkrumah University of Science and Technology,Medicine,3/11/2024 12:02,Team Allocated,1070,8/7/2023 15:26,1/8/2024 3:30,1999-09-03_Female_Ghana,2,Other,19,153,,23,1,Churned
7/18/2023 19:46,00000000-0GRA-BD28-CXVV-EYEX21,Health Care Management,Internship,,4/7/1996,Male,United States,Saint Louis University,Information Systems,3/11/2024 12:02,Team Allocated,1070,10/2/2023 15:54,1/8/2024 3:30,1996-04-07_Male_United States,2,Other,75,97,,27,1,Churned
7/26/2023 5:50,00000000-0GRA-BD28-CXVV-EYEX21,Health Care Management,Internship,,3/17/2002,Female,United States,Saint Louis University,Cyber Security,3/11/2024 12:02,Team Allocated,1070,9/25/2023 19:33,1/8/2024 3:30,2002-03-17_Female_United States,2,CS / IT,61,104,,21,1,Churned
7/18/2023 4:59,00000000-0GN2-A0AY-7XK8-C5FZPP,Career Essentials: Getting Started with Your Professional Journey,Course,6/29/2024 18:52,12/31/1997,Female,Bangladesh,Bangladesh University of Professionals,Health Education,3/11/2024 12:01,Team Allocated,1070,,11/3/2022 18:30,1997-12-31_Female_Bangladesh,2,Other,,,604,25,1,Churned
7/21/2023 18:29,00000000-0GRA-BD28-CXVV-EYEX21,Health Care Management,Internship,,10/19/2001,Female,India,Sri Guru Tegh Bahadur Khalsa College  University of Delhi,Zoology,3/11/2024 12:02,Team Allocated,1070,7/21/2023 18:45,1/8/2024 3:30,2001-10-19_Female_India,2,Other,0,170,,21,1,Churned
7/18/2023 4:04,00000000-0GRA-BD28-CXVV-EYEX21,Health Care Management,Internship,,4/4/1999,Male,United States,Saint Louis University,Computer Science,3/11/2024 12:02,Team Allocated,1070,7/18/2023 4:46,1/8/2024 3:30,1999-04-04_Male_United States,2,CS / IT,0,173,,24,1,Churned
7/17/2023 23:42,00000000-0GRA-BD28-CXVV-EYEX21,Health Care Management,Internship,,6/5/1999,Male,United States,Saint Louis University,Computer Science,3/11/2024 12:02,Team Allocated,1070,7/18/2023 19:39,1/8/2024 3:30,1999-06-05_Male_United States,2,CS / IT,0,173,,24,1,Churned
7/17/2023 21:14,00000000-0GHB-4N83-QX9K-JM48K2,Project Management,Internship,3/11/2024 18:00,10/19/1999,Male,Nigeria,Afe Babalola University,Mechanical Engineering,3/11/2024 12:02,Team Allocated,1070,7/17/2023 21:24,1/8/2024 3:30,1999-10-19_Male_Nigeria,2,Engineering,0,174,63,23,1,Churned
7/17/2023 15:51,00000000-0GRA-BD28-CXVV-EYEX21,Health Care Management,Internship,,8/28/1999,Male,United States,Saint Louis University,Computer Science,3/11/2024 12:02,Team Allocated,1070,7/18/2023 19:40,1/8/2024 3:30,1999-08-28_Male_United States,2,CS / IT,1,173,,23,1,Churned
7/17/2023 6:17,00000000-0GRA-BD28-CXVV-EYEX21,Health Care Management,Internship,,6/17/1999,Male,United States,Saint louis university,Computer Science and Information Systems,3/11/2024 12:02,Team Allocated,1070,7/17/2023 6:58,1/8/2024 3:30,1999-06-17_Male_United States,2,CS / IT,0,174,,24,1,Churned
7/14/2023 12:04,00000000-0GRA-BD28-CXVV-EYEX21,Health Care Management,Internship,,8/3/1996,Female,Egypt,University of Khartoum,Public Health,3/11/2024 12:02,Team Allocated,1070,7/14/2023 12:16,1/8/2024 3:30,1996-08-03_Female_Egypt,2,Other,0,177,,26,1,Churned
7/14/2023 10:12,00000000-0GRA-BD28-CXVV-EYEX21,Health Care Management,Internship,,11/29/1988,Female,Pakistan,National Institute of Rehabilitation Medicine,Speech and Language Therapy,3/11/2024 12:02,Team Allocated,1070,8/22/2023 17:20,1/8/2024 3:30,1988-11-29_Female_Pakistan,2,Other,39,138,,34,1,Churned
7/14/2023 9:10,00000000-0GRA-BD28-CXVV-EYEX21,Health Care Management,Internship,,7/19/1999,Male,Ghana,Kwame Nkrumah University of science and technology,Hospitality and Leisure Management,3/11/2024 12:02,Team Allocated,1070,7/27/2023 14:59,1/8/2024 3:30,1999-07-19_Male_Ghana,2,CS / IT,13,164,,24,1,Churned
7/13/2023 6:29,00000000-0GHB-4N83-QX9K-JM48K2,Project Management,Internship,3/11/2024 18:00,3/25/1980,Male,Nigeria,Lagos Business School,General Management,3/11/2024 12:02,Team Allocated,1070,7/13/2023 6:55,1/8/2024 3:30,1980-03-25_Male_Nigeria,2,Business,0,178,63,43,1,Churned
7/12/2023 14:32,00000000-0GZY-NNHV-FJWW-PTA9VX,Innovation & Entrepreneurship,Internship,3/11/2024 18:00,7/13/2006,Male,India,Army Public School no.2,Artificial Intelligence and Robotics,3/11/2024 12:02,Team Allocated,1070,7/15/2023 16:45,1/8/2024 3:30,2006-07-13_Male_India,2,Other,3,176,63,17,1,Churned
7/11/2023 19:50,00000000-0GWQ-AXC5-X45C-2MHJ28,Data Visualization,Internship,3/11/2024 18:00,5/27/2005,Male,Nigeria,Bridgehouse college,Economics,3/11/2024 12:02,Team Allocated,1070,7/11/2023 20:00,1/8/2024 3:30,2005-05-27_Male_Nigeria,2,Other,0,180,63,18,1,Churned
7/21/2023 1:41,00000000-0GRA-BD28-CXVV-EYEX21,Health Care Management,Internship,,2/1/1987,Male,Nigeria,Nigerian Defense Academy kaduna,Civil and Structural Engineering,3/11/2024 12:02,Team Allocated,1070,7/21/2023 2:31,1/8/2024 3:30,1987-02-01_Male_Nigeria,2,Engineering,0,171,,36,1,Churned
7/11/2023 19:50,00000000-0GHB-4N83-QX9K-JM48K2,Project Management,Internship,3/11/2024 18:00,5/27/2005,Male,Nigeria,Bridgehouse college,Economics,3/11/2024 12:02,Team Allocated,1070,7/11/2023 20:09,1/8/2024 3:30,2005-05-27_Male_Nigeria,2,Other,0,180,63,18,1,Churned
7/11/2023 17:11,00000000-0GRA-BD28-CXVV-EYEX21,Health Care Management,Internship,,8/7/2002,Female,Nigeria,University of Benin,Radiography,3/11/2024 12:02,Team Allocated,1070,7/11/2023 17:43,1/8/2024 3:30,2002-08-07_Female_Nigeria,2,Other,0,180,,20,1,Churned
12/26/2023 13:27,00000000-0GRA-BD28-CXVV-EYEX21,Health Care Management,Internship,,4/24/2001,Male,United States,Saint Louis University,Information Systems,3/11/2024 12:02,Team Allocated,1070,12/26/2023 14:05,1/8/2024 3:30,2001-04-24_Male_United States,2,Other,0,12,,22,1,Churned
6/15/2023 11:58,00000000-0GRA-BD28-CXVV-EYEX21,Health Care Management,Internship,,1/3/1994,Female,Nigeria,Adekunle Ajasin University,Biochemistry,3/11/2024 12:02,Team Allocated,1070,6/15/2023 12:32,1/8/2024 3:30,1994-01-03_Female_Nigeria,2,Other,0,206,,29,1,Churned
7/11/2023 7:03,00000000-0GRA-BD28-CXVV-EYEX21,Health Care Management,Internship,,3/22/2000,Female,India,Sri sai college of dental surgery,Public Health,3/11/2024 12:02,Team Allocated,1070,7/15/2023 6:43,1/8/2024 3:30,2000-03-22_Female_India,2,Other,3,176,,23,1,Churned
7/11/2023 5:34,00000000-0GRA-BD28-CXVV-EYEX21,Health Care Management,Internship,,7/23/1997,Male,Ghana,KNUST,Statistics,3/11/2024 12:02,Team Allocated,1070,7/11/2023 6:09,1/8/2024 3:30,1997-07-23_Male_Ghana,2,Other,0,180,,25,1,Churned
7/10/2023 18:52,00000000-0GRA-BD28-CXVV-EYEX21,Health Care Management,Internship,,4/9/1995,Female,United States,Saint Louis University,Applied Analytics,3/11/2024 12:02,Team Allocated,1070,7/10/2023 19:14,1/8/2024 3:30,1995-04-09_Female_United States,2,Other,0,181,,28,1,Churned
7/10/2023 14:07,00000000-0GRA-BD28-CXVV-EYEX21,Health Care Management,Internship,,1/1/2000,Male,Bangladesh,Dhaka city College,Marketing,3/11/2024 12:02,Team Allocated,1070,9/26/2023 7:06,1/8/2024 3:30,2000-01-01_Male_Bangladesh,2,Other,77,103,,23,1,Churned
7/10/2023 13:37,00000000-0GRA-BD28-CXVV-EYEX21,Health Care Management,Internship,,5/29/1998,Female,India,CMR College of Pharmacy,Public Health,3/11/2024 12:02,Team Allocated,1070,8/19/2023 23:48,1/8/2024 3:30,1998-05-29_Female_India,2,Other,40,141,,25,1,Churned
7/10/2023 5:58,00000000-0GRA-BD28-CXVV-EYEX21,Health Care Management,Internship,,9/10/1996,Female,United States,Saint Louis University,Public Health,3/11/2024 12:02,Team Allocated,1070,8/30/2023 17:25,1/8/2024 3:30,1996-09-10_Female_United States,2,Other,51,130,,26,1,Churned
7/9/2023 15:09,00000000-0GRA-BD28-CXVV-EYEX21,Health Care Management,Internship,,10/9/1997,Female,United States,Saint Louis University,Computer Science,3/11/2024 12:02,Team Allocated,1070,7/11/2023 17:02,1/8/2024 3:30,1997-10-09_Female_United States,2,CS / IT,2,180,,25,1,Churned
8/21/2023 12:19,00000000-0GRA-BD28-CXVV-EYEX21,Health Care Management,Internship,,5/29/2001,Female,India,Indian Institute of Public Health,Clinical Research,3/11/2024 12:02,Team Allocated,1070,8/21/2023 12:41,1/8/2024 3:30,2001-05-29_Female_India,2,Other,0,139,,22,1,Churned
7/9/2023 11:06,00000000-10WW-X340-GTVH-RR52VF,Jump Start: Developing your Emotional Intelligence,Course,12/5/2025 11:06,8/14/1997,Female,India,saint louis university,Public Health,3/11/2024 12:02,Team Allocated,1070,,6/6/2023 11:06,1997-08-14_Female_India,2,Other,,,913,25,1,Churned
7/9/2023 10:16,00000000-0GRA-BD28-CXVV-EYEX21,Health Care Management,Internship,,7/3/1998,Male,Ghana,Takoradi Technical University,Information technology,3/11/2024 12:02,Team Allocated,1070,7/9/2023 10:26,1/8/2024 3:30,1998-07-03_Male_Ghana,2,Other,0,182,,25,1,Churned
7/9/2023 10:02,00000000-106T-FSAJ-KDBX-40ZGNV,UrbanRenew Challenge,Competition,4/29/2024 18:29,8/24/2001,Male,India,G.M INSTITUTE OF TECHNOLOGY,Computer Science,3/11/2024 12:03,Team Allocated,1070,2/3/2024 3:45,3/21/2024 18:30,2001-08-24_Male_India,2,CS / IT,208,47,38,21,1,Churned
7/9/2023 10:02,00000000-0GRA-BD28-CXVV-EYEX21,Health Care Management,Internship,,8/24/2001,Male,India,G.M INSTITUTE OF TECHNOLOGY,Computer Science,3/11/2024 12:02,Team Allocated,1070,12/12/2023 5:10,1/8/2024 3:30,2001-08-24_Male_India,2,CS / IT,155,26,,21,1,Churned
7/9/2023 10:00,00000000-0GRA-BD28-CXVV-EYEX21,Health Care Management,Internship,,8/24/2001,Male,United States,GM INSTITUTE OF TECHNOLOGY,Computer Science,3/11/2024 12:02,Team Allocated,1070,9/3/2023 4:18,1/8/2024 3:30,2001-08-24_Male_United States,2,CS / IT,55,126,,21,1,Churned
7/9/2023 6:55,00000000-0GRA-BD28-CXVV-EYEX21,Health Care Management,Internship,,8/23/2001,Male,United States,Saint Louis university,Computer Science,3/11/2024 12:02,Team Allocated,1070,10/31/2023 15:40,1/8/2024 3:30,2001-08-23_Male_United States,2,CS / IT,114,68,,21,1,Churned
7/9/2023 9:39,00000000-0GRA-BD28-CXVV-EYEX21,Health Care Management,Internship,,8/1/2000,Male,India,Saint Louis University,Computer Science and Information Systems,3/11/2024 12:02,Team Allocated,1070,12/27/2023 2:44,1/8/2024 3:30,2000-08-01_Male_India,2,CS / IT,170,12,,22,1,Churned
7/9/2023 8:52,00000000-0GRA-BD28-CXVV-EYEX21,Health Care Management,Internship,,7/26/1998,Male,India,JNTUHCEH,Information Systems,3/11/2024 12:02,Team Allocated,1070,10/6/2023 18:40,1/8/2024 3:30,1998-07-26_Male_India,2,Other,89,93,,24,1,Churned
7/9/2023 8:44,00000000-10QW-PYTT-CJCX-7VQBTT,Join a Student Organisation,Engagement,12/5/2025 12:59,8/10/1991,Female,United States,Saint Louis University,Health Data Science,3/11/2024 12:02,Team Allocated,1070,7/11/2023 12:04,8/21/2023 6:30,1991-08-10_Female_United States,2,Other,2,40,837,31,1,Churned
7/9/2023 7:00,00000000-106T-FSAJ-KDBX-40ZGNV,UrbanRenew Challenge,Competition,4/29/2024 18:29,2/24/2001,Female,United States,Vignana Bharathi Institute of Technology,Cyber Security,3/11/2024 12:03,Team Allocated,1070,3/2/2024 20:45,3/21/2024 18:30,2001-02-24_Female_United States,2,CS / IT,237,18,38,22,1,Churned
7/9/2023 7:00,00000000-0GRA-BD28-CXVV-EYEX21,Health Care Management,Internship,,2/24/2001,Female,United States,Vignana Bharathi Institute of Technology,Cyber Security,3/11/2024 12:02,Team Allocated,1070,9/6/2023 16:32,1/8/2024 3:30,2001-02-24_Female_United States,2,CS / IT,59,123,,22,1,Churned
7/9/2023 7:00,00000000-0GN2-A0AY-7XK8-C5FZPP,Career Essentials: Getting Started with Your Professional Journey,Course,6/29/2024 18:52,2/24/2001,Female,United States,Vignana Bharathi Institute of Technology,Cyber Security,3/11/2024 12:01,Team Allocated,1070,,11/3/2022 18:30,2001-02-24_Female_United States,2,CS / IT,,,604,22,1,Churned
7/9/2023 6:59,00000000-0GRA-BD28-CXVV-EYEX21,Health Care Management,Internship,,9/9/1999,Male,India,Sri indhu college of engineering and technology,Computer Information Systems,3/11/2024 12:02,Team Allocated,1070,12/4/2023 20:27,1/8/2024 3:30,1999-09-09_Male_India,2,CS / IT,148,34,,23,1,Churned
7/9/2023 6:58,00000000-0GRA-BD28-CXVV-EYEX21,Health Care Management,Internship,,3/13/2001,Female,United States,Saint Louis,Computer Science and Information Systems,3/11/2024 12:02,Team Allocated,1070,9/20/2023 19:57,1/8/2024 3:30,2001-03-13_Female_United States,2,CS / IT,73,109,,22,1,Churned
7/9/2023 6:56,00000000-0GRA-BD28-CXVV-EYEX21,Health Care Management,Internship,,8/27/2000,Male,India,Saint Louis University,Artificial Intelligence,3/11/2024 12:02,Team Allocated,1070,,1/8/2024 3:30,2000-08-27_Male_India,2,Other,,,,22,1,Churned
7/9/2023 6:56,00000000-0GRA-BD28-CXVV-EYEX21,Health Care Management,Internship,,6/28/2000,Male,United States,Saint Louis University,Software Engineering,3/11/2024 12:02,Team Allocated,1070,10/12/2023 1:07,1/8/2024 3:30,2000-06-28_Male_United States,2,CS / IT,94,88,,23,1,Churned
7/9/2023 6:56,00000000-0GRA-BD28-CXVV-EYEX21,Health Care Management,Internship,,8/11/2000,Male,India,Saint Louis University,Information Systems,3/11/2024 12:02,Team Allocated,1070,9/25/2023 15:33,1/8/2024 3:30,2000-08-11_Male_India,2,Other,78,104,,22,1,Churned
7/9/2023 6:56,00000000-0GRA-BD28-CXVV-EYEX21,Health Care Management,Internship,,4/16/2001,Male,United States,Saint Louis University,Computer Science,3/11/2024 12:02,Team Allocated,1070,,1/8/2024 3:30,2001-04-16_Male_United States,2,CS / IT,,,,22,1,Churned
7/6/2023 8:03,00000000-0GRA-BD28-CXVV-EYEX21,Health Care Management,Internship,,11/11/2001,Female,Nigeria,NNAMDI AZIKIWE UNIVERSITY AWKA,Public Health,3/11/2024 12:02,Team Allocated,1070,7/6/2023 8:21,1/8/2024 3:30,2001-11-11_Female_Nigeria,2,Other,0,185,,21,1,Churned
7/9/2023 10:00,00000000-106T-FSAJ-KDBX-40ZGNV,UrbanRenew Challenge,Competition,4/29/2024 18:29,8/24/2001,Male,United States,GM INSTITUTE OF TECHNOLOGY,Computer Science,3/11/2024 12:03,Team Allocated,1070,2/6/2024 20:48,3/21/2024 18:30,2001-08-24_Male_United States,2,CS / IT,212,43,38,21,1,Churned
7/6/2023 7:43,00000000-0GRA-BD28-CXVV-EYEX21,Health Care Management,Internship,,4/15/2001,Female,Nigeria,Nnamdi Azikiwe University,Public Health,3/11/2024 12:02,Team Allocated,1070,7/6/2023 8:02,1/8/2024 3:30,2001-04-15_Female_Nigeria,2,Other,0,185,,22,1,Churned
7/9/2023 6:55,00000000-0GRA-BD28-CXVV-EYEX21,Health Care Management,Internship,,4/24/2001,Male,India,Saint Louis university,Computer Science,3/11/2024 12:02,Team Allocated,1070,10/11/2023 23:52,1/8/2024 3:30,2001-04-24_Male_India,2,CS / IT,94,88,,22,1,Churned
7/7/2023 18:40,00000000-0GRA-BD28-CXVV-EYEX21,Health Care Management,Internship,,6/6/2002,Female,India,Srm,Biotechnology,3/11/2024 12:02,Team Allocated,1070,7/7/2023 18:46,1/8/2024 3:30,2002-06-06_Female_India,2,Other,0,184,,21,1,Churned
7/9/2023 6:55,00000000-106T-FSAJ-KDBX-40ZGNV,UrbanRenew Challenge,Competition,4/29/2024 18:29,9/18/2000,Male,India,Jawaharlal Nehru technological universities vizianagaram,Cyber Security,3/11/2024 12:03,Team Allocated,1070,1/25/2024 17:16,3/21/2024 18:30,2000-09-18_Male_India,2,CS / IT,200,56,38,22,1,Churned
7/9/2023 6:55,00000000-10QW-PYTT-CJCX-7VQBTT,Join a Student Organisation,Engagement,12/5/2025 12:59,9/18/2000,Male,India,Jawaharlal Nehru technological universities vizianagaram,Cyber Security,3/11/2024 12:02,Team Allocated,1070,7/25/2023 13:10,8/21/2023 6:30,2000-09-18_Male_India,2,CS / IT,16,26,837,22,1,Churned
7/9/2023 6:55,00000000-0GRA-BD28-CXVV-EYEX21,Health Care Management,Internship,,9/18/2000,Male,India,Jawaharlal Nehru technological universities vizianagaram,Cyber Security,3/11/2024 12:02,Team Allocated,1070,8/30/2023 5:04,1/8/2024 3:30,2000-09-18_Male_India,2,CS / IT,51,130,,22,1,Churned
7/9/2023 6:53,00000000-0GHB-4N83-QX9K-JM48K2,Project Management,Internship,3/11/2024 18:00,8/8/2001,Male,India,Kl university,Computer Science,3/11/2024 12:02,Team Allocated,1070,12/8/2023 3:26,1/8/2024 3:30,2001-08-08_Male_India,2,CS / IT,151,31,63,21,1,Churned
7/9/2023 6:53,00000000-10RQ-JXA9-NNKD-EW5RCF,UX Redesign Challenge,Competition,4/19/2024 18:29,9/17/2000,Male,United States,Saint Louis University,Computer Science,3/11/2024 12:03,Team Allocated,1070,1/23/2024 14:42,2/15/2024 18:30,2000-09-17_Male_United States,2,CS / IT,198,23,63,22,1,Churned
7/9/2023 6:53,00000000-106T-FSAJ-KDBX-40ZGNV,UrbanRenew Challenge,Competition,4/29/2024 18:29,9/17/2000,Male,United States,Saint Louis University,Computer Science,3/11/2024 12:03,Team Allocated,1070,1/23/2024 14:43,3/21/2024 18:30,2000-09-17_Male_United States,2,CS / IT,198,58,38,22,1,Churned
7/9/2023 6:53,00000000-0GWQ-AXC5-X45C-2MHJ28,Data Visualization,Internship,3/11/2024 18:00,9/17/2000,Male,United States,Saint Louis University,Computer Science,3/11/2024 12:02,Team Allocated,1070,10/19/2023 20:22,1/8/2024 3:30,2000-09-17_Male_United States,2,CS / IT,102,80,63,22,1,Churned
7/9/2023 6:53,00000000-0GZY-NNHV-FJWW-PTA9VX,Innovation & Entrepreneurship,Internship,3/11/2024 18:00,9/17/2000,Male,United States,Saint Louis University,Computer Science,3/11/2024 12:02,Team Allocated,1070,10/29/2023 18:26,1/8/2024 3:30,2000-09-17_Male_United States,2,CS / IT,112,70,63,22,1,Churned
7/9/2023 5:36,00000000-0GHB-4N83-QX9K-JM48K2,Project Management,Internship,3/11/2024 18:00,4/28/1993,Male,Ghana,National Pirogov medical university,Public Health,3/11/2024 12:02,Team Allocated,1070,7/9/2023 5:50,1/8/2024 3:30,1993-04-28_Male_Ghana,2,Other,0,182,63,30,1,Churned
7/8/2023 20:32,00000000-0GRA-BD28-CXVV-EYEX21,Health Care Management,Internship,,6/6/1999,Female,Kenya,Garissa University,Education and Training,3/11/2024 12:02,Team Allocated,1070,7/17/2023 14:41,1/8/2024 3:30,1999-06-06_Female_Kenya,2,Other,8,174,,24,1,Churned
7/8/2023 9:09,00000000-0GRA-BD28-CXVV-EYEX21,Health Care Management,Internship,,1/1/1997,Male,India,Saint Louis University,Information Systems,3/11/2024 12:02,Team Allocated,1070,9/6/2023 4:10,1/8/2024 3:30,1997-01-01_Male_India,2,Other,59,123,,26,1,Churned
7/8/2023 8:04,00000000-0GRA-BD28-CXVV-EYEX21,Health Care Management,Internship,,4/26/2000,Male,India,REVA University,Biochemistry,3/11/2024 12:02,Team Allocated,1070,8/19/2023 10:43,1/8/2024 3:30,2000-04-26_Male_India,2,Other,42,141,,23,1,Churned
7/9/2023 6:55,00000000-10A5-TYD2-181G-D2J679,Xperience Design Hackathon,Competition,3/13/2024 18:29,9/18/2000,Male,India,Jawaharlal Nehru technological universities vizianagaram,Cyber Security,3/11/2024 12:03,Team Allocated,1070,1/27/2024 5:45,1/28/2024 18:30,2000-09-18_Male_India,2,CS / IT,201,1,44,22,1,Churned
7/9/2023 6:55,00000000-10RQ-JXA9-NNKD-EW5RCF,UX Redesign Challenge,Competition,4/19/2024 18:29,9/18/2000,Male,India,Jawaharlal Nehru technological universities vizianagaram,Cyber Security,3/11/2024 12:03,Team Allocated,1070,1/25/2024 17:15,2/15/2024 18:30,2000-09-18_Male_India,2,CS / IT,200,21,63,22,1,Churned
7/7/2023 16:49,00000000-10RQ-JXA9-NNKD-EW5RCF,UX Redesign Challenge,Competition,4/19/2024 18:29,9/10/1998,Male,Nigeria,Kebbi state University of science and technology aliero,Biology,3/11/2024 12:03,Team Allocated,1070,2/6/2024 6:13,2/15/2024 18:30,1998-09-10_Male_Nigeria,2,Other,213,9,63,24,1,Churned
7/7/2023 16:49,00000000-0GRA-BD28-CXVV-EYEX21,Health Care Management,Internship,,9/10/1998,Male,Nigeria,Kebbi state University of science and technology aliero,Biology,3/11/2024 12:02,Team Allocated,1070,8/7/2023 15:36,1/8/2024 3:30,1998-09-10_Male_Nigeria,2,Other,30,153,,24,1,Churned
7/7/2023 12:55,00000000-0GHB-4N83-QX9K-JM48K2,Project Management,Internship,3/11/2024 18:00,3/30/1999,Female,India,Maharshi Dayanand University,Business Administration,3/11/2024 12:02,Team Allocated,1070,7/7/2023 18:33,1/8/2024 3:30,1999-03-30_Female_India,2,Business,0,184,63,24,1,Churned
7/7/2023 8:04,00000000-0GRA-BD28-CXVV-EYEX21,Health Care Management,Internship,,2/8/1996,Female,Ghana,University of Health and Allied Sciences,Public Health,3/11/2024 12:02,Team Allocated,1070,7/7/2023 10:35,1/8/2024 3:30,1996-02-08_Female_Ghana,2,Other,0,184,,27,1,Churned
7/7/2023 7:31,00000000-0GRA-BD28-CXVV-EYEX21,Health Care Management,Internship,,1/22/1996,Female,Ghana,University of Health and Allied Sciences,Dietetics,3/11/2024 12:02,Team Allocated,1070,7/7/2023 7:43,1/8/2024 3:30,1996-01-22_Female_Ghana,2,Other,0,184,,27,1,Churned
7/7/2023 7:28,00000000-0GRA-BD28-CXVV-EYEX21,Health Care Management,Internship,,6/26/1995,Male,India,Vaagdevi Engineering College,Electrical and Electronic Engineering,3/11/2024 12:02,Team Allocated,1070,8/21/2023 14:44,1/8/2024 3:30,1995-06-26_Male_India,2,Engineering,45,139,,28,1,Churned
7/7/2023 6:14,00000000-0GHB-4N83-QX9K-JM48K2,Project Management,Internship,3/11/2024 18:00,9/19/1998,Male,India,Pondicherry University,Business Analytics,3/11/2024 12:02,Team Allocated,1070,7/7/2023 19:01,1/8/2024 3:30,1998-09-19_Male_India,2,Business,0,184,63,24,1,Churned
7/7/2023 4:23,00000000-0GHB-4N83-QX9K-JM48K2,Project Management,Internship,3/11/2024 18:00,12/29/1997,Male,India,KR Mangalam,MBA,3/11/2024 12:02,Team Allocated,1070,9/11/2023 5:28,1/8/2024 3:30,1997-12-29_Male_India,2,Other,66,118,63,25,1,Churned
7/6/2023 23:29,00000000-0GRA-BD28-CXVV-EYEX21,Health Care Management,Internship,,7/13/1999,Female,Nigeria,Olabisi Onabanjo University,Mass Communication,3/11/2024 12:02,Team Allocated,1070,7/8/2023 17:06,1/8/2024 3:30,1999-07-13_Female_Nigeria,2,Other,1,183,,23,1,Churned
7/6/2023 21:46,00000000-0GWQ-AXC5-X45C-2MHJ28,Data Visualization,Internship,3/11/2024 18:00,12/8/1989,Male,Nigeria,University of Ibadan  Ibadan  Nigeria.,Education and Training,3/11/2024 12:02,Team Allocated,1070,7/9/2023 18:33,1/8/2024 3:30,1989-12-08_Male_Nigeria,2,Other,2,182,63,33,1,Churned
7/6/2023 17:02,00000000-0GWQ-AXC5-X45C-2MHJ28,Data Visualization,Internship,3/11/2024 18:00,4/19/1989,Male,Nigeria,University of Jos,Physics and Astronomy,3/11/2024 12:02,Team Allocated,1070,7/9/2023 4:23,1/8/2024 3:30,1989-04-19_Male_Nigeria,2,Other,2,182,63,34,1,Churned
7/6/2023 14:10,00000000-0GNT-FT74-MZT8-93VC0G,Digital Marketing,Internship,3/11/2024 18:00,5/12/1992,Female,India,M.G university,Electronics and Communication,3/11/2024 12:01,Team Allocated,1070,7/6/2023 14:29,1/8/2024 3:30,1992-05-12_Female_India,2,Other,0,185,63,31,1,Churned
7/5/2023 21:17,00000000-0GRA-BD28-CXVV-EYEX21,Health Care Management,Internship,,8/5/1995,Male,Nigeria,Ahmadu Bello University Zaria  Nigeria.,Other,3/11/2024 12:02,Team Allocated,1070,7/5/2023 23:49,1/8/2024 3:30,1995-08-05_Male_Nigeria,2,Other,0,186,,27,1,Churned
6/16/2023 16:08,00000000-10QW-PYTT-CJCX-7VQBTT,Join a Student Organisation,Engagement,12/5/2025 12:59,11/27/2001,Female,India,University of Europe,Software Engineering,3/11/2024 12:02,Team Allocated,1070,6/19/2023 6:22,8/21/2023 6:30,2001-11-27_Female_India,2,CS / IT,2,63,837,21,1,Churned
7/11/2023 15:48,00000000-0GRA-BD28-CXVV-EYEX21,Health Care Management,Internship,,6/5/1999,Female,Ghana,UNIVERSITY OF GHANA,Political Science and Spanish,3/11/2024 12:02,Team Allocated,1070,7/12/2023 1:21,1/8/2024 3:30,1999-06-05_Female_Ghana,2,CS / IT,0,180,,24,1,Churned
6/17/2023 18:31,00000000-0GRA-BD28-CXVV-EYEX21,Health Care Management,Internship,,12/17/1994,Female,Nigeria,Collage of health sciences and technology kaltingo gombe state,Zoology,3/11/2024 12:02,Team Allocated,1070,6/19/2023 19:58,1/8/2024 3:30,1994-12-17_Female_Nigeria,2,Other,2,202,,28,1,Churned
6/30/2023 18:36,00000000-0GRA-BD28-CXVV-EYEX21,Health Care Management,Internship,,6/14/1988,Male,Ghana,Pentecost University College,Business Analytics,3/11/2024 12:02,Team Allocated,1070,12/27/2023 10:04,1/8/2024 3:30,1988-06-14_Male_Ghana,2,Business,179,11,,35,1,Churned
6/30/2023 17:13,00000000-10QW-PYTT-CJCX-7VQBTT,Join a Student Organisation,Engagement,12/5/2025 12:59,5/13/1998,Male,India,Saint Louis University,Information Systems,3/11/2024 12:02,Team Allocated,1070,8/19/2023 3:20,8/21/2023 6:30,1998-05-13_Male_India,2,Other,49,2,837,25,1,Churned
6/29/2023 10:34,00000000-106T-FSAJ-KDBX-40ZGNV,UrbanRenew Challenge,Competition,4/29/2024 18:29,8/18/2005,Male,Nigeria,University of Debrecen,Mechatronics Engineering,3/11/2024 12:03,Team Allocated,1070,2/25/2024 16:53,3/21/2024 18:30,2005-08-18_Male_Nigeria,2,Engineering,241,25,38,17,1,Churned
6/27/2023 22:42,00000000-0GRA-BD28-CXVV-EYEX21,Health Care Management,Internship,,2/23/2001,Female,Nigeria,Federal University of Technology Minna,Microbiology,3/11/2024 12:02,Team Allocated,1070,6/29/2023 3:20,1/8/2024 3:30,2001-02-23_Female_Nigeria,2,Other,1,193,,22,1,Churned
6/27/2023 17:48,00000000-0GRA-BD28-CXVV-EYEX21,Health Care Management,Internship,,2/2/2002,Female,India,Jawaharlal Nehru Medical College,MBBS,3/11/2024 12:02,Team Allocated,1070,9/2/2023 14:44,1/8/2024 3:30,2002-02-02_Female_India,2,Other,66,127,,21,1,Churned
6/27/2023 14:31,00000000-0GRA-BD28-CXVV-EYEX21,Health Care Management,Internship,,10/22/2002,Male,India,Vignan's lara institute of technology and science,Computer Information Systems,3/11/2024 12:02,Team Allocated,1070,9/13/2023 16:41,1/8/2024 3:30,2002-10-22_Male_India,2,CS / IT,78,116,,20,1,Churned
6/27/2023 13:38,00000000-10QW-PYTT-CJCX-7VQBTT,Join a Student Organisation,Engagement,12/5/2025 12:59,11/15/2001,Male,India,Sathyabama institute of science and technology,Computer Science,3/11/2024 12:02,Team Allocated,1070,7/26/2023 10:02,8/21/2023 6:30,2001-11-15_Male_India,2,CS / IT,28,25,837,21,1,Churned
6/27/2023 9:16,00000000-0GRA-BD28-CXVV-EYEX21,Health Care Management,Internship,,3/18/1988,Male,Nigeria,Yaba college of technology,Architecture,3/11/2024 12:02,Team Allocated,1070,7/28/2023 5:20,1/8/2024 3:30,1988-03-18_Male_Nigeria,2,CS / IT,30,163,,35,1,Churned
6/27/2023 2:47,00000000-0GHB-4N83-QX9K-JM48K2,Project Management,Internship,3/11/2024 18:00,5/27/1995,Female,India,VNIT,Chemical Engineering,3/11/2024 12:02,Team Allocated,1070,7/25/2023 18:39,1/8/2024 3:30,1995-05-27_Female_India,2,Engineering,28,166,63,28,1,Churned
6/26/2023 18:57,00000000-0GRA-BD28-CXVV-EYEX21,Health Care Management,Internship,,1/10/1990,Female,Ghana,University of Education,Aviation Maintenance,3/11/2024 12:02,Team Allocated,1070,6/26/2023 19:07,1/8/2024 3:30,1990-01-10_Female_Ghana,2,Other,0,195,,33,1,Churned
6/26/2023 10:38,00000000-0GRA-BD28-CXVV-EYEX21,Health Care Management,Internship,,11/18/2001,Female,Nigeria,University of Ilorin,Chemistry,3/11/2024 12:02,Team Allocated,1070,8/23/2023 5:57,1/8/2024 3:30,2001-11-18_Female_Nigeria,2,Other,57,137,,21,1,Churned
6/23/2023 16:35,00000000-0GRA-BD28-CXVV-EYEX21,Health Care Management,Internship,,4/16/1993,Female,United States,Saint Louis University,Business Analytics,3/11/2024 12:02,Team Allocated,1070,7/4/2023 23:01,1/8/2024 3:30,1993-04-16_Female_United States,2,Business,11,187,,30,1,Churned
6/26/2023 1:25,00000000-0GRA-BD28-CXVV-EYEX21,Health Care Management,Internship,,12/19/1990,Male,Ghana,AAMUSTED,Agriculture and Forestry,3/11/2024 12:02,Team Allocated,1070,6/26/2023 1:42,1/8/2024 3:30,1990-12-19_Male_Ghana,2,Other,0,196,,32,1,Churned
6/25/2023 16:25,00000000-106T-FSAJ-KDBX-40ZGNV,UrbanRenew Challenge,Competition,4/29/2024 18:29,2/6/1999,Male,India,Gitam university,Electronics and Communication,3/11/2024 12:03,Team Allocated,1070,2/20/2024 5:36,3/21/2024 18:30,1999-02-06_Male_India,2,Other,239,30,38,24,1,Churned
6/25/2023 16:02,00000000-10QW-PYTT-CJCX-7VQBTT,Join a Student Organisation,Engagement,12/5/2025 12:59,2/5/2002,Male,United States,Saint Louis University,Computer Science,3/11/2024 12:02,Team Allocated,1070,8/19/2023 5:31,8/21/2023 6:30,2002-02-05_Male_United States,2,CS / IT,54,2,837,21,1,Churned
6/25/2023 15:16,00000000-10A5-TYD2-181G-D2J679,Xperience Design Hackathon,Competition,3/13/2024 18:29,2/26/2002,Female,United States,saint louis University,Information Systems,3/11/2024 12:03,Team Allocated,1070,1/27/2024 1:53,1/28/2024 18:30,2002-02-26_Female_United States,2,Other,215,1,44,21,1,Churned
6/25/2023 15:16,00000000-10RQ-JXA9-NNKD-EW5RCF,UX Redesign Challenge,Competition,4/19/2024 18:29,2/26/2002,Female,United States,saint louis University,Information Systems,3/11/2024 12:03,Team Allocated,1070,1/27/2024 1:53,2/15/2024 18:30,2002-02-26_Female_United States,2,Other,215,19,63,21,1,Churned
6/25/2023 15:16,00000000-106T-FSAJ-KDBX-40ZGNV,UrbanRenew Challenge,Competition,4/29/2024 18:29,2/26/2002,Female,United States,saint louis University,Information Systems,3/11/2024 12:03,Team Allocated,1070,1/27/2024 1:54,3/21/2024 18:30,2002-02-26_Female_United States,2,Other,215,54,38,21,1,Churned
6/25/2023 15:16,00000000-10YM-B80K-RNNJ-YAVQ7V,Upload Your First Year Transcript,Engagement,12/6/2025 10:26,2/26/2002,Female,United States,saint louis University,Information Systems,3/11/2024 12:02,Team Allocated,1070,9/5/2023 4:27,5/31/2024 7:04,2002-02-26_Female_United States,2,Other,71,269,554,21,1,Churned
6/25/2023 15:16,00000000-0GRA-BD28-CXVV-EYEX21,Health Care Management,Internship,,2/26/2002,Female,United States,saint louis University,Information Systems,3/11/2024 12:02,Team Allocated,1070,10/16/2023 10:37,1/8/2024 3:30,2002-02-26_Female_United States,2,Other,112,83,,21,1,Churned
6/25/2023 13:55,00000000-0GRA-BD28-CXVV-EYEX21,Health Care Management,Internship,,2/13/2001,Female,Nigeria,University of Ilorin,Medicine,3/11/2024 12:02,Team Allocated,1070,6/25/2023 14:03,1/8/2024 3:30,2001-02-13_Female_Nigeria,2,Other,0,196,,22,1,Churned
6/25/2023 7:42,00000000-0GRA-BD28-CXVV-EYEX21,Health Care Management,Internship,,6/26/2009,Female,Nigeria,University of Maiduguri,Education and Training,3/11/2024 12:02,Team Allocated,1070,6/25/2023 8:00,1/8/2024 3:30,2009-06-26_Female_Nigeria,2,Other,0,196,,14,1,Churned
6/23/2023 18:54,00000000-10QW-PYTT-CJCX-7VQBTT,Join a Student Organisation,Engagement,12/5/2025 12:59,5/21/2002,Male,United States,Saint Louis Univeristy,Artificial Intelligence,3/11/2024 12:02,Team Allocated,1070,7/26/2023 14:18,8/21/2023 6:30,2002-05-21_Male_United States,2,Other,32,25,837,21,1,Churned
8/21/2023 11:52,00000000-0GRA-BD28-CXVV-EYEX21,Health Care Management,Internship,,5/8/1996,Female,India,Indian institute of public health Delhi,Public Health,3/11/2024 12:02,Team Allocated,1070,8/21/2023 12:32,1/8/2024 3:30,1996-05-08_Female_India,2,Other,0,139,,27,1,Churned
8/21/2023 12:40,00000000-0GRA-BD28-CXVV-EYEX21,Health Care Management,Internship,,8/13/2003,Female,India,© 2023 TomTom  © OpenStreetMap Sri Venkateswara College of Engineering,Artificial Intelligence and Data Science,3/11/2024 12:02,Team Allocated,1070,8/21/2023 14:33,1/8/2024 3:30,2003-08-13_Female_India,2,Other,0,139,,20,1,Churned
,00000000-0GRA-BD28-CXVV-EYEX21,Health Care Management,Internship,,10/19/2001,Female,United States,Saintlouis  University,Information Systems,3/11/2024 12:02,Team Allocated,1070,10/10/2023 1:15,1/8/2024 3:30,2001-10-19_Female_United States,2,Other,,90,,,1,Churned
12/20/2023 13:34,00000000-0GRA-BD28-CXVV-EYEX21,Health Care Management,Internship,,6/6/2000,Male,India,NIMS University,Hospitality and Leisure Management,3/11/2024 12:02,Team Allocated,1070,12/20/2023 13:55,1/8/2024 3:30,2000-06-06_Male_India,2,CS / IT,0,18,,23,1,Churned
7/1/2023 12:10,00000000-0GN2-A0AY-7XK8-C5FZPP,Career Essentials: Getting Started with Your Professional Journey,Course,6/29/2024 18:52,3/14/2002,Female,India,saint louis university,Computer Science,3/11/2024 12:01,Team Allocated,1070,,11/3/2022 18:30,2002-03-14_Female_India,2,CS / IT,,,604,21,1,Churned
7/2/2023 15:03,00000000-106T-FSAJ-KDBX-40ZGNV,UrbanRenew Challenge,Competition,4/29/2024 18:29,6/12/2001,Male,United States,Saint Louis University,Information Systems,3/11/2024 12:03,Team Allocated,1070,1/29/2024 2:11,3/21/2024 18:30,2001-06-12_Male_United States,2,Other,210,52,38,22,1,Churned
6/26/2023 14:52,00000000-0GRA-BD28-CXVV-EYEX21,Health Care Management,Internship,,1/8/2005,Female,India,Saint Louis University,Biology,3/11/2024 12:02,Team Allocated,1070,7/26/2023 4:59,1/8/2024 3:30,2005-01-08_Female_India,2,Other,29,165,,18,1,Churned
6/16/2023 9:40,00000000-100J-PM3A-0WJ8-5T68M5,Jump Start: Developing your Emotional Intelligence,Course,12/24/2025 3:34,1/31/2002,Male,India,Saint Louis University,Information Systems,3/11/2024 12:03,Team Allocated,1070,1/26/2024 1:02,1/28/2024 23:30,2002-01-31_Male_India,2,Other,223,2,695,21,1,Churned
6/17/2023 17:52,00000000-0GRA-BD28-CXVV-EYEX21,Health Care Management,Internship,,3/14/2002,Male,India,TKR college of engineering and technology,Computer Science and Engineering,3/11/2024 12:02,Team Allocated,1070,7/17/2023 17:31,1/8/2024 3:30,2002-03-14_Male_India,2,CS / IT,29,174,,21,1,Churned
6/17/2023 14:20,00000000-100J-PM3A-0WJ8-5T68M5,Jump Start: Developing your Emotional Intelligence,Course,12/24/2025 3:34,12/24/2001,Male,India,Saint louis University,Information Systems,3/11/2024 12:03,Team Allocated,1070,1/26/2024 1:04,1/28/2024 23:30,2001-12-24_Male_India,2,Other,222,2,695,21,1,Churned
6/17/2023 14:20,00000000-10RQ-JXA9-NNKD-EW5RCF,UX Redesign Challenge,Competition,4/19/2024 18:29,12/24/2001,Male,India,Saint louis University,Information Systems,3/11/2024 12:03,Team Allocated,1070,1/24/2024 1:18,2/15/2024 18:30,2001-12-24_Male_India,2,Other,220,22,63,21,1,Churned
6/17/2023 14:20,00000000-106T-FSAJ-KDBX-40ZGNV,UrbanRenew Challenge,Competition,4/29/2024 18:29,12/24/2001,Male,India,Saint louis University,Information Systems,3/11/2024 12:03,Team Allocated,1070,1/24/2024 1:17,3/21/2024 18:30,2001-12-24_Male_India,2,Other,220,57,38,21,1,Churned
6/17/2023 14:20,00000000-0GRA-BD28-CXVV-EYEX21,Health Care Management,Internship,,12/24/2001,Male,India,Saint louis University,Information Systems,3/11/2024 12:02,Team Allocated,1070,8/16/2023 16:23,1/8/2024 3:30,2001-12-24_Male_India,2,Other,60,144,,21,1,Churned
6/17/2023 11:01,00000000-106T-FSAJ-KDBX-40ZGNV,UrbanRenew Challenge,Competition,4/29/2024 18:29,8/27/1999,Male,India,Saint Louis University,Computer Science,3/11/2024 12:03,Team Allocated,1070,2/15/2024 16:05,3/21/2024 18:30,1999-08-27_Male_India,2,CS / IT,243,35,38,23,1,Churned
6/16/2023 19:39,00000000-0GRA-BD28-CXVV-EYEX21,Health Care Management,Internship,,12/27/1995,Female,Nigeria,University of Jos,Medicine,3/11/2024 12:02,Team Allocated,1070,6/16/2023 19:52,1/8/2024 3:30,1995-12-27_Female_Nigeria,2,Other,0,205,,27,1,Churned
6/16/2023 19:06,00000000-106T-FSAJ-KDBX-40ZGNV,UrbanRenew Challenge,Competition,4/29/2024 18:29,7/24/1997,Male,United States,Saint Louis University,Information Systems,3/11/2024 12:03,Team Allocated,1070,1/24/2024 13:59,3/21/2024 18:30,1997-07-24_Male_United States,2,Other,221,57,38,25,1,Churned
6/16/2023 17:16,00000000-0GRA-BD28-CXVV-EYEX21,Health Care Management,Internship,,11/7/1996,Female,Egypt,Cairo University,Mechanical Engineering,3/11/2024 12:02,Team Allocated,1070,8/29/2023 13:56,1/8/2024 3:30,1996-11-07_Female_Egypt,2,Engineering,73,131,,26,1,Churned
6/16/2023 17:05,00000000-0GNT-FT74-MZT8-93VC0G,Digital Marketing,Internship,3/11/2024 18:00,2/15/1985,Male,India,Great Lakes Institute of Management,Artificial Intelligence and Data Science,3/11/2024 12:02,Team Allocated,1070,8/16/2023 10:57,1/8/2024 3:30,1985-02-15_Male_India,2,Other,60,144,63,38,1,Churned
6/16/2023 13:30,00000000-0GHB-4N83-QX9K-JM48K2,Project Management,Internship,3/11/2024 18:00,3/4/1999,Male,India,Rajasthan technical university,Certification,3/11/2024 12:02,Team Allocated,1070,8/10/2023 9:44,1/8/2024 3:30,1999-03-04_Male_India,2,Other,54,150,63,24,1,Churned
,00000000-0GRA-BD28-CXVV-EYEX21,Health Care Management,Internship,,10/10/2005,Female,Saudi Arabia,other,Other,3/11/2024 12:02,Team Allocated,1070,8/14/2023 13:12,1/8/2024 3:30,2005-10-10_Female_Saudi Arabia,2,Other,,146,,,1,Churned
6/16/2023 9:40,00000000-10A5-TYD2-181G-D2J679,Xperience Design Hackathon,Competition,3/13/2024 18:29,1/31/2002,Male,India,Saint Louis University,Information Systems,3/11/2024 12:03,Team Allocated,1070,,1/28/2024 18:30,2002-01-31_Male_India,2,Other,,,44,21,1,Churned
7/5/2023 20:07,00000000-0GRA-BD28-CXVV-EYEX21,Health Care Management,Internship,,11/10/1999,Male,United States,saint Louis university,Artificial Intelligence,3/11/2024 12:02,Team Allocated,1070,8/14/2023 4:18,1/8/2024 3:30,1999-11-10_Male_United States,2,Other,39,146,,23,1,Churned
6/16/2023 9:40,00000000-10RQ-JXA9-NNKD-EW5RCF,UX Redesign Challenge,Competition,4/19/2024 18:29,1/31/2002,Male,India,Saint Louis University,Information Systems,3/11/2024 12:03,Team Allocated,1070,1/23/2024 21:07,2/15/2024 18:30,2002-01-31_Male_India,2,Other,221,22,63,21,1,Churned
6/16/2023 9:40,00000000-106T-FSAJ-KDBX-40ZGNV,UrbanRenew Challenge,Competition,4/29/2024 18:29,1/31/2002,Male,India,Saint Louis University,Information Systems,3/11/2024 12:03,Team Allocated,1070,1/23/2024 21:07,3/21/2024 18:30,2002-01-31_Male_India,2,Other,221,57,38,21,1,Churned
6/16/2023 4:10,00000000-0GHB-4N83-QX9K-JM48K2,Project Management,Internship,3/11/2024 18:00,12/18/1996,Male,India,Ideal Institute of Engineering,Electrical Engineering,3/11/2024 12:02,Team Allocated,1070,8/21/2023 13:26,1/8/2024 3:30,1996-12-18_Male_India,2,Engineering,66,139,63,26,1,Churned
6/15/2023 23:00,00000000-0GHB-4N83-QX9K-JM48K2,Project Management,Internship,3/11/2024 18:00,7/25/1991,Male,Ghana,Accra Institute of Technology,Computer Engineering,3/11/2024 12:02,Team Allocated,1070,8/1/2023 15:44,1/8/2024 3:30,1991-07-25_Male_Ghana,2,CS / IT,46,159,63,31,1,Churned
6/15/2023 21:03,00000000-0GRA-BD28-CXVV-EYEX21,Health Care Management,Internship,,4/14/2001,Male,Egypt,The British University in Egypt,Pharmacy and Pharmacology,3/11/2024 12:02,Team Allocated,1070,6/15/2023 21:14,1/8/2024 3:30,2001-04-14_Male_Egypt,2,Other,0,206,,22,1,Churned
6/15/2023 17:46,00000000-10QW-PYTT-CJCX-7VQBTT,Join a Student Organisation,Engagement,12/5/2025 12:59,1/29/2010,Male,Pakistan,habibrehman529@gmail.com,Job,3/11/2024 12:02,Team Allocated,1070,6/15/2023 18:03,8/21/2023 6:30,2010-01-29_Male_Pakistan,2,Other,0,66,837,13,1,Churned
6/15/2023 17:18,00000000-106T-FSAJ-KDBX-40ZGNV,UrbanRenew Challenge,Competition,4/29/2024 18:29,7/12/2002,Male,India,Kl University,MBA,3/11/2024 12:03,Team Allocated,1070,2/29/2024 5:31,3/21/2024 18:30,2002-07-12_Male_India,2,Other,258,21,38,20,1,Churned
6/15/2023 16:12,00000000-0GRA-BD28-CXVV-EYEX21,Health Care Management,Internship,,7/25/1995,Male,Nigeria,Bauchi State University Gadau,Other,3/11/2024 12:02,Team Allocated,1070,6/15/2023 16:38,1/8/2024 3:30,1995-07-25_Male_Nigeria,2,Other,0,206,,27,1,Churned
6/15/2023 14:54,00000000-10QW-PYTT-CJCX-7VQBTT,Join a Student Organisation,Engagement,12/5/2025 12:59,11/14/1978,Female,Ghana,Middlesex University,Information technology,3/11/2024 12:02,Team Allocated,1070,8/3/2023 5:24,8/21/2023 6:30,1978-11-14_Female_Ghana,2,Other,48,18,837,44,1,Churned
6/15/2023 13:57,00000000-0GRA-BD28-CXVV-EYEX21,Health Care Management,Internship,,7/22/1999,Female,Nigeria,Imo state college of nursing and midwifery,Nursing,3/11/2024 12:02,Team Allocated,1070,8/22/2023 22:08,1/8/2024 3:30,1999-07-22_Female_Nigeria,2,Other,68,138,,23,1,Churned
6/19/2023 12:48,00000000-10WC-BS50-CYGD-X97ES4,CPR/AED Certification,Course,6/30/2024 16:18,6/30/1996,Female,Nigeria,Catholic University of Ghana,Nursing,3/11/2024 12:02,Team Allocated,1070,,3/20/2023 2:30,1996-06-30_Female_Nigeria,2,Other,,,468,26,1,Churned
6/23/2023 9:27,00000000-0GRA-BD28-CXVV-EYEX21,Health Care Management,Internship,,4/12/1999,Male,India,Saint louis university,Business Analytics,3/11/2024 12:02,Team Allocated,1070,9/2/2023 21:07,1/8/2024 3:30,1999-04-12_Male_India,2,Business,71,127,,24,1,Churned
7/7/2023 23:05,00000000-0GN2-A0AY-7XK8-C5FZPP,Career Essentials: Getting Started with Your Professional Journey,Course,6/29/2024 18:52,8/11/1994,Male,Nigeria,Jigawa State Polytechnic Dutse,Computer Science,3/11/2024 12:01,Team Allocated,1070,,11/3/2022 18:30,1994-08-11_Male_Nigeria,2,CS / IT,,,604,28,1,Churned
6/15/2023 6:16,00000000-0GRA-BD28-CXVV-EYEX21,Health Care Management,Internship,,7/27/1993,Male,Nigeria,Ahmadu Bello University zaria,Civil Engineering,3/11/2024 12:02,Team Allocated,1070,6/16/2023 13:53,1/8/2024 3:30,1993-07-27_Male_Nigeria,2,Engineering,1,205,,29,1,Churned
6/14/2023 18:36,00000000-0GHB-4N83-QX9K-JM48K2,Project Management,Internship,3/11/2024 18:00,8/7/1998,Female,India,ABN and PRR College of Science,Computer Science,3/11/2024 12:02,Team Allocated,1070,8/15/2023 13:32,1/8/2024 3:30,1998-08-07_Female_India,2,CS / IT,61,145,63,24,1,Churned
6/14/2023 16:30,00000000-0GRA-BD28-CXVV-EYEX21,Health Care Management,Internship,,7/28/1990,Male,Egypt,Directorate of health affairs,Pharmacy and Pharmacology,3/11/2024 12:02,Team Allocated,1070,6/14/2023 16:38,1/8/2024 3:30,1990-07-28_Male_Egypt,2,Other,0,207,,32,1,Churned
6/7/2023 14:14,00000000-0GNT-FT74-MZT8-93VC0G,Digital Marketing,Internship,3/11/2024 18:00,2/5/2008,Female,India,Dyal Singh Public School,Cyber Security,3/11/2024 12:02,Team Allocated,1070,6/20/2023 6:56,1/8/2024 3:30,2008-02-05_Female_India,2,CS / IT,12,201,63,15,1,Churned
6/14/2023 2:09,00000000-0GRA-BD28-CXVV-EYEX21,Health Care Management,Internship,,2/17/2000,Male,Ghana,ACCRA TECHNICAL UNIVERSITY,Other,3/11/2024 12:02,Team Allocated,1070,6/14/2023 2:23,1/8/2024 3:30,2000-02-17_Male_Ghana,2,Other,0,208,,23,1,Churned
6/13/2023 12:54,00000000-0GNT-FT74-MZT8-93VC0G,Digital Marketing,Internship,3/11/2024 18:00,11/4/1993,Male,Ghana,University of Cape Coast,Business and Management Studies,3/11/2024 12:02,Team Allocated,1070,8/14/2023 11:35,1/8/2024 3:30,1993-11-04_Male_Ghana,2,Business,61,146,63,29,1,Churned
6/13/2023 11:26,00000000-0GZY-NNHV-FJWW-PTA9VX,Innovation & Entrepreneurship,Internship,3/11/2024 18:00,12/28/1993,Female,Pakistan,Nust,Industrial Engineering,3/11/2024 12:02,Team Allocated,1070,8/10/2023 5:30,1/8/2024 3:30,1993-12-28_Female_Pakistan,2,Engineering,57,150,63,29,1,Churned
6/13/2023 7:24,00000000-0GRA-BD28-CXVV-EYEX21,Health Care Management,Internship,,8/11/1985,Female,Nigeria,Olabisi Onabanjo University,Social Work,3/11/2024 12:02,Team Allocated,1070,8/3/2023 23:15,1/8/2024 3:30,1985-08-11_Female_Nigeria,2,Other,51,157,,37,1,Churned
6/12/2023 17:14,00000000-10RQ-JXA9-NNKD-EW5RCF,UX Redesign Challenge,Competition,4/19/2024 18:29,4/16/2005,Female,United States,Saint Louis University,Nursing,3/11/2024 12:03,Team Allocated,1070,1/25/2024 18:08,2/15/2024 18:30,2005-04-16_Female_United States,2,Other,227,21,63,18,1,Churned
6/9/2023 15:57,00000000-10QW-PYTT-CJCX-7VQBTT,Join a Student Organisation,Engagement,12/5/2025 12:59,12/16/2000,Female,United States,Saint Louis University,Health Data Science,3/11/2024 12:02,Team Allocated,1070,7/9/2023 17:35,8/21/2023 6:30,2000-12-16_Female_United States,2,Other,30,42,837,22,1,Churned
6/9/2023 6:17,00000000-106T-FSAJ-KDBX-40ZGNV,UrbanRenew Challenge,Competition,4/29/2024 18:29,1/12/2005,Male,Philippines,University of Santo Tomas Senior High School,Biochemistry,3/11/2024 12:03,Team Allocated,1070,3/10/2024 17:12,3/21/2024 18:30,2005-01-12_Male_Philippines,2,Other,275,11,38,18,1,Churned
6/8/2023 18:57,00000000-10RQ-JXA9-NNKD-EW5RCF,UX Redesign Challenge,Competition,4/19/2024 18:29,11/15/2001,Male,United States,St Louis University,Information Systems,3/11/2024 12:03,Team Allocated,1070,2/2/2024 21:41,2/15/2024 18:30,2001-11-15_Male_United States,2,Other,239,12,63,21,1,Churned
6/8/2023 18:57,00000000-106T-FSAJ-KDBX-40ZGNV,UrbanRenew Challenge,Competition,4/29/2024 18:29,11/15/2001,Male,United States,St Louis University,Information Systems,3/11/2024 12:03,Team Allocated,1070,2/2/2024 21:38,3/21/2024 18:30,2001-11-15_Male_United States,2,Other,239,47,38,21,1,Churned
6/8/2023 13:14,00000000-0GHB-4N83-QX9K-JM48K2,Project Management,Internship,3/11/2024 18:00,7/13/1985,Male,Nigeria,Utiva,Data Visualization,3/11/2024 12:02,Team Allocated,1070,8/17/2023 20:25,1/8/2024 3:30,1985-07-13_Male_Nigeria,2,Other,70,143,63,37,1,Churned
6/7/2023 15:07,00000000-10QW-PYTT-CJCX-7VQBTT,Join a Student Organisation,Engagement,12/5/2025 12:59,9/17/2002,Male,India,Saint louis university,Computer Science,3/11/2024 12:02,Team Allocated,1070,7/11/2023 8:57,8/21/2023 6:30,2002-09-17_Male_India,2,CS / IT,33,40,837,20,1,Churned
6/7/2023 14:14,00000000-0GZY-NNHV-FJWW-PTA9VX,Innovation & Entrepreneurship,Internship,3/11/2024 18:00,2/5/2008,Female,India,Dyal Singh Public School,Cyber Security,3/11/2024 12:02,Team Allocated,1070,11/3/2023 8:41,1/8/2024 3:30,2008-02-05_Female_India,2,CS / IT,148,65,63,15,1,Churned
6/7/2023 12:56,00000000-0GRA-BD28-CXVV-EYEX21,Health Care Management,Internship,,10/29/2000,Male,United States,saint louis university,Computer Science,3/11/2024 12:02,Team Allocated,1070,9/17/2023 3:58,1/8/2024 3:30,2000-10-29_Male_United States,2,CS / IT,101,112,,22,1,Churned
5/28/2023 6:58,00000000-10RQ-JXA9-NNKD-EW5RCF,UX Redesign Challenge,Competition,4/19/2024 18:29,1/25/1999,Female,South Africa,Umuzi,Software Engineering,3/11/2024 12:03,Team Allocated,1070,2/2/2024 5:52,2/15/2024 18:30,1999-01-25_Female_South Africa,2,CS / IT,249,13,63,24,1,Churned
6/4/2023 11:38,00000000-10QW-PYTT-CJCX-7VQBTT,Join a Student Organisation,Engagement,12/5/2025 12:59,10/20/1998,Male,United States,Saint Louis University,Cyber Security,3/11/2024 12:02,Team Allocated,1070,7/25/2023 13:03,8/21/2023 6:30,1998-10-20_Male_United States,2,CS / IT,51,26,837,24,1,Churned
6/3/2023 10:26,00000000-0GHB-4N83-QX9K-JM48K2,Project Management,Internship,3/11/2024 18:00,7/11/2000,Male,India,Malla Reddy College of Engineering,Business Analytics,3/11/2024 12:02,Team Allocated,1070,8/21/2023 22:27,1/8/2024 3:30,2000-07-11_Male_India,2,Business,79,139,63,22,1,Churned
6/3/2023 10:26,00000000-0GRA-BD28-CXVV-EYEX21,Health Care Management,Internship,,7/11/2000,Male,India,Malla Reddy College of Engineering,Business Analytics,3/11/2024 12:02,Team Allocated,1070,8/21/2023 23:03,1/8/2024 3:30,2000-07-11_Male_India,2,Business,79,139,,22,1,Churned
6/3/2023 6:44,00000000-0GRA-BD28-CXVV-EYEX21,Health Care Management,Internship,,11/27/2000,Male,India,Saint louis university,Other,3/11/2024 12:02,Team Allocated,1070,8/21/2023 23:01,1/8/2024 3:30,2000-11-27_Male_India,2,Other,79,139,,22,1,Churned
6/2/2023 17:46,00000000-0GRA-BD28-CXVV-EYEX21,Health Care Management,Internship,,3/15/2000,Female,India,Bhoj Reddy Engineering College for women,Computer Science and Engineering,3/11/2024 12:02,Team Allocated,1070,10/2/2023 22:38,1/8/2024 3:30,2000-03-15_Female_India,2,CS / IT,122,97,,23,1,Churned
6/2/2023 15:04,00000000-0GNT-FT74-MZT8-93VC0G,Digital Marketing,Internship,3/11/2024 18:00,11/27/1998,Male,India,Saint Louis University  Saint Louis Missouri,Information Systems,3/11/2024 12:01,Team Allocated,1070,12/14/2023 4:09,1/8/2024 3:30,1998-11-27_Male_India,2,Other,194,24,63,24,1,Churned
6/2/2023 12:59,00000000-0GRA-BD28-CXVV-EYEX21,Health Care Management,Internship,,6/2/1998,Male,United States,Saint Louis University,Supply Chain Management,3/11/2024 12:02,Team Allocated,1070,12/7/2023 17:03,1/8/2024 3:30,1998-06-02_Male_United States,2,Business,188,31,,25,1,Churned
6/1/2023 14:58,00000000-10QW-PYTT-CJCX-7VQBTT,Join a Student Organisation,Engagement,12/5/2025 12:59,9/22/2001,Male,India,ICAT Design and Media College,B Sc,3/11/2024 12:02,Team Allocated,1070,6/9/2023 8:43,8/21/2023 6:30,2001-09-22_Male_India,2,Other,7,72,837,21,1,Churned
6/1/2023 13:49,00000000-0GRA-BD28-CXVV-EYEX21,Health Care Management,Internship,,8/19/2000,Male,India,Vignan's lara institute of technology and science,Civil Engineering,3/11/2024 12:02,Team Allocated,1070,8/13/2023 22:02,1/8/2024 3:30,2000-08-19_Male_India,2,Engineering,73,147,,22,1,Churned
6/1/2023 13:35,00000000-0GRA-BD28-CXVV-EYEX21,Health Care Management,Internship,,7/11/2002,Female,India,RVR&jc,Computer Science,3/11/2024 12:02,Team Allocated,1070,10/2/2023 22:45,1/8/2024 3:30,2002-07-11_Female_India,2,CS / IT,123,97,,20,1,Churned
6/1/2023 13:22,00000000-106T-FSAJ-KDBX-40ZGNV,UrbanRenew Challenge,Competition,4/29/2024 18:29,11/30/2000,Male,India,Saint Louis University,Artificial Intelligence,3/11/2024 12:03,Team Allocated,1070,2/16/2024 16:32,3/21/2024 18:30,2000-11-30_Male_India,2,Other,260,34,38,22,1,Churned
6/1/2023 13:22,00000000-10QW-PYTT-CJCX-7VQBTT,Join a Student Organisation,Engagement,12/5/2025 12:59,11/30/2000,Male,India,Saint Louis University,Artificial Intelligence,3/11/2024 12:02,Team Allocated,1070,6/15/2023 7:42,8/21/2023 6:30,2000-11-30_Male_India,2,Other,13,66,837,22,1,Churned
5/27/2023 19:22,00000000-0GRA-BD28-CXVV-EYEX21,Health Care Management,Internship,,12/26/2003,Female,United Kingdom,University of Chester,Biological Sciences,3/11/2024 12:02,Team Allocated,1070,12/7/2023 23:01,1/8/2024 3:30,2003-12-26_Female_United Kingdom,2,Other,194,31,,19,1,Churned
5/27/2023 18:15,00000000-0GWQ-AXC5-X45C-2MHJ28,Data Visualization,Internship,3/11/2024 18:00,2/23/2001,Male,India,Sri venkateswara college of engineering,Information Systems,3/11/2024 12:02,Team Allocated,1070,10/17/2023 20:50,1/8/2024 3:30,2001-02-23_Male_India,2,Other,143,82,63,22,1,Churned
5/27/2023 10:15,00000000-0GRA-BD28-CXVV-EYEX21,Health Care Management,Internship,,10/7/2000,Female,India,Saint Louis University,Computer Science,3/11/2024 12:02,Team Allocated,1070,7/17/2023 7:42,1/8/2024 3:30,2000-10-07_Female_India,2,CS / IT,50,174,,22,1,Churned
5/14/2023 12:40,00000000-0GZY-NNHV-FJWW-PTA9VX,Innovation & Entrepreneurship,Internship,3/11/2024 18:00,7/18/1999,Female,India,DVR &Dr.HS MIC college of technology,Information technology,3/11/2024 12:02,Team Allocated,1070,8/18/2023 1:18,1/8/2024 3:30,1999-07-18_Female_India,2,Other,95,143,63,23,1,Churned
5/27/2023 8:12,00000000-10RQ-JXA9-NNKD-EW5RCF,UX Redesign Challenge,Competition,4/19/2024 18:29,10/20/2001,Female,India,saint lious University,Computer Science,3/11/2024 12:03,Team Allocated,1070,2/13/2024 18:54,2/15/2024 18:30,2001-10-20_Female_India,2,CS / IT,262,1,63,21,1,Churned
5/27/2023 8:12,00000000-106T-FSAJ-KDBX-40ZGNV,UrbanRenew Challenge,Competition,4/29/2024 18:29,10/20/2001,Female,India,saint lious University,Computer Science,3/11/2024 12:03,Team Allocated,1070,2/13/2024 18:43,3/21/2024 18:30,2001-10-20_Female_India,2,CS / IT,262,36,38,21,1,Churned
5/27/2023 8:12,00000000-0GRA-BD28-CXVV-EYEX21,Health Care Management,Internship,,10/20/2001,Female,India,saint lious University,Computer Science,3/11/2024 12:02,Team Allocated,1070,8/24/2023 4:44,1/8/2024 3:30,2001-10-20_Female_India,2,CS / IT,88,136,,21,1,Churned
5/26/2023 9:20,00000000-10QW-PYTT-CJCX-7VQBTT,Join a Student Organisation,Engagement,12/5/2025 12:59,7/22/2000,Male,United States,Saint louis University,Computer Science,3/11/2024 12:02,Team Allocated,1070,6/9/2023 8:40,8/21/2023 6:30,2000-07-22_Male_United States,2,CS / IT,13,72,837,22,1,Churned
5/22/2023 20:24,00000000-10YM-B80K-RNNJ-YAVQ7V,Upload Your First Year Transcript,Engagement,12/6/2025 10:26,2/6/1968,Male,United States,Creighton University,Other,3/11/2024 12:02,Team Allocated,1070,8/8/2023 13:49,5/31/2024 7:04,1968-02-06_Male_United States,2,Other,77,296,554,55,1,Churned
5/22/2023 20:24,00000000-0GRA-BD28-CXVV-EYEX21,Health Care Management,Internship,,2/6/1968,Male,United States,Creighton University,Other,3/11/2024 12:02,Team Allocated,1070,7/27/2023 15:56,1/8/2024 3:30,1968-02-06_Male_United States,2,Other,65,164,,55,1,Churned
5/19/2023 18:36,00000000-106T-FSAJ-KDBX-40ZGNV,UrbanRenew Challenge,Competition,4/29/2024 18:29,12/17/1998,Female,India,St Louis university,Computer Science and Information Systems,3/11/2024 12:03,Team Allocated,1070,3/4/2024 6:13,3/21/2024 18:30,1998-12-17_Female_India,2,CS / IT,289,17,38,24,1,Churned
5/18/2023 4:32,00000000-0GRA-BD28-CXVV-EYEX21,Health Care Management,Internship,,8/3/1996,Male,India,Saint Louis University,Cyber Security,3/11/2024 12:02,Team Allocated,1070,12/14/2023 4:12,1/8/2024 3:30,1996-08-03_Male_India,2,CS / IT,209,24,,26,1,Churned
5/17/2023 16:15,00000000-10QW-PYTT-CJCX-7VQBTT,Join a Student Organisation,Engagement,12/5/2025 12:59,2/4/2001,Male,India,Saint Louis University,Artificial Intelligence and Machine learning,3/11/2024 12:02,Team Allocated,1070,8/18/2023 19:46,8/21/2023 6:30,2001-02-04_Male_India,2,Other,93,2,837,22,1,Churned
5/16/2023 12:03,00000000-10QW-PYTT-CJCX-7VQBTT,Join a Student Organisation,Engagement,12/5/2025 12:59,5/12/2000,Female,India,Saint Louis University,Computer Science,3/11/2024 12:02,Team Allocated,1070,7/12/2023 14:22,8/21/2023 6:30,2000-05-12_Female_India,2,CS / IT,57,39,837,23,1,Churned
5/14/2023 18:30,00000000-106T-FSAJ-KDBX-40ZGNV,UrbanRenew Challenge,Competition,4/29/2024 18:29,9/10/1998,Female,United States,Saint Louis University,Public Health,3/11/2024 12:03,Team Allocated,1070,1/23/2024 17:46,3/21/2024 18:30,1998-09-10_Female_United States,2,Other,253,58,38,24,1,Churned
5/14/2023 18:30,00000000-10QW-PYTT-CJCX-7VQBTT,Join a Student Organisation,Engagement,12/5/2025 12:59,9/10/1998,Female,United States,Saint Louis University,Public Health,3/11/2024 12:02,Team Allocated,1070,8/11/2023 22:15,8/21/2023 6:30,1998-09-10_Female_United States,2,Other,89,9,837,24,1,Churned
5/12/2023 20:53,00000000-0GRA-BD28-CXVV-EYEX21,Health Care Management,Internship,,12/16/1995,Male,Nigeria,Kano University of Science and Technology  wudil,Education and Training,3/11/2024 12:02,Team Allocated,1070,7/20/2023 7:56,1/8/2024 3:30,1995-12-16_Male_Nigeria,2,Other,68,171,,27,1,Churned
4/30/2023 16:04,00000000-10QW-PYTT-CJCX-7VQBTT,Join a Student Organisation,Engagement,12/5/2025 12:59,9/26/2000,Male,India,Vishnu Institute of Technology,Computer Science and Information Systems,3/11/2024 12:02,Team Allocated,1070,8/19/2023 2:52,8/21/2023 6:30,2000-09-26_Male_India,2,CS / IT,110,2,837,22,1,Churned
5/12/2023 16:21,00000000-0GRA-BD28-CXVV-EYEX21,Health Care Management,Internship,,11/4/1999,Female,United States,saint louis university,Data Analytics,3/11/2024 12:02,Team Allocated,1070,12/14/2023 21:54,1/8/2024 3:30,1999-11-04_Female_United States,2,Other,216,24,,23,1,Churned
5/10/2023 13:48,00000000-106T-FSAJ-KDBX-40ZGNV,UrbanRenew Challenge,Competition,4/29/2024 18:29,9/10/2006,Male,Ukraine,Lyceum of social and natural profile No. 303,Mechanical and Aerospace Engineering,3/11/2024 12:03,Team Allocated,1070,2/16/2024 16:56,3/21/2024 18:30,2006-09-10_Male_Ukraine,2,Engineering,282,34,38,16,1,Churned
5/7/2023 3:43,00000000-10QW-PYTT-CJCX-7VQBTT,Join a Student Organisation,Engagement,12/5/2025 12:59,3/28/2002,Male,India,saint louis university,Information Systems,3/11/2024 12:02,Team Allocated,1070,,8/21/2023 6:30,2002-03-28_Male_India,2,Other,,,837,21,1,Churned
5/4/2023 15:27,00000000-10QW-PYTT-CJCX-7VQBTT,Join a Student Organisation,Engagement,12/5/2025 12:59,12/10/2001,Male,India,Saint louis university,Artificial Intelligence,3/11/2024 12:02,Team Allocated,1070,8/16/2023 21:02,8/21/2023 6:30,2001-12-10_Male_India,2,Other,104,4,837,21,1,Churned
5/3/2023 10:49,00000000-100J-PM3A-0WJ8-5T68M5,Jump Start: Developing your Emotional Intelligence,Course,12/24/2025 3:34,5/25/2001,Female,India,Saint louis University,Information Systems,3/11/2024 12:03,Team Allocated,1070,1/26/2024 1:05,1/28/2024 23:30,2001-05-25_Female_India,2,Other,267,2,695,21,1,Churned
5/3/2023 10:49,00000000-10A5-TYD2-181G-D2J679,Xperience Design Hackathon,Competition,3/13/2024 18:29,5/25/2001,Female,India,Saint louis University,Information Systems,3/11/2024 12:03,Team Allocated,1070,1/26/2024 1:01,1/28/2024 18:30,2001-05-25_Female_India,2,Other,267,2,44,21,1,Churned
5/3/2023 10:49,00000000-10RQ-JXA9-NNKD-EW5RCF,UX Redesign Challenge,Competition,4/19/2024 18:29,5/25/2001,Female,India,Saint louis University,Information Systems,3/11/2024 12:03,Team Allocated,1070,1/23/2024 21:07,2/15/2024 18:30,2001-05-25_Female_India,2,Other,265,22,63,21,1,Churned
5/3/2023 10:49,00000000-106T-FSAJ-KDBX-40ZGNV,UrbanRenew Challenge,Competition,4/29/2024 18:29,5/25/2001,Female,India,Saint louis University,Information Systems,3/11/2024 12:03,Team Allocated,1070,1/23/2024 21:07,3/21/2024 18:30,2001-05-25_Female_India,2,Other,265,57,38,21,1,Churned
5/3/2023 10:49,00000000-0GRA-BD28-CXVV-EYEX21,Health Care Management,Internship,,5/25/2001,Female,India,Saint louis University,Information Systems,3/11/2024 12:02,Team Allocated,1070,12/20/2023 15:20,1/8/2024 3:30,2001-05-25_Female_India,2,Other,231,18,,21,1,Churned
5/2/2023 13:46,00000000-10QW-PYTT-CJCX-7VQBTT,Join a Student Organisation,Engagement,12/5/2025 12:59,11/6/2000,Male,India,Vishnu Institute of Technology,Information Systems,3/11/2024 12:02,Team Allocated,1070,8/19/2023 3:20,8/21/2023 6:30,2000-11-06_Male_India,2,Other,108,2,837,22,1,Churned
5/2/2023 5:12,00000000-0GZY-NNHV-FJWW-PTA9VX,Innovation & Entrepreneurship,Internship,3/11/2024 18:00,8/17/2000,Female,India,Saint Louis university,Computer Science,3/11/2024 12:02,Team Allocated,1070,9/19/2023 18:41,1/8/2024 3:30,2000-08-17_Female_India,2,CS / IT,140,110,63,22,1,Churned
5/1/2023 17:42,00000000-106T-FSAJ-KDBX-40ZGNV,UrbanRenew Challenge,Competition,4/29/2024 18:29,9/10/1999,Male,India,Savitribai Phule Pune University,Construction Engineering and Management,3/11/2024 12:03,Team Allocated,1070,3/5/2024 5:30,3/21/2024 18:30,1999-09-10_Male_India,2,Engineering,308,16,38,23,1,Churned
4/30/2023 15:19,00000000-10QW-PYTT-CJCX-7VQBTT,Join a Student Organisation,Engagement,12/5/2025 12:59,12/1/1999,Male,India,Vishnu Institute of Technology,Information Systems,3/11/2024 12:02,Team Allocated,1070,8/5/2023 15:55,8/21/2023 6:30,1999-12-01_Male_India,2,Other,97,15,837,23,1,Churned
4/28/2023 14:42,00000000-10QW-PYTT-CJCX-7VQBTT,Join a Student Organisation,Engagement,12/5/2025 12:59,8/25/1988,Female,United States,Asifia college of engineering and technology,Computer Science,3/11/2024 12:02,Team Allocated,1070,,8/21/2023 6:30,1988-08-25_Female_United States,2,CS / IT,,,837,34,1,Churned
4/28/2023 7:06,00000000-10QW-PYTT-CJCX-7VQBTT,Join a Student Organisation,Engagement,12/5/2025 12:59,12/3/2001,Male,India,Saint Louis University,Computer Science,3/11/2024 12:02,Team Allocated,1070,,8/21/2023 6:30,2001-12-03_Male_India,2,CS / IT,,,837,21,1,Churned
4/24/2023 9:05,00000000-0GHB-4N83-QX9K-JM48K2,Project Management,Internship,3/11/2024 18:00,7/27/1995,Male,Ghana,Kwame Nkrumah University of Science and Technology,Social Policy and Administration,3/11/2024 12:02,Team Allocated,1070,8/16/2023 18:34,1/8/2024 3:30,1995-07-27_Male_Ghana,2,Other,114,144,63,27,1,Churned
4/26/2023 17:24,00000000-10QW-PYTT-CJCX-7VQBTT,Join a Student Organisation,Engagement,12/5/2025 12:59,7/31/2001,Male,India,Osmania University,Computer Science,3/11/2024 12:02,Team Allocated,1070,,8/21/2023 6:30,2001-07-31_Male_India,2,CS / IT,,,837,21,1,Churned
4/26/2023 15:20,00000000-106T-FSAJ-KDBX-40ZGNV,UrbanRenew Challenge,Competition,4/29/2024 18:29,5/15/2001,Female,United States,Saint Louis University,Information Systems,3/11/2024 12:03,Team Allocated,1070,2/8/2024 15:00,3/21/2024 18:30,2001-05-15_Female_United States,2,Other,287,42,38,21,1,Churned
4/26/2023 6:41,00000000-0GRA-BD28-CXVV-EYEX21,Health Care Management,Internship,,7/26/1999,Male,India,saint Louis university,Information Systems,3/11/2024 12:02,Team Allocated,1070,10/5/2023 5:22,1/8/2024 3:30,1999-07-26_Male_India,2,Other,161,94,,23,1,Churned
4/25/2023 18:32,00000000-0GRA-BD28-CXVV-EYEX21,Health Care Management,Internship,,12/9/2002,Female,India,SAINT LOUIS UNIVERSITY,Business Analytics,3/11/2024 12:02,Team Allocated,1070,8/22/2023 22:45,1/8/2024 3:30,2002-12-09_Female_India,2,Business,119,138,,20,1,Churned
4/25/2023 14:26,00000000-0GN2-A0AY-7XK8-C5FZPP,Career Essentials: Getting Started with Your Professional Journey,Course,6/29/2024 18:52,4/29/2002,Male,United States,Saint Louis University,Information Systems,3/11/2024 12:01,Team Allocated,1070,,11/3/2022 18:30,2002-04-29_Male_United States,2,Other,,,604,21,1,Churned
4/25/2023 9:37,00000000-10RQ-JXA9-NNKD-EW5RCF,UX Redesign Challenge,Competition,4/19/2024 18:29,12/8/2001,Female,India,vignan nirula institute of technology,Computer Science,3/11/2024 12:03,Team Allocated,1070,1/29/2024 3:43,2/15/2024 18:30,2001-12-08_Female_India,2,CS / IT,278,17,63,21,1,Churned
4/25/2023 9:37,00000000-106T-FSAJ-KDBX-40ZGNV,UrbanRenew Challenge,Competition,4/29/2024 18:29,12/8/2001,Female,India,vignan nirula institute of technology,Computer Science,3/11/2024 12:03,Team Allocated,1070,1/29/2024 3:44,3/21/2024 18:30,2001-12-08_Female_India,2,CS / IT,278,52,38,21,1,Churned
4/25/2023 9:37,00000000-0GRA-BD28-CXVV-EYEX21,Health Care Management,Internship,,12/8/2001,Female,India,vignan nirula institute of technology,Computer Science,3/11/2024 12:02,Team Allocated,1070,8/17/2023 5:20,1/8/2024 3:30,2001-12-08_Female_India,2,CS / IT,113,143,,21,1,Churned
4/25/2023 9:13,00000000-10RQ-JXA9-NNKD-EW5RCF,UX Redesign Challenge,Competition,4/19/2024 18:29,8/22/2001,Male,India,saint louis university,Information Systems,3/11/2024 12:03,Team Allocated,1070,1/29/2024 3:39,2/15/2024 18:30,2001-08-22_Male_India,2,Other,278,17,63,21,1,Churned
4/25/2023 9:13,00000000-106T-FSAJ-KDBX-40ZGNV,UrbanRenew Challenge,Competition,4/29/2024 18:29,8/22/2001,Male,India,saint louis university,Information Systems,3/11/2024 12:03,Team Allocated,1070,1/29/2024 3:39,3/21/2024 18:30,2001-08-22_Male_India,2,Other,278,52,38,21,1,Churned
4/25/2023 9:13,00000000-10YM-B80K-RNNJ-YAVQ7V,Upload Your First Year Transcript,Engagement,12/6/2025 10:26,8/22/2001,Male,India,saint louis university,Information Systems,3/11/2024 12:02,Team Allocated,1070,3/2/2024 22:30,5/31/2024 7:04,2001-08-22_Male_India,2,Other,312,89,554,21,1,Churned
4/25/2023 6:41,00000000-0GRA-BD28-CXVV-EYEX21,Health Care Management,Internship,,7/6/2001,Male,India,Vardhaman college of engineering,Electronics and Communication,3/11/2024 12:02,Team Allocated,1070,8/22/2023 2:59,1/8/2024 3:30,2001-07-06_Male_India,2,Other,118,139,,21,1,Churned
4/17/2023 3:09,00000000-106T-FSAJ-KDBX-40ZGNV,UrbanRenew Challenge,Competition,4/29/2024 18:29,7/12/2001,Male,United States,saint louis university,Computer Science,3/11/2024 12:03,Team Allocated,1070,1/28/2024 16:47,3/21/2024 18:30,2001-07-12_Male_United States,2,CS / IT,286,53,38,21,1,Churned
4/27/2023 4:55,00000000-0GRA-BD28-CXVV-EYEX21,Health Care Management,Internship,,4/8/2000,Male,United States,Saint Louis University,Computer Science and Information Systems,3/11/2024 12:02,Team Allocated,1070,12/3/2023 2:35,1/8/2024 3:30,2000-04-08_Male_United States,2,CS / IT,219,36,,23,1,Churned
4/24/2023 8:07,00000000-10QW-PYTT-CJCX-7VQBTT,Join a Student Organisation,Engagement,12/5/2025 12:59,3/22/1998,Male,India,Saint louis university,Computer Science,3/11/2024 12:02,Team Allocated,1070,6/13/2023 13:18,8/21/2023 6:30,1998-03-22_Male_India,2,CS / IT,50,68,837,25,1,Churned
4/24/2023 7:24,00000000-0GRA-BD28-CXVV-EYEX21,Health Care Management,Internship,,3/22/2000,Female,United States,Saint Louis University,Computer Science,3/11/2024 12:02,Team Allocated,1070,12/19/2023 4:05,1/8/2024 3:30,2000-03-22_Female_United States,2,CS / IT,238,19,,23,1,Churned
4/24/2023 6:52,00000000-106T-FSAJ-KDBX-40ZGNV,UrbanRenew Challenge,Competition,4/29/2024 18:29,2/14/2002,Male,India,Badruka college of commerce and Arts,Business Administration,3/11/2024 12:03,Team Allocated,1070,2/16/2024 6:57,3/21/2024 18:30,2002-02-14_Male_India,2,Business,298,34,38,21,1,Churned
4/24/2023 6:52,00000000-0GRA-BD28-CXVV-EYEX21,Health Care Management,Internship,,2/14/2002,Male,India,Badruka college of commerce and Arts,Business Administration,3/11/2024 12:02,Team Allocated,1070,9/12/2023 2:39,1/8/2024 3:30,2002-02-14_Male_India,2,Business,140,118,,21,1,Churned
4/23/2023 3:29,00000000-10QW-PYTT-CJCX-7VQBTT,Join a Student Organisation,Engagement,12/5/2025 12:59,9/24/2001,Male,United States,Saint Louis University,Information Systems,3/11/2024 12:02,Team Allocated,1070,6/13/2023 13:20,8/21/2023 6:30,2001-09-24_Male_United States,2,Other,51,68,837,21,1,Churned
4/22/2023 10:22,00000000-0GHB-4N83-QX9K-JM48K2,Project Management,Internship,3/11/2024 18:00,1/10/2005,Female,India,HSC,Other,3/11/2024 12:02,Team Allocated,1070,11/24/2023 14:35,1/8/2024 3:30,2005-01-10_Female_India,2,Other,216,44,63,18,1,Churned
4/22/2023 5:21,00000000-10RQ-JXA9-NNKD-EW5RCF,UX Redesign Challenge,Competition,4/19/2024 18:29,1/1/2001,Male,United States,saint louis university,Information Systems,3/11/2024 12:03,Team Allocated,1070,2/3/2024 4:17,2/15/2024 18:30,2001-01-01_Male_United States,2,Other,286,12,63,22,1,Churned
4/22/2023 5:21,00000000-106T-FSAJ-KDBX-40ZGNV,UrbanRenew Challenge,Competition,4/29/2024 18:29,1/1/2001,Male,United States,saint louis university,Information Systems,3/11/2024 12:03,Team Allocated,1070,2/3/2024 4:19,3/21/2024 18:30,2001-01-01_Male_United States,2,Other,286,47,38,22,1,Churned
4/17/2023 15:00,00000000-106T-FSAJ-KDBX-40ZGNV,UrbanRenew Challenge,Competition,4/29/2024 18:29,5/25/1999,Female,India,Saint Louis University,Computer Science,3/11/2024 12:03,Team Allocated,1070,2/16/2024 14:54,3/21/2024 18:30,1999-05-25_Female_India,2,CS / IT,304,34,38,23,1,Churned
4/17/2023 3:09,00000000-100J-PM3A-0WJ8-5T68M5,Jump Start: Developing your Emotional Intelligence,Course,12/24/2025 3:34,7/12/2001,Male,United States,saint louis university,Computer Science,3/11/2024 12:03,Team Allocated,1070,1/28/2024 16:49,1/28/2024 23:30,2001-07-12_Male_United States,2,CS / IT,286,0,695,21,1,Churned
4/17/2023 3:09,00000000-10A5-TYD2-181G-D2J679,Xperience Design Hackathon,Competition,3/13/2024 18:29,7/12/2001,Male,United States,saint louis university,Computer Science,3/11/2024 12:03,Team Allocated,1070,1/28/2024 16:46,1/28/2024 18:30,2001-07-12_Male_United States,2,CS / IT,286,0,44,21,1,Churned
4/17/2023 3:09,00000000-10RQ-JXA9-NNKD-EW5RCF,UX Redesign Challenge,Competition,4/19/2024 18:29,7/12/2001,Male,United States,saint louis university,Computer Science,3/11/2024 12:03,Team Allocated,1070,1/28/2024 16:46,2/15/2024 18:30,2001-07-12_Male_United States,2,CS / IT,286,18,63,21,1,Churned
4/25/2023 6:40,00000000-10QW-PYTT-CJCX-7VQBTT,Join a Student Organisation,Engagement,12/5/2025 12:59,5/12/1999,Male,India,SAINT LOUIS UNIVERSITY,Information Systems,3/11/2024 12:02,Team Allocated,1070,6/24/2023 15:27,8/21/2023 6:30,1999-05-12_Male_India,2,Other,60,57,837,23,1,Churned
4/13/2023 17:09,00000000-10RQ-JXA9-NNKD-EW5RCF,UX Redesign Challenge,Competition,4/19/2024 18:29,11/27/2001,Male,India,Saint Louis University,Computer Science,3/11/2024 12:03,Team Allocated,1070,2/6/2024 7:35,2/15/2024 18:30,2001-11-27_Male_India,2,CS / IT,298,9,63,21,1,Churned
2/24/2023 3:54,00000000-10QW-PYTT-CJCX-7VQBTT,Join a Student Organisation,Engagement,12/5/2025 12:59,4/22/2001,Male,India,Saint Louis University,Information Systems,3/11/2024 12:02,Team Allocated,1070,8/5/2023 15:50,8/21/2023 6:30,2001-04-22_Male_India,2,Other,162,15,837,21,1,Churned
2/24/2023 2:06,00000000-10QW-PYTT-CJCX-7VQBTT,Join a Student Organisation,Engagement,12/5/2025 12:59,6/9/2000,Male,India,SASTRA University,Information Systems,3/11/2024 12:02,Team Allocated,1070,8/5/2023 15:52,8/21/2023 6:30,2000-06-09_Male_India,2,Other,162,15,837,22,1,Churned
4/10/2023 22:19,00000000-10RQ-JXA9-NNKD-EW5RCF,UX Redesign Challenge,Competition,4/19/2024 18:29,6/8/1992,Female,United States,JNTUH,Information Systems,3/11/2024 12:03,Team Allocated,1070,1/24/2024 17:52,2/15/2024 18:30,1992-06-08_Female_United States,2,Other,288,22,63,30,1,Churned
4/10/2023 22:19,00000000-106T-FSAJ-KDBX-40ZGNV,UrbanRenew Challenge,Competition,4/29/2024 18:29,6/8/1992,Female,United States,JNTUH,Information Systems,3/11/2024 12:03,Team Allocated,1070,1/24/2024 17:53,3/21/2024 18:30,1992-06-08_Female_United States,2,Other,288,57,38,30,1,Churned
4/10/2023 19:51,00000000-0GRA-BD28-CXVV-EYEX21,Health Care Management,Internship,,3/14/2000,Male,United States,Saint Louis University,Computer Science,3/11/2024 12:02,Team Allocated,1070,8/10/2023 18:26,1/8/2024 3:30,2000-03-14_Male_United States,2,CS / IT,121,150,,23,1,Churned
3/27/2023 12:45,00000000-106T-FSAJ-KDBX-40ZGNV,UrbanRenew Challenge,Competition,4/29/2024 18:29,4/4/2002,Male,Pakistan,wah engineering college,Mechatronics Engineering,3/11/2024 12:03,Team Allocated,1070,2/16/2024 16:19,3/21/2024 18:30,2002-04-04_Male_Pakistan,2,Engineering,326,34,38,20,1,Churned
3/21/2023 7:56,00000000-10QW-PYTT-CJCX-7VQBTT,Join a Student Organisation,Engagement,12/5/2025 12:59,11/17/1999,Female,United States,Mahatma Gandhi University,Information Systems,3/11/2024 12:02,Team Allocated,1070,,8/21/2023 6:30,1999-11-17_Female_United States,2,Other,,,837,23,1,Churned
3/12/2023 15:59,00000000-10QW-PYTT-CJCX-7VQBTT,Join a Student Organisation,Engagement,12/5/2025 12:59,3/9/2010,Female,India,Ashoka,Psychology,3/11/2024 12:02,Team Allocated,1070,8/5/2023 17:58,8/21/2023 6:30,2010-03-09_Female_India,2,Other,146,15,837,13,1,Churned
3/12/2023 15:59,00000000-0GHB-4N83-QX9K-JM48K2,Project Management,Internship,3/11/2024 18:00,3/9/2010,Female,India,Ashoka,Psychology,3/11/2024 12:02,Team Allocated,1070,8/18/2023 15:04,1/8/2024 3:30,2010-03-09_Female_India,2,Other,158,142,63,13,1,Churned
3/8/2023 6:56,00000000-0GHB-4N83-QX9K-JM48K2,Project Management,Internship,3/11/2024 18:00,10/9/1995,Male,India,jntuk,Information Systems,3/11/2024 12:02,Team Allocated,1070,9/11/2023 16:05,1/8/2024 3:30,1995-10-09_Male_India,2,Other,187,118,63,27,1,Churned
3/6/2023 18:59,00000000-0GWQ-AXC5-X45C-2MHJ28,Data Visualization,Internship,3/11/2024 18:00,4/19/2005,Female,United States,Hazelwood West High School,Nursing,3/11/2024 12:02,Team Allocated,1070,6/13/2023 15:07,1/8/2024 3:30,2005-04-19_Female_United States,2,Other,98,208,63,17,1,Churned
3/4/2023 22:57,00000000-0GRA-BD28-CXVV-EYEX21,Health Care Management,Internship,,11/11/1996,Male,Nigeria,OAUTHC,Nursing,3/11/2024 12:02,Team Allocated,1070,8/16/2023 11:27,1/8/2024 3:30,1996-11-11_Male_Nigeria,2,Other,164,144,,26,1,Churned
3/4/2023 22:57,00000000-0GNT-FT74-MZT8-93VC0G,Digital Marketing,Internship,3/11/2024 18:00,11/11/1996,Male,Nigeria,OAUTHC,Nursing,3/11/2024 12:02,Team Allocated,1070,12/4/2023 6:52,1/8/2024 3:30,1996-11-11_Male_Nigeria,2,Other,274,34,63,26,1,Churned
2/24/2023 8:14,00000000-0GRA-BD28-CXVV-EYEX21,Health Care Management,Internship,,11/17/1997,Male,India,Aliah University,Cyber Security,3/11/2024 12:02,Team Allocated,1070,12/1/2023 15:20,1/8/2024 3:30,1997-11-17_Male_India,2,CS / IT,280,37,,25,1,Churned
4/13/2023 17:09,00000000-106T-FSAJ-KDBX-40ZGNV,UrbanRenew Challenge,Competition,4/29/2024 18:29,11/27/2001,Male,India,Saint Louis University,Computer Science,3/11/2024 12:03,Team Allocated,1070,2/6/2024 7:36,3/21/2024 18:30,2001-11-27_Male_India,2,CS / IT,298,44,38,21,1,Churned
4/11/2023 7:13,00000000-0GWQ-AXC5-X45C-2MHJ28,Data Visualization,Internship,3/11/2024 18:00,11/30/2007,Female,India,Kuriakose Elias English Medium School,Other,3/11/2024 12:02,Team Allocated,1070,8/2/2023 13:00,1/8/2024 3:30,2007-11-30_Female_India,2,Other,113,158,63,15,1,Churned
2/23/2023 15:30,00000000-10RQ-JXA9-NNKD-EW5RCF,UX Redesign Challenge,Competition,4/19/2024 18:29,3/11/2000,Male,India,Gitam University,Computer Science and Information Systems,3/11/2024 12:03,Team Allocated,1070,2/11/2024 6:00,2/15/2024 18:30,2000-03-11_Male_India,2,CS / IT,352,4,63,22,1,Churned
2/23/2023 14:12,00000000-0GNT-FT74-MZT8-93VC0G,Digital Marketing,Internship,3/11/2024 18:00,12/8/1997,Male,India,Saint Louis University,Software Engineering,3/11/2024 12:01,Team Allocated,1070,12/4/2023 20:12,1/8/2024 3:30,1997-12-08_Male_India,2,CS / IT,284,34,63,25,1,Churned
2/16/2023 20:19,00000000-0GWQ-AXC5-X45C-2MHJ28,Data Visualization,Internship,3/11/2024 18:00,8/18/2006,Female,Peru,Colegio Peruano Norteamericano Abraham Lincoln,Aerospace Engineering,3/11/2024 12:02,Team Allocated,1070,8/15/2023 3:46,1/8/2024 3:30,2006-08-18_Female_Peru,2,Engineering,179,145,63,16,1,Churned
2/12/2023 21:06,00000000-0GN2-A0AY-7XK8-C5FZPP,Career Essentials: Getting Started with Your Professional Journey,Course,6/29/2024 18:52,7/2/1993,Female,United States,Saint Louis University,Public Health,3/11/2024 12:01,Team Allocated,1070,,11/3/2022 18:30,1993-07-02_Female_United States,2,Other,,,604,29,1,Churned
1/11/2023 16:17,00000000-0GWQ-AXC5-X45C-2MHJ28,Data Visualization,Internship,3/11/2024 18:00,3/31/2006,Male,United States,Dripping Springs High School,Computer Science,3/11/2024 12:02,Team Allocated,1070,11/20/2023 5:02,1/8/2024 3:30,2006-03-31_Male_United States,2,CS / IT,312,48,63,16,1,Churned
1/7/2023 9:23,00000000-10A5-TYD2-181G-D2J679,Xperience Design Hackathon,Competition,3/13/2024 18:29,5/17/2002,Male,India,Vardhaman College of Engineering,Information technology,3/11/2024 12:03,Team Allocated,1070,1/27/2024 3:18,1/28/2024 18:30,2002-05-17_Male_India,2,Other,384,1,44,20,1,Churned
1/5/2023 16:33,00000000-0GRA-BD28-CXVV-EYEX21,Health Care Management,Internship,,8/15/1998,Male,United States,Saint Louis University,Information Systems,3/11/2024 12:02,Team Allocated,1070,8/20/2023 15:53,1/8/2024 3:30,1998-08-15_Male_United States,2,Other,226,140,,24,1,Churned
1/5/2023 16:33,00000000-106T-FSAJ-KDBX-40ZGNV,UrbanRenew Challenge,Competition,4/29/2024 18:29,8/3/2000,Male,India,Saint Louis University,Computer Science and Information Systems,3/11/2024 12:03,Team Allocated,1070,2/13/2024 22:16,3/21/2024 18:30,2000-08-03_Male_India,2,CS / IT,404,36,38,22,1,Churned
1/5/2023 16:33,00000000-106T-FSAJ-KDBX-40ZGNV,UrbanRenew Challenge,Competition,4/29/2024 18:29,11/4/2000,Female,India,MVSR ENGINEERING COLLEGE,Eee,3/11/2024 12:03,Team Allocated,1070,2/23/2024 5:38,3/21/2024 18:30,2000-11-04_Female_India,2,Other,413,27,38,22,1,Churned
1/5/2023 16:33,00000000-10YM-B80K-RNNJ-YAVQ7V,Upload Your First Year Transcript,Engagement,12/6/2025 10:26,12/2/1998,Male,United States,Saint Louis University,Software Engineering,3/11/2024 12:02,Team Allocated,1070,9/16/2023 18:36,5/31/2024 7:04,1998-12-02_Male_United States,2,CS / IT,254,257,554,24,1,Churned
1/5/2023 16:33,00000000-0GRA-BD28-CXVV-EYEX21,Health Care Management,Internship,,1/4/1999,Male,United States,Geethanjali collage of engineering and technology,Mechanical Engineering,3/11/2024 12:02,Team Allocated,1070,8/30/2023 18:46,1/8/2024 3:30,1999-01-04_Male_United States,2,Engineering,237,130,,24,1,Churned
1/5/2023 16:32,00000000-0GZY-NNHV-FJWW-PTA9VX,Innovation & Entrepreneurship,Internship,3/11/2024 18:00,1/24/2004,Male,Bangladesh,Dinajpur Government College,Software Engineering,3/11/2024 12:02,Team Allocated,1070,12/2/2023 5:15,1/8/2024 3:30,2004-01-24_Male_Bangladesh,2,CS / IT,330,36,63,18,1,Churned
1/5/2023 16:32,00000000-0GNT-FT74-MZT8-93VC0G,Digital Marketing,Internship,3/11/2024 18:00,1/24/2004,Male,Bangladesh,Dinajpur Government College,Software Engineering,3/11/2024 12:01,Team Allocated,1070,12/2/2023 5:11,1/8/2024 3:30,2004-01-24_Male_Bangladesh,2,CS / IT,330,36,63,18,1,Churned
